link,category,title,abstract,keywords,ccs_concepts,author_names,author_affiliations,author_countries
https://arxiv.org/abs/2203.04286,Transparency & Explainability,Proximal PanNet: A Model-Based Deep Network for Pansharpening.,"Recently, deep learning techniques have been extensively studied for pansharpening, which aims to generate a high resolution multispectral (HRMS) image by fusing a low resolution multispectral (LRMS) image with a high resolution panchromatic (PAN) image. However, existing deep learning-based pansharpening methods directly learn the mapping from LRMS and PAN to HRMS. These network architectures always lack sufficient interpretability, which limits further performance improvements. To alleviate this issue, we propose a novel deep network for pansharpening by combining the model-based methodology with the deep learning method. Firstly, we build an observation model for pansharpening using the convolutional sparse coding (CSC) technique and design a proximal gradient algorithm to solve this model. Secondly, we unfold the iterative algorithm into a deep network, dubbed as Proximal PanNet, by learning the proximal operators using convolutional neural networks. Finally, all the learnable modules can be automatically learned in an end-to-end manner. Experimental results on some benchmark datasets show that our network performs better than other advanced methods both quantitatively and qualitatively.",[],[],"['Xiangyong Cao', 'Yang Chen', 'Wenfei Cao']",[],[]
https://arxiv.org/abs/2110.15629,Transparency & Explainability,Attacking Video Recognition Models with Bullet-Screen Comments.,"Recent research has demonstrated that Deep Neural Networks (DNNs) are vulnerable to adversarial patches which introduce perceptible but localized changes to the input. Nevertheless, existing approaches have focused on generating adversarial patches on images, their counterparts in videos have been less explored. Compared with images, attacking videos is much more challenging as it needs to consider not only spatial cues but also temporal cues. To close this gap, we introduce a novel adversarial attack in this paper, the bullet-screen comment (BSC) attack, which attacks video recognition models with BSCs. Specifically, adversarial BSCs are generated with a Reinforcement Learning (RL) framework, where the environment is set as the target model and the agent plays the role of selecting the position and transparency of each BSC. By continuously querying the target models and receiving feedback, the agent gradually adjusts its selection strategies in order to achieve a high fooling rate with non-overlapping BSCs. As BSCs can be regarded as a kind of meaningful patch, adding it to a clean video will not affect people' s understanding of the video content, nor will arouse people' s suspicion. We conduct extensive experiments to verify the effectiveness of the proposed method. On both UCF-101 and HMDB-51 datasets, our BSC attack method can achieve about 90\% fooling rate when attacking three mainstream video recognition models, while only occluding \textless 8\% areas in the video. Our code is available at this https URL.",[],[],"['Kai Chen', 'Zhipeng Wei', 'Jingjing Chen', 'Zuxuan Wu', 'Yu-Gang Jiang']",[],[]
https://arxiv.org/abs/2201.03210,Transparency & Explainability,Model-Based Image Signal Processors via Learnable Dictionaries.,"Digital cameras transform sensor RAW readings into RGB images by means of their Image Signal Processor (ISP). Computational photography tasks such as image denoising and colour constancy are commonly performed in the RAW domain, in part due to the inherent hardware design, but also due to the appealing simplicity of noise statistics that result from the direct sensor readings. Despite this, the availability of RAW images is limited in comparison with the abundance and diversity of available RGB data. Recent approaches have attempted to bridge this gap by estimating the RGB to RAW mapping: handcrafted model-based methods that are interpretable and controllable usually require manual parameter fine-tuning, while end-to-end learnable neural networks require large amounts of training data, at times with complex training procedures, and generally lack interpretability and parametric control. Towards addressing these existing limitations, we present a novel hybrid model-based and data-driven ISP that builds on canonical ISP operations and is both learnable and interpretable. Our proposed invertible model, capable of bidirectional mapping between RAW and RGB domains, employs end-to-end learning of rich parameter representations, i.e. dictionaries, that are free from direct parametric supervision and additionally enable simple and plausible data augmentation. We evidence the value of our data generation process by extensive experiments under both RAW image reconstruction and RAW image denoising tasks, obtaining state-of-the-art performance in both. Additionally, we show that our ISP can learn meaningful mappings from few data samples, and that denoising models trained with our dictionary-based data augmentation are competitive despite having only few or zero ground-truth labels.",[],[],"['Marcos V. Conde', 'Steven McDonagh', 'Matteo Maggioni', 'Aleš Leonardis', 'Eduardo Pérez-Pellitero']",[],[]
https://arxiv.org/abs/2011.10698,Transparency & Explainability,Backdoor Attacks on the DNN Interpretation System.,"Interpretability is crucial to understand the inner workings of deep neural networks (DNNs) and many interpretation methods generate saliency maps that highlight parts of the input image that contribute the most to the prediction made by the DNN. In this paper we design a backdoor attack that alters the saliency map produced by the network for an input image only with injected trigger that is invisible to the naked eye while maintaining the prediction accuracy. The attack relies on injecting poisoned data with a trigger into the training data set. The saliency maps are incorporated in the penalty term of the objective function that is used to train a deep model and its influence on model training is conditioned upon the presence of a trigger. We design two types of attacks: targeted attack that enforces a specific modification of the saliency map and untargeted attack when the importance scores of the top pixels from the original saliency map are significantly reduced. We perform empirical evaluation of the proposed backdoor attacks on gradient-based and gradient-free interpretation methods for a variety of deep learning architectures. We show that our attacks constitute a serious security threat when deploying deep learning models developed by untrusty sources. Finally, in the Supplement we demonstrate that the proposed methodology can be used in an inverted setting, where the correct saliency map can be obtained only in the presence of a trigger (key), effectively making the interpretation system available only to selected users.",[],[],"['Shihong Fang', 'Anna Choromanska']",[],[]
https://arxiv.org/abs/2112.04895,Transparency & Explainability,Latent Space Explanation by Intervention.,"The success of deep neural nets heavily relies on their ability to encode complex relations between their input and their output. While this property serves to fit the training data well, it also obscures the mechanism that drives prediction. This study aims to reveal hidden concepts by employing an intervention mechanism that shifts the predicted class based on discrete variational autoencoders. An explanatory model then visualizes the encoded information from any hidden layer and its corresponding intervened representation. By the assessment of differences between the original representation and the intervened representation, one can determine the concepts that can alter the class, hence providing interpretability. We demonstrate the effectiveness of our approach on CelebA, where we show various visualizations for bias in the data and suggest different interventions to reveal and change bias.",[],[],"['Itai Gat', 'Guy Lorberbom', 'Idan Schwartz', 'Tamir Hazan']",[],[]
https://arxiv.org/abs/2312.16012,Transparency & Explainability,Learning the Dynamics of Visual Relational Reasoning via Reinforced Path Routing.,"Recently, neural module networks (NMNs) have yielded ongoing success in answering compositional visual questions, especially those involving multi-hop visual and logical reasoning. NMNs decompose the complex question into several sub-tasks using instance-modules from the reasoning paths of that question and then exploit intermediate supervisions to guide answer prediction, thereby improving inference interpretability. However, their performance may be hindered due to sketchy modeling of intermediate supervisions. For instance, (1) a prior assumption that each instance-module refers to only one grounded object yet overlooks other potentially associated grounded objects, impeding full cross-modal alignment learning; (2) IoU-based intermediate supervisions may introduce noise signals as the bounding box overlap issue might guide the model's focus towards irrelevant objects. To address these issues, a novel method, \textbf{\underline{D}}etection-based \textbf{\underline{I}}ntermediate \textbf{\underline{S}}upervision (DIS), is proposed, which adopts a generative detection framework to facilitate multiple grounding supervisions via sequence generation. As such, DIS offers more comprehensive and accurate intermediate supervisions, thereby boosting answer prediction performance. Furthermore, by considering intermediate results, DIS enhances the consistency in answering compositional questions and their sub-questions.Extensive experiments demonstrate the superiority of our proposed DIS, showcasing both improved accuracy and state-of-the-art reasoning consistency compared to prior approaches.",[],[],"['Yuhang Liu', 'Daowan Peng', 'Wei Wei', 'Yuanyuan Fu', 'Wenfeng Xie', 'Dangyang Chen']",[],[]
https://arxiv.org/abs/2302.06670,Transparency & Explainability,A Causal Inference Look at Unsupervised Video Anomaly Detection.,"Anomaly detection and localization of visual data, including images and videos, are of great significance in both machine learning academia and applied real-world scenarios. Despite the rapid development of visual anomaly detection techniques in recent years, the interpretations of these black-box models and reasonable explanations of why anomalies can be distinguished out are scarce. This paper provides the first survey concentrated on explainable visual anomaly detection methods. We first introduce the basic background of image-level anomaly detection and video-level anomaly detection, followed by the current explainable approaches for visual anomaly detection. Then, as the main content of this survey, a comprehensive and exhaustive literature review of explainable anomaly detection methods for both images and videos is presented. Finally, we discuss several promising future directions and open problems to explore on the explainability of visual anomaly detection.",[],[],"['Yizhou Wang', 'Dongliang Guo', 'Sheng Li', 'Yun Fu']",[],[]
https://arxiv.org/abs/2308.00508,Transparency & Explainability,Context-Based Contrastive Learning for Scene Text Recognition.,"Context-aware methods achieved great success in supervised scene text recognition via incorporating semantic priors from words. We argue that such prior contextual information can be interpreted as the relations of textual primitives due to the heterogeneous text and background, which can provide effective self-supervised labels for representation learning. However, textual relations are restricted to the finite size of dataset due to lexical dependencies, which causes the problem of over-fitting and compromises representation robustness. To this end, we propose to enrich the textual relations via rearrangement, hierarchy and interaction, and design a unified framework called RCLSTR: Relational Contrastive Learning for Scene Text Recognition. Based on causality, we theoretically explain that three modules suppress the bias caused by the contextual prior and thus guarantee representation robustness. Experiments on representation quality show that our method outperforms state-of-the-art self-supervised STR methods. Code is available at this https URL.",[],[],"['Jinglei Zhang', 'Tiancheng Lin', 'Yi Xu', 'Kai Chen', 'Rui Zhang']",[],[]
https://arxiv.org/abs/2112.11547,Transparency & Explainability,"Decompose the Sounds and Pixels, Recompose the Events.","In this paper, we propose a framework centering around a novel architecture called the Event Decomposition Recomposition Network (EDRNet) to tackle the Audio-Visual Event (AVE) localization problem in the supervised and weakly supervised settings. AVEs in the real world exhibit common unravelling patterns (termed as Event Progress Checkpoints (EPC)), which humans can perceive through the cooperation of their auditory and visual senses. Unlike earlier methods which attempt to recognize entire event sequences, the EDRNet models EPCs and inter-EPC relationships using stacked temporal convolutions. Based on the postulation that EPC representations are theoretically consistent for an event category, we introduce the State Machine Based Video Fusion, a novel augmentation technique that blends source videos using different EPC template sequences. Additionally, we design a new loss function called the Land-Shore-Sea loss to compactify continuous foreground and background representations. Lastly, to alleviate the issue of confusing events during weak supervision, we propose a prediction stabilization method called Bag to Instance Label Correction. Experiments on the AVE dataset show that our collective framework outperforms the state-of-the-art by a sizable margin.",[],[],"['Varshanth R. Rao', 'Md Ibrahim Khalil', 'Haoda Li', 'Peng Dai', 'Juwei Lu']",[],[]
https://arxiv.org/abs/2205.13296,Transparency & Explainability,Social Interpretable Tree for Pedestrian Trajectory Prediction.,"Understanding the multiple socially-acceptable future behaviors is an essential task for many vision applications. In this paper, we propose a tree-based method, termed as Social Interpretable Tree (SIT), to address this multi-modal prediction task, where a hand-crafted tree is built depending on the prior information of observed trajectory to model multiple future trajectories. Specifically, a path in the tree from the root to leaf represents an individual possible future trajectory. SIT employs a coarse-to-fine optimization strategy, in which the tree is first built by high-order velocity to balance the complexity and coverage of the tree and then optimized greedily to encourage multimodality. Finally, a teacher-forcing refining operation is used to predict the final fine trajectory. Compared with prior methods which leverage implicit latent variables to represent possible future trajectories, the path in the tree can explicitly explain the rough moving behaviors (e.g., go straight and then turn right), and thus provides better interpretability. Despite the hand-crafted tree, the experimental results on ETH-UCY and Stanford Drone datasets demonstrate that our method is capable of matching or exceeding the performance of state-of-the-art methods. Interestingly, the experiments show that the raw built tree without training outperforms many prior deep neural network based approaches. Meanwhile, our method presents sufficient flexibility in long-term prediction and different best-of-$K$ predictions.",[],[],"['Liushuai Shi', 'Le Wang', 'Chengjiang Long', 'Sanping Zhou', 'Fang Zheng', 'Nanning Zheng', 'Gang Hua']",[],[]
https://arxiv.org/abs/2112.06197,Transparency & Explainability,Video as Conditional Graph Hierarchy for Multi-Granular Question Answering.,"Video question answering requires the models to understand and reason about both the complex video and language data to correctly derive the answers. Existing efforts have been focused on designing sophisticated cross-modal interactions to fuse the information from two modalities, while encoding the video and question holistically as frame and word sequences. Despite their success, these methods are essentially revolving around the sequential nature of video- and question-contents, providing little insight to the problem of question-answering and lacking interpretability as well. In this work, we argue that while video is presented in frame sequence, the visual elements (e.g., objects, actions, activities and events) are not sequential but rather hierarchical in semantic space. To align with the multi-granular essence of linguistic concepts in language queries, we propose to model video as a conditional graph hierarchy which weaves together visual facts of different granularity in a level-wise manner, with the guidance of corresponding textual cues. Despite the simplicity, our extensive experiments demonstrate the superiority of such conditional hierarchical graph architecture, with clear performance improvements over prior methods and also better generalization across different type of questions. Further analyses also demonstrate the model's reliability as it shows meaningful visual-textual evidences for the predicted answers.",[],[],"['Junbin Xiao', 'Angela Yao', 'Zhiyuan Liu', 'Yicong Li', 'Wei Ji', 'Tat-Seng Chua']",[],[]
https://arxiv.org/abs/2304.14612,Transparency & Explainability,Pan-Sharpening with Customized Transformer and Invertible Neural Network.,"Pan-sharpening aims to increase the spatial resolution of the low-resolution multispectral (LrMS) image with the guidance of the corresponding panchromatic (PAN) image. Although deep learning (DL)-based pan-sharpening methods have achieved promising performance, most of them have a two-fold deficiency. For one thing, the universally adopted black box principle limits the model interpretability. For another thing, existing DL-based methods fail to efficiently capture local and global dependencies at the same time, inevitably limiting the overall performance. To address these mentioned issues, we first formulate the degradation process of the high-resolution multispectral (HrMS) image as a unified variational optimization problem, and alternately solve its data and prior subproblems by the designed iterative proximal gradient descent (PGD) algorithm. Moreover, we customize a Local-Global Transformer (LGT) to simultaneously model local and global dependencies, and further formulate an LGT-based prior module for image denoising. Besides the prior module, we also design a lightweight data module. Finally, by serially integrating the data and prior modules in each iterative stage, we unfold the iterative algorithm into a stage-wise unfolding network, Local-Global Transformer Enhanced Unfolding Network (LGTEUN), for the interpretable MS pan-sharpening. Comprehensive experimental results on three satellite data sets demonstrate the effectiveness and efficiency of LGTEUN compared with state-of-the-art (SOTA) methods. The source code is available at this https URL.",[],[],"['Mingsong Li', 'Yikun Liu', 'Tao Xiao', 'Yuwen Huang', 'Gongping Yang']",[],[]
https://arxiv.org/abs/2112.14380,Transparency & Explainability,Cross-Domain Empirical Risk Minimization for Unbiased Long-Tailed Classification.,"We address the overlooked unbiasedness in existing long-tailed classification methods: we find that their overall improvement is mostly attributed to the biased preference of tail over head, as the test distribution is assumed to be balanced; however, when the test is as imbalanced as the long-tailed training data -- let the test respect Zipf's law of nature -- the tail bias is no longer beneficial overall because it hurts the head majorities. In this paper, we propose Cross-Domain Empirical Risk Minimization (xERM) for training an unbiased model to achieve strong performances on both test distributions, which empirically demonstrates that xERM fundamentally improves the classification by learning better feature representation rather than the head vs. tail game. Based on causality, we further theoretically explain why xERM achieves unbiasedness: the bias caused by the domain selection is removed by adjusting the empirical risks on the imbalanced domain and the balanced but unseen domain. Codes are available at this https URL.",[],[],"['Beier Zhu', 'Yulei Niu', 'Xian-Sheng Hua', 'Hanwang Zhang']",[],[]
https://arxiv.org/abs/2308.12755,Transparency & Explainability,GEQCA: Generic Qualitative Constraint Acquisition.,"The future of automated driving (AD) is rooted in the development of robust, fair and explainable artificial intelligence methods. Upon request, automated vehicles must be able to explain their decisions to the driver and the car passengers, to the pedestrians and other vulnerable road users and potentially to external auditors in case of accidents. However, nowadays, most explainable methods still rely on quantitative analysis of the AD scene representations captured by multiple sensors. This paper proposes a novel representation of AD scenes, called Qualitative eXplainable Graph (QXG), dedicated to qualitative spatiotemporal reasoning of long-term scenes. The construction of this graph exploits the recent Qualitative Constraint Acquisition paradigm. Our experimental results on NuScenes, an open real-world multi-modal dataset, show that the qualitative eXplainable graph of an AD scene composed of 40 frames can be computed in real-time and light in space storage which makes it a potentially interesting tool for improved and more trustworthy perception and control processes in AD.",[],[],"['Nassim Belmecheri', 'Arnaud Gotlieb', 'Nadjib Lazaar', 'Helge Spieker']",[],[]
https://arxiv.org/abs/2203.11386,Transparency & Explainability,Optimizing Binary Decision Diagrams with MaxSAT for Classification.,"The growing interest in explainable artificial intelligence (XAI) for critical decision making motivates the need for interpretable machine learning (ML) models. In fact, due to their structure (especially with small sizes), these models are inherently understandable by humans. Recently, several exact methods for computing such models are proposed to overcome weaknesses of traditional heuristic methods by providing more compact models or better prediction quality. Despite their compressed representation of Boolean functions, Binary decision diagrams (BDDs) did not gain enough interest as other interpretable ML models. In this paper, we first propose SAT-based models for learning optimal BDDs (in terms of the number of features) that classify all input examples. Then, we lift the encoding to a MaxSAT model to learn optimal BDDs in limited depths, that maximize the number of examples correctly classified. Finally, we tackle the fragmentation problem by introducing a method to merge compatible subtrees for the BDDs found via the MaxSAT model. Our empirical study shows clear benefits of the proposed approach in terms of prediction quality and intrepretability (i.e., lighter size) compared to the state-of-the-art approaches.",[],[],"['Hao Hu', 'Marie-José Huguet', 'Mohamed Siala']",[],[]
https://arxiv.org/abs/2108.11527,Transparency & Explainability,Subspace Differential Privacy.,"Many data applications have certain invariant constraints due to practical needs. Data curators who employ differential privacy need to respect such constraints on the sanitized data product as a primary utility requirement. Invariants challenge the formulation, implementation, and interpretation of privacy guarantees. We propose subspace differential privacy, to honestly characterize the dependence of the sanitized output on confidential aspects of the data. We discuss two design frameworks that convert well-known differentially private mechanisms, such as the Gaussian and the Laplace mechanisms, to subspace differentially private ones that respect the invariants specified by the curator. For linear queries, we discuss the design of near-optimal mechanisms that minimize the mean squared error. Subspace differentially private mechanisms rid the need for post-processing due to invariants, preserve transparency and statistical intelligibility of the output, and can be suitable for distributed implementation. We showcase the proposed mechanisms on the 2020 Census Disclosure Avoidance demonstration data, and a spatio-temporal dataset of mobile access point connections on a large university campus.",[],[],"['Jie Gao', 'Ruobin Gong', 'Fang-Yi Yu']",[],[]
