link,category,title,abstract,keywords,ccs_concepts,author_names,author_affiliations,author_countries
https://arxiv.org/abs/2112.01683,Fairness & Bias,TransZero: Attribute-Guided Transformer for Zero-Shot Learning.,"Zero-shot learning (ZSL) aims to recognize novel classes by transferring semantic knowledge from seen classes to unseen ones. Semantic knowledge is learned from attribute descriptions shared between different classes, which act as strong priors for localizing object attributes that represent discriminative region features, enabling significant visual-semantic interaction. Although some attention-based models have attempted to learn such region features in a single image, the transferability and discriminative attribute localization of visual features are typically neglected. In this paper, we propose an attribute-guided Transformer network, termed TransZero, to refine visual features and learn attribute localization for discriminative visual embedding representations in ZSL. Specifically, TransZero takes a feature augmentation encoder to alleviate the cross-dataset bias between ImageNet and ZSL benchmarks, and improves the transferability of visual features by reducing the entangled relative geometry relationships among region features. To learn locality-augmented visual features, TransZero employs a visual-semantic decoder to localize the image regions most relevant to each attribute in a given image, under the guidance of semantic attribute information. Then, the locality-augmented visual features and semantic vectors are used to conduct effective visual-semantic interaction in a visual-semantic embedding network. Extensive experiments show that TransZero achieves the new state of the art on three ZSL benchmarks. The codes are available at: \url{this https URL}.",[],[],"['Shiming Chen', 'Ziming Hong', 'Yang Liu', 'Guo-Sen Xie', 'Baigui Sun', 'Hao Li', 'Qinmu Peng', 'Ke Lu', 'Xinge You']",[],[]
https://arxiv.org/abs/2112.05291,Fairness & Bias,LCTR: On Awakening the Local Continuity of Transformer for Weakly Supervised Object Localization.,"Weakly supervised object localization (WSOL) aims to learn object localizer solely by using image-level labels. The convolution neural network (CNN) based techniques often result in highlighting the most discriminative part of objects while ignoring the entire object extent. Recently, the transformer architecture has been deployed to WSOL to capture the long-range feature dependencies with self-attention mechanism and multilayer perceptron structure. Nevertheless, transformers lack the locality inductive bias inherent to CNNs and therefore may deteriorate local feature details in WSOL. In this paper, we propose a novel framework built upon the transformer, termed LCTR (Local Continuity TRansformer), which targets at enhancing the local perception capability of global features among long-range feature dependencies. To this end, we propose a relational patch-attention module (RPAM), which considers cross-patch information on a global basis. We further design a cue digging module (CDM), which utilizes local features to guide the learning trend of the model for highlighting the weak local responses. Finally, comprehensive experiments are carried out on two widely used datasets, ie, CUB-200-2011 and ILSVRC, to verify the effectiveness of our method.",[],[],"['Zhiwei Chen', 'Changan Wang', 'Yabiao Wang', 'Guannan Jiang', 'Yunhang Shen', 'Ying Tai', 'Chengjie Wang', 'Wei Zhang', 'Liujuan Cao']",[],[]
https://arxiv.org/abs/2108.08029,Fairness & Bias,Unbiased IoU for Spherical Image Object Detection.,"As one of the most fundamental and challenging problems in computer vision, object detection tries to locate object instances and find their categories in natural images. The most important step in the evaluation of object detection algorithm is calculating the intersection-over-union (IoU) between the predicted bounding box and the ground truth one. Although this procedure is well-defined and solved for planar images, it is not easy for spherical image object detection. Existing methods either compute the IoUs based on biased bounding box representations or make excessive approximations, thus would give incorrect results. In this paper, we first identify that spherical rectangles are unbiased bounding boxes for objects in spherical images, and then propose an analytical method for IoU calculation without any approximations. Based on the unbiased representation and calculation, we also present an anchor free object detection algorithm for spherical images. The experiments on two spherical object detection datasets show that the proposed method can achieve better performance than existing methods.",[],[],"['Qiang Zhao', 'Bin Chen', 'Hang Xu', 'Yike Ma', 'Xiaodong Li', 'Bailan Feng', 'Chenggang Yan', 'Feng Dai']",[],[]
https://arxiv.org/abs/2112.04895,Fairness & Bias,Latent Space Explanation by Intervention.,"The success of deep neural nets heavily relies on their ability to encode complex relations between their input and their output. While this property serves to fit the training data well, it also obscures the mechanism that drives prediction. This study aims to reveal hidden concepts by employing an intervention mechanism that shifts the predicted class based on discrete variational autoencoders. An explanatory model then visualizes the encoded information from any hidden layer and its corresponding intervened representation. By the assessment of differences between the original representation and the intervened representation, one can determine the concepts that can alter the class, hence providing interpretability. We demonstrate the effectiveness of our approach on CelebA, where we show various visualizations for bias in the data and suggest different interventions to reveal and change bias.",[],[],"['Itai Gat', 'Guy Lorberbom', 'Idan Schwartz', 'Tamir Hazan']",[],[]
https://arxiv.org/abs/2301.04545,Fairness & Bias,Modify Self-Attention via Skeleton Decomposition for Effective Point Cloud Transformer.,"In this paper, we present a new method that reformulates point cloud completion as a set-to-set translation problem and design a new model, called PoinTr, which adopts a Transformer encoder-decoder architecture for point cloud completion. By representing the point cloud as a set of unordered groups of points with position embeddings, we convert the input data to a sequence of point proxies and employ the Transformers for generation. To facilitate Transformers to better leverage the inductive bias about 3D geometric structures of point clouds, we further devise a geometry-aware block that models the local geometric relationships explicitly. The migration of Transformers enables our model to better learn structural knowledge and preserve detailed information for point cloud completion. Taking a step towards more complicated and diverse situations, we further propose AdaPoinTr by developing an adaptive query generation mechanism and designing a novel denoising task during completing a point cloud. Coupling these two techniques enables us to train the model efficiently and effectively: we reduce training time (by 15x or more) and improve completion performance (over 20%). We also show our method can be extended to the scene-level point cloud completion scenario by designing a new geometry-enhanced semantic scene completion framework. Extensive experiments on the existing and newly-proposed datasets demonstrate the effectiveness of our method, which attains 6.53 CD on PCN, 0.81 CD on ShapeNet-55 and 0.392 MMD on real-world KITTI, surpassing other work by a large margin and establishing new state-of-the-arts on various benchmarks. Most notably, AdaPoinTr can achieve such promising performance with higher throughputs and fewer FLOPs compared with the previous best methods in practice. The code and datasets are available at this https URL",[],[],"['Xumin Yu', 'Yongming Rao', 'Ziyi Wang', 'Jiwen Lu', 'Jie Zhou']",[],[]
https://arxiv.org/abs/2203.00672,Fairness & Bias,Generalizable Person Re-identification via Self-Supervised Batch Norm Test-Time Adaption.,"In this paper, we investigate the generalization problem of person re-identification (re-id), whose major challenge is the distribution shift on an unseen domain. As an important tool of regularizing the distribution, batch normalization (BN) has been widely used in existing methods. However, they neglect that BN is severely biased to the training domain and inevitably suffers the performance drop if directly generalized without being updated. To tackle this issue, we propose Batch Norm Test-time Adaption (BNTA), a novel re-id framework that applies the self-supervised strategy to update BN parameters adaptively. Specifically, BNTA quickly explores the domain-aware information within unlabeled target data before inference, and accordingly modulates the feature distribution normalized by BN to adapt to the target domain. This is accomplished by two designed self-supervised auxiliary tasks, namely part positioning and part nearest neighbor matching, which help the model mine the domain-aware information with respect to the structure and identity of body parts, respectively. To demonstrate the effectiveness of our method, we conduct extensive experiments on three re-id datasets and confirm the superior performance to the state-of-the-art methods.",[],[],"['Ke Han', 'Chenyang Si', 'Yan Huang', 'Liang Wang', 'Tieniu Tan']",[],[]
https://arxiv.org/abs/2112.15324,Fairness & Bias,Deconfounded Visual Grounding.,"We focus on the confounding bias between language and location in the visual grounding pipeline, where we find that the bias is the major visual reasoning bottleneck. For example, the grounding process is usually a trivial language-location association without visual reasoning, e.g., grounding any language query containing sheep to the nearly central regions, due to that most queries about sheep have ground-truth locations at the image center. First, we frame the visual grounding pipeline into a causal graph, which shows the causalities among image, query, target location and underlying confounder. Through the causal graph, we know how to break the grounding bottleneck: deconfounded visual grounding. Second, to tackle the challenge that the confounder is unobserved in general, we propose a confounder-agnostic approach called: Referring Expression Deconfounder (RED), to remove the confounding bias. Third, we implement RED as a simple language attention, which can be applied in any grounding method. On popular benchmarks, RED improves various state-of-the-art grounding methods by a significant margin. Code will soon be available at: this https URL.",[],[],"['Jianqiang Huang', 'Yu Qin', 'Jiaxin Qi', 'Qianru Sun', 'Hanwang Zhang']",[],[]
https://arxiv.org/abs/2107.11617,Fairness & Bias,LAGConv: Local-Context Adaptive Convolution Kernels with Global Harmonic Bias for Pansharpening.,"The convolution operation is a powerful tool for feature extraction and plays a prominent role in the field of computer vision. However, when targeting the pixel-wise tasks like image fusion, it would not fully perceive the particularity of each pixel in the image if the uniform convolution kernel is used on different patches. In this paper, we propose a local adaptive convolution (LAConv), which is dynamically adjusted to different spatial locations. LAConv enables the network to pay attention to every specific local area in the learning process. Besides, the dynamic bias (DYB) is introduced to provide more possibilities for the depiction of features and make the network more flexible. We further design a residual structure network equipped with the proposed LAConv and DYB modules, and apply it to two image fusion tasks. Experiments for pansharpening and hyperspectral image super-resolution (HISR) demonstrate the superiority of our method over other state-of-the-art methods. It is worth mentioning that LAConv can also be competent for other super-resolution tasks with less computation effort.",[],[],"['Zi-Rong Jin', 'Liang-Jian Deng', 'Tai-Xiang Jiang', 'Tian-Jing Zhang']",[],[]
https://arxiv.org/abs/2202.04287,Fairness & Bias,Amplitude Spectrum Transformation for Open Compound Domain Adaptive Semantic Segmentation.,"Open compound domain adaptation (OCDA) has emerged as a practical adaptation setting which considers a single labeled source domain against a compound of multi-modal unlabeled target data in order to generalize better on novel unseen domains. We hypothesize that an improved disentanglement of domain-related and task-related factors of dense intermediate layer features can greatly aid OCDA. Prior-arts attempt this indirectly by employing adversarial domain discriminators on the spatial CNN output. However, we find that latent features derived from the Fourier-based amplitude spectrum of deep CNN features hold a more tractable mapping with domain discrimination. Motivated by this, we propose a novel feature space Amplitude Spectrum Transformation (AST). During adaptation, we employ the AST auto-encoder for two purposes. First, carefully mined source-target instance pairs undergo a simulation of cross-domain feature stylization (AST-Sim) at a particular layer by altering the AST-latent. Second, AST operating at a later layer is tasked to normalize (AST-Norm) the domain content by fixing its latent to a mean prototype. Our simplified adaptation technique is not only clustering-free but also free from complex adversarial alignment. We achieve leading performance against the prior arts on the OCDA scene segmentation benchmarks.",[],[],"['Jogendra Nath Kundu', 'Akshay Kulkarni', 'Suvaansh Bhambri', 'Varun Jampani', 'R. Venkatesh Babu']",[],[]
https://arxiv.org/abs/2110.06679,Fairness & Bias,EditVAE: Unsupervised Parts-Aware Controllable 3D Point Cloud Shape Generation.,"This paper tackles the problem of parts-aware point cloud generation. Unlike existing works which require the point cloud to be segmented into parts a priori, our parts-aware editing and generation are performed in an unsupervised manner. We achieve this with a simple modification of the Variational Auto-Encoder which yields a joint model of the point cloud itself along with a schematic representation of it as a combination of shape primitives. In particular, we introduce a latent representation of the point cloud which can be decomposed into a disentangled representation for each part of the shape. These parts are in turn disentangled into both a shape primitive and a point cloud representation, along with a standardising transformation to a canonical coordinate system. The dependencies between our standardising transformations preserve the spatial dependencies between the parts in a manner that allows meaningful parts-aware point cloud generation and shape editing. In addition to the flexibility afforded by our disentangled representation, the inductive bias introduced by our joint modeling approach yields state-of-the-art experimental results on the ShapeNet dataset.",[],[],"['Shidi Li', 'Miaomiao Liu', 'Christian Walder']",[],[]
https://arxiv.org/abs/2204.02251,Fairness & Bias,Distribution Aware VoteNet for 3D Object Detection.,"As a fundamental problem in computer vision, 3D object detection is experiencing rapid growth. To extract the point-wise features from the irregularly and sparsely distributed points, previous methods usually take a feature grouping module to aggregate the point features to an object candidate. However, these methods have not yet leveraged the surface geometry of foreground objects to enhance grouping and 3D box generation. In this paper, we propose the RBGNet framework, a voting-based 3D detector for accurate 3D object detection from point clouds. In order to learn better representations of object shape to enhance cluster features for predicting 3D boxes, we propose a ray-based feature grouping module, which aggregates the point-wise features on object surfaces using a group of determined rays uniformly emitted from cluster centers. Considering the fact that foreground points are more meaningful for box estimation, we design a novel foreground biased sampling strategy in downsample process to sample more points on object surfaces and further boost the detection performance. Our model achieves state-of-the-art 3D detection performance on ScanNet V2 and SUN RGB-D with remarkable performance gains. Code will be available at this https URL.",[],[],"['Haiyang Wang', 'Shaoshuai Shi', 'Ze Yang', 'Rongyao Fang', 'Qi Qian', 'Hongsheng Li', 'Bernt Schiele', 'Liwei Wang']",[],[]
https://arxiv.org/abs/2112.04138,Fairness & Bias,Contrastive Instruction-Trajectory Learning for Vision-Language Navigation.,"The vision-language navigation (VLN) task requires an agent to reach a target with the guidance of natural language instruction. Previous works learn to navigate step-by-step following an instruction. However, these works may fail to discriminate the similarities and discrepancies across instruction-trajectory pairs and ignore the temporal continuity of sub-instructions. These problems hinder agents from learning distinctive vision-and-language representations, harming the robustness and generalizability of the navigation policy. In this paper, we propose a Contrastive Instruction-Trajectory Learning (CITL) framework that explores invariance across similar data samples and variance across different ones to learn distinctive representations for robust navigation. Specifically, we propose: (1) a coarse-grained contrastive learning objective to enhance vision-and-language representations by contrasting semantics of full trajectory observations and instructions, respectively; (2) a fine-grained contrastive learning objective to perceive instructions by leveraging the temporal information of the sub-instructions; (3) a pairwise sample-reweighting mechanism for contrastive learning to mine hard samples and hence mitigate the influence of data sampling bias in contrastive learning. Our CITL can be easily integrated with VLN backbones to form a new learning paradigm and achieve better generalizability in unseen environments. Extensive experiments show that the model with CITL surpasses the previous state-of-the-art methods on R2R, R4R, and RxR.",[],[],"['Xiwen Liang', 'Fengda Zhu', 'Yi Zhu', 'Bingqian Lin', 'Bing Wang', 'Xiaodan Liang']",[],[]
https://arxiv.org/abs/2303.06873,Fairness & Bias,Interventional Multi-Instance Learning with Deconfounded Instance-Level Prediction.,"Multi-instance learning (MIL) is an effective paradigm for whole-slide pathological images (WSIs) classification to handle the gigapixel resolution and slide-level label. Prevailing MIL methods primarily focus on improving the feature extractor and aggregator. However, one deficiency of these methods is that the bag contextual prior may trick the model into capturing spurious correlations between bags and labels. This deficiency is a confounder that limits the performance of existing MIL methods. In this paper, we propose a novel scheme, Interventional Bag Multi-Instance Learning (IBMIL), to achieve deconfounded bag-level prediction. Unlike traditional likelihood-based strategies, the proposed scheme is based on the backdoor adjustment to achieve the interventional training, thus is capable of suppressing the bias caused by the bag contextual prior. Note that the principle of IBMIL is orthogonal to existing bag MIL methods. Therefore, IBMIL is able to bring consistent performance boosting to existing schemes, achieving new state-of-the-art performance. Code is available at this https URL.",[],[],"['Tiancheng Lin', 'Zhimiao Yu', 'Hongyu Hu', 'Yi Xu', 'Chang Wen Chen']",[],[]
https://arxiv.org/abs/2310.09533,Fairness & Bias,A Causal Debiasing Framework for Unsupervised Salient Object Detection.,"Unsupervised salient object detection aims to detect salient objects without using supervision signals eliminating the tedious task of manually labeling salient objects. To improve training efficiency, end-to-end methods for USOD have been proposed as a promising alternative. However, current solutions rely heavily on noisy handcraft labels and fail to mine rich semantic information from deep features. In this paper, we propose a self-supervised end-to-end salient object detection framework via top-down context. Specifically, motivated by contrastive learning, we exploit the self-localization from the deepest feature to construct the location maps which are then leveraged to learn the most instructive segmentation guidance. Further considering the lack of detailed information in deepest features, we exploit the detail-boosting refiner module to enrich the location labels with details. Moreover, we observe that due to lack of supervision, current unsupervised saliency models tend to detect non-salient objects that are salient in some other samples of corresponding scenarios. To address this widespread issue, we design a novel Unsupervised Non-Salient Suppression (UNSS) method developing the ability to ignore non-salient objects. Extensive experiments on benchmark datasets demonstrate that our method achieves leading performance among the recent end-to-end methods and most of the multi-stage solutions. The code is available.",[],[],"['Yicheng Song', 'Shuyong Gao', 'Haozhe Xing', 'Yiting Cheng', 'Yan Wang', 'Wenqiang Zhang']",[],[]
https://arxiv.org/abs/2308.00508,Fairness & Bias,Context-Based Contrastive Learning for Scene Text Recognition.,"Context-aware methods achieved great success in supervised scene text recognition via incorporating semantic priors from words. We argue that such prior contextual information can be interpreted as the relations of textual primitives due to the heterogeneous text and background, which can provide effective self-supervised labels for representation learning. However, textual relations are restricted to the finite size of dataset due to lexical dependencies, which causes the problem of over-fitting and compromises representation robustness. To this end, we propose to enrich the textual relations via rearrangement, hierarchy and interaction, and design a unified framework called RCLSTR: Relational Contrastive Learning for Scene Text Recognition. Based on causality, we theoretically explain that three modules suppress the bias caused by the contextual prior and thus guarantee representation robustness. Experiments on representation quality show that our method outperforms state-of-the-art self-supervised STR methods. Code is available at this https URL.",[],[],"['Jinglei Zhang', 'Tiancheng Lin', 'Yi Xu', 'Kai Chen', 'Rui Zhang']",[],[]
https://arxiv.org/abs/2203.01723,Fairness & Bias,Debiased Batch Normalization via Gaussian Process for Generalizable Person Re-identification.,"Generalizable person re-identification aims to learn a model with only several labeled source domains that can perform well on unseen domains. Without access to the unseen domain, the feature statistics of the batch normalization (BN) layer learned from a limited number of source domains is doubtlessly biased for unseen domain. This would mislead the feature representation learning for unseen domain and deteriorate the generalizaiton ability of the model. In this paper, we propose a novel Debiased Batch Normalization via Gaussian Process approach (GDNorm) for generalizable person re-identification, which models the feature statistic estimation from BN layers as a dynamically self-refining Gaussian process to alleviate the bias to unseen domain for improving the generalization. Specifically, we establish a lightweight model with multiple set of domain-specific BN layers to capture the discriminability of individual source domain, and learn the corresponding parameters of the domain-specific BN layers. These parameters of different source domains are employed to deduce a Gaussian process. We randomly sample several paths from this Gaussian process served as the BN estimations of potential new domains outside of existing source domains, which can further optimize these learned parameters from source domains, and estimate more accurate Gaussian process by them in return, tending to real data distribution. Even without a large number of source domains, GDNorm can still provide debiased BN estimation by using the mean path of the Gaussian process, while maintaining low computational cost during testing. Extensive experiments demonstrate that our GDNorm effectively improves the generalization ability of the model on unseen domain.",[],[],"['Jiawei Liu', 'Zhipeng Huang', 'Liang Li', 'Kecheng Zheng', 'Zheng-Jun Zha']",[],[]
