link,category,title,abstract,keywords,ccs_concepts,author_names,author_affiliations,author_countries
https://arxiv.org/abs/2104.08142,Fairness & Bias,Supervising Model Attention with Human Explanations for Robust Natural Language Inference.,"Natural Language Inference (NLI) models are known to learn from biases and artefacts within their training data, impacting how well they generalise to other unseen datasets. Existing de-biasing approaches focus on preventing the models from learning these biases, which can result in restrictive models and lower performance. We instead investigate teaching the model how a human would approach the NLI task, in order to learn features that will generalise better to previously unseen examples. Using natural language explanations, we supervise the model's attention weights to encourage more attention to be paid to the words present in the explanations, significantly improving model performance. Our experiments show that the in-distribution improvements of this method are also accompanied by out-of-distribution improvements, with the supervised models learning from features that generalise better to other NLI datasets. Analysis of the model indicates that human explanations encourage increased attention on the important words, with more attention paid to words in the premise and less attention paid to punctuation and stop-words.",[],[],"['Joe Stacey', 'Yonatan Belinkov', 'Marek Rei']",[],[]
https://arxiv.org/abs/2212.10392,Fairness & Bias,Debiasing NLU Models via Causal Intervention and Counterfactual Reasoning.,"Stance detection models may tend to rely on dataset bias in the text part as a shortcut and thus fail to sufficiently learn the interaction between the targets and texts. Recent debiasing methods usually treated features learned by small models or big models at earlier steps as bias features and proposed to exclude the branch learning those bias features during inference. However, most of these methods fail to disentangle the ``good'' stance features and ``bad'' bias features in the text part. In this paper, we investigate how to mitigate dataset bias in stance detection. Motivated by causal effects, we leverage a novel counterfactual inference framework, which enables us to capture the dataset bias in the text part as the direct causal effect of the text on stances and reduce the dataset bias in the text part by subtracting the direct text effect from the total causal effect. We novelly model bias features as features that correlate with the stance labels but fail on intermediate stance reasoning subtasks and propose an adversarial bias learning module to model the bias more accurately. To verify whether our model could better model the interaction between texts and targets, we test our model on recently proposed test sets to evaluate the understanding of the task from various aspects. Experiments demonstrate that our proposed method (1) could better model the bias features, and (2) outperforms existing debiasing baselines on both the original dataset and most of the newly constructed test sets.",[],[],"['Jianhua Yuan', 'Yanyan Zhao', 'Bing Qin']",[],[]
https://arxiv.org/abs/2203.07504,Fairness & Bias,VAST: The Valence-Assessing Semantics Test for Contextualizing Language Models.,"VAST, the Valence-Assessing Semantics Test, is a novel intrinsic evaluation task for contextualized word embeddings (CWEs). VAST uses valence, the association of a word with pleasantness, to measure the correspondence of word-level LM semantics with widely used human judgments, and examines the effects of contextualization, tokenization, and LM-specific geometry. Because prior research has found that CWEs from GPT-2 perform poorly on other intrinsic evaluations, we select GPT-2 as our primary subject, and include results showing that VAST is useful for 7 other LMs, and can be used in 7 languages. GPT-2 results show that the semantics of a word incorporate the semantics of context in layers closer to model output, such that VAST scores diverge between our contextual settings, ranging from Pearson's rho of .55 to .77 in layer 11. We also show that multiply tokenized words are not semantically encoded until layer 8, where they achieve Pearson's rho of .46, indicating the presence of an encoding process for multiply tokenized words which differs from that of singly tokenized words, for which rho is highest in layer 0. We find that a few neurons with values having greater magnitude than the rest mask word-level semantics in GPT-2's top layer, but that word-level semantics can be recovered by nullifying non-semantic principal components: Pearson's rho in the top layer improves from .32 to .76. After isolating semantics, we show the utility of VAST for understanding LM semantics via improvements over related work on four word similarity tasks, with a score of .50 on SimLex-999, better than the previous best of .45 for GPT-2. Finally, we show that 8 of 10 WEAT bias tests, which compare differences in word embedding associations between groups of words, exhibit more stereotype-congruent biases after isolating semantics, indicating that non-semantic structures in LMs also mask biases.",[],[],"['Robert Wolfe', 'Aylin Caliskan']",[],[]
https://arxiv.org/abs/2305.09335,Fairness & Bias,A Graph Convolutional Network with Adaptive Graph Generation and Channel Selection for Event Detection.,"Event detection (ED) is aimed to identify the key trigger words in unstructured text and predict the event types accordingly. Traditional ED models are too data-hungry to accommodate real applications with scarce labeled data. Besides, typical ED models are facing the context-bypassing and disabled generalization issues caused by the trigger bias stemming from ED datasets. Therefore, we focus on the true few-shot paradigm to satisfy the low-resource scenarios. In particular, we propose a multi-step prompt learning model (MsPrompt) for debiasing few-shot event detection, that consists of the following three components: an under-sampling module targeting to construct a novel training set that accommodates the true few-shot setting, a multi-step prompt module equipped with a knowledge-enhanced ontology to leverage the event semantics and latent prior knowledge in the PLMs sufficiently for tackling the context-bypassing problem, and a prototypical module compensating for the weakness of classifying events with sparse data and boost the generalization performance. Experiments on two public datasets ACE-2005 and FewEvent show that MsPrompt can outperform the state-of-the-art models, especially in the strict low-resource scenarios reporting 11.43% improvement in terms of weighted F1-score against the best-performing baseline and achieving an outstanding debiasing performance.",[],[],"['Siyuan Wang', 'Jianming Zheng', 'Xuejun Hu', 'Fei Cai', 'Chengyu Song', 'Xueshan Luo']",[],[]
https://arxiv.org/abs/2106.07176,Fairness & Bias,SAS: Self-Augmentation Strategy for Language Model Pre-training.,"The core of self-supervised learning for pre-training language models includes pre-training task design as well as appropriate data augmentation. Most data augmentations in language model pre-training are context-independent. A seminal contextualized augmentation was recently proposed in ELECTRA and achieved state-of-the-art performance by introducing an auxiliary generation network (generator) to produce contextualized data augmentation for the training of a main discrimination network (discriminator). This design, however, introduces extra computation cost of the generator and a need to adjust the relative capability between the generator and the discriminator. In this paper, we propose a self-augmentation strategy (SAS) where a single network is utilized for both regular pre-training and contextualized data augmentation for the training in later epochs. Essentially, this strategy eliminates a separate generator and uses the single network to jointly conduct two pre-training tasks with MLM (Masked Language Modeling) and RTD (Replaced Token Detection) heads. It avoids the challenge to search for an appropriate size of the generator, which is critical to the performance as evidenced in ELECTRA and its subsequent variant models. In addition, SAS is a general strategy that can be seamlessly combined with many new techniques emerging recently or in the future, such as the disentangled attention mechanism from DeBERTa. Our experiments show that SAS is able to outperform ELECTRA and other state-of-the-art models in the GLUE tasks with similar or less computation cost.",[],[],"['Yifei Xu', 'Jingqiao Zhang', 'Ru He', 'Liangzhu Ge', 'Chao Yang', 'Cheng Yang', 'Ying Nian Wu']",[],[]
https://arxiv.org/abs/2109.11087,Fairness & Bias,BiRdQA: A Bilingual Dataset for Question Answering on Tricky Riddles.,"A riddle is a question or statement with double or veiled meanings, followed by an unexpected answer. Solving riddle is a challenging task for both machine and human, testing the capability of understanding figurative, creative natural language and reasoning with commonsense knowledge. We introduce BiRdQA, a bilingual multiple-choice question answering dataset with 6614 English riddles and 8751 Chinese riddles. For each riddle-answer pair, we provide four distractors with additional information from Wikipedia. The distractors are automatically generated at scale with minimal bias. Existing monolingual and multilingual QA models fail to perform well on our dataset, indicating that there is a long way to go before machine can beat human on solving tricky riddles. The dataset has been released to the community.",[],[],"['Yunxiang Zhang', 'Xiaojun Wan']",[],[]
https://arxiv.org/abs/2109.06486,Fairness & Bias,Conditional Synthetic Data Generation for Robust Machine Learning Applications with Limited Pandemic Data.,"$\textbf{Background:}$ At the onset of a pandemic, such as COVID-19, data with proper labeling/attributes corresponding to the new disease might be unavailable or sparse. Machine Learning (ML) models trained with the available data, which is limited in quantity and poor in diversity, will often be biased and inaccurate. At the same time, ML algorithms designed to fight pandemics must have good performance and be developed in a time-sensitive manner. To tackle the challenges of limited data, and label scarcity in the available data, we propose generating conditional synthetic data, to be used alongside real data for developing robust ML models. $\textbf{Methods:}$ We present a hybrid model consisting of a conditional generative flow and a classifier for conditional synthetic data generation. The classifier decouples the feature representation for the condition, which is fed to the flow to extract the local noise. We generate synthetic data by manipulating the local noise with fixed conditional feature representation. We also propose a semi-supervised approach to generate synthetic samples in the absence of labels for a majority of the available data.  $\textbf{Results:}$ We performed conditional synthetic generation for chest computed tomography (CT) scans corresponding to normal, COVID-19, and pneumonia afflicted patients. We show that our method significantly outperforms existing models both on qualitative and quantitative performance, and our semi-supervised approach can efficiently synthesize conditional samples under label scarcity. As an example of downstream use of synthetic data, we show improvement in COVID-19 detection from CT scans with conditional synthetic data augmentation.",[],[],"['Hari Prasanna Das', 'Ryan Tran', 'Japjot Singh', 'Xiangyu Yue', 'Geoff Tison', 'Alberto Sangiovanni-Vincentelli', 'Costas J. Spanos']",[],[]
https://arxiv.org/abs/2202.03281,Fairness & Bias,Personalized Public Policy Analysis in Social Sciences Using Causal-Graphical Normalizing Flows.,"Structural Equation/Causal Models (SEMs/SCMs) are widely used in epidemiology and social sciences to identify and analyze the average causal effect (ACE) and conditional ACE (CACE). Traditional causal effect estimation methods such as Inverse Probability Weighting (IPW) and more recently Regression-With-Residuals (RWR) are widely used - as they avoid the challenging task of identifying the SCM parameters - to estimate ACE and CACE. However, much work remains before traditional estimation methods can be used for counterfactual inference, and for the benefit of Personalized Public Policy Analysis (P$^3$A) in the social sciences. While doctors rely on personalized medicine to tailor treatments to patients in laboratory settings (relatively closed systems), P$^3$A draws inspiration from such tailoring but adapts it for open social systems. In this article, we develop a method for counterfactual inference that we name causal-Graphical Normalizing Flow (c-GNF), facilitating P$^3$A. First, we show how c-GNF captures the underlying SCM without making any assumption about functional forms. Second, we propose a novel dequantization trick to deal with discrete variables, which is a limitation of normalizing flows in general. Third, we demonstrate in experiments that c-GNF performs on-par with IPW and RWR in terms of bias and variance for estimating the ATE, when the true functional forms are known, and better when they are unknown. Fourth and most importantly, we conduct counterfactual inference with c-GNFs, demonstrating promising empirical performance. Because IPW and RWR, like other traditional methods, lack the capability of counterfactual inference, c-GNFs will likely play a major role in tailoring personalized treatment, facilitating P$^3$A, optimizing social interventions - in contrast to the current `one-size-fits-all' approach of existing methods.",[],[],"['Sourabh Balgi', 'Jose M. Pena', 'Adel Daoud']",[],[]
https://arxiv.org/abs/2012.13176,Fairness & Bias,Interpreting Gender Bias in Neural Machine Translation: Multilingual Architecture Matters.,"Multilingual Neural Machine Translation architectures mainly differ in the amount of sharing modules and parameters among languages. In this paper, and from an algorithmic perspective, we explore if the chosen architecture, when trained with the same data, influences the gender bias accuracy. Experiments in four language pairs show that Language-Specific encoders-decoders exhibit less bias than the Shared encoder-decoder architecture. Further interpretability analysis of source embeddings and the attention shows that, in the Language-Specific case, the embeddings encode more gender information, and its attention is more diverted. Both behaviors help in mitigating gender bias.",[],[],"['Marta R. Costa-jussà', 'Carlos Escolano', 'Christine Basta', 'Javier Ferrando', 'Roser Batlle', 'Ksenia Kharitonova']",[],[]
https://arxiv.org/abs/2112.05194,Fairness & Bias,Word Embeddings via Causal Inference: Gender Bias Reducing and Semantic Information Preserving.,"With widening deployments of natural language processing (NLP) in daily life, inherited social biases from NLP models have become more severe and problematic. Previous studies have shown that word embeddings trained on human-generated corpora have strong gender biases that can produce discriminative results in downstream tasks. Previous debiasing methods focus mainly on modeling bias and only implicitly consider semantic information while completely overlooking the complex underlying causal structure among bias and semantic components. To address these issues, we propose a novel methodology that leverages a causal inference framework to effectively remove gender bias. The proposed method allows us to construct and analyze the complex causal mechanisms facilitating gender information flow while retaining oracle semantic information within word embeddings. Our comprehensive experiments show that the proposed method achieves state-of-the-art results in gender-debiasing tasks. In addition, our methods yield better performance in word similarity evaluation and various extrinsic downstream NLP tasks.",[],[],"['Lei Ding', 'Dengdeng Yu', 'Jinhan Xie', 'Wenxing Guo', 'Shenggang Hu', 'Meichen Liu', 'Linglong Kong', 'Hongsheng Dai', 'Yanchun Bao', 'Bei Jiang']",[],[]
https://arxiv.org/abs/2310.19986,Fairness & Bias,Has CEO Gender Bias Really Been Fixed? Adversarial Attacking and Improving Gender Fairness in Image Search.,"Machine learning (ML) technologies are known to be riddled with ethical and operational problems, however, we are witnessing an increasing thrust by businesses to deploy them in sensitive applications. One major issue among many is that ML models do not perform equally well for underrepresented groups. This puts vulnerable populations in an even disadvantaged and unfavorable position. We propose an approach that leverages the power of web search and generative models to alleviate some of the shortcomings of discriminative models. We demonstrate our method on an image classification problem using ImageNet's People Subtree subset, and show that it is effective in enhancing robustness and mitigating bias in certain classes that represent vulnerable populations (e.g., female doctor of color). Our new method is able to (1) identify weak decision boundaries for such classes; (2) construct search queries for Google as well as text for generating images through DALL-E 2 and Stable Diffusion; and (3) show how these newly captured training samples could alleviate population bias issue. While still improving the model's overall performance considerably, we achieve a significant reduction (77.30\%) in the model's gender accuracy disparity. In addition to these improvements, we observed a notable enhancement in the classifier's decision boundary, as it is characterized by fewer weakspots and an increased separation between classes. Although we showcase our method on vulnerable populations in this study, the proposed technique is extendable to a wide range of problems and domains.",[],[],"['Preetam Prabhu Srikar Dammu', 'Yunhe Feng', 'Chirag Shah']",[],[]
https://arxiv.org/abs/2104.07496,Fairness & Bias,Unmasking the Mask - Evaluating Social Biases in Masked Language Models.,"Masked Language Models (MLMs) have shown superior performances in numerous downstream NLP tasks when used as text encoders. Unfortunately, MLMs also demonstrate significantly worrying levels of social biases. We show that the previously proposed evaluation metrics for quantifying the social biases in MLMs are problematic due to following reasons: (1) prediction accuracy of the masked tokens itself tend to be low in some MLMs, which raises questions regarding the reliability of the evaluation metrics that use the (pseudo) likelihood of the predicted tokens, and (2) the correlation between the prediction accuracy of the mask and the performance in downstream NLP tasks is not taken into consideration, and (3) high frequency words in the training data are masked more often, introducing noise due to this selection bias in the test cases. To overcome the above-mentioned disfluencies, we propose All Unmasked Likelihood (AUL), a bias evaluation measure that predicts all tokens in a test case given the MLM embedding of the unmasked input. We find that AUL accurately detects different types of biases in MLMs. We also propose AUL with attention weights (AULA) to evaluate tokens based on their importance in a sentence. However, unlike AUL and AULA, previously proposed bias evaluation measures for MLMs systematically overestimate the measured biases, and are heavily influenced by the unmasked tokens in the context.",[],[],"['Masahiro Kaneko', 'Danushka Bollegala']",[],[]
https://arxiv.org/abs/2105.02725,Fairness & Bias,CrossWalk: Fairness-Enhanced Node Representation Learning.,"The potential for machine learning systems to amplify social inequities and unfairness is receiving increasing popular and academic attention. Much recent work has focused on developing algorithmic tools to assess and mitigate such unfairness. However, there is little work on enhancing fairness in graph algorithms. Here, we develop a simple, effective and general method, CrossWalk, that enhances fairness of various graph algorithms, including influence maximization, link prediction and node classification, applied to node embeddings. CrossWalk is applicable to any random walk based node representation learning algorithm, such as DeepWalk and Node2Vec. The key idea is to bias random walks to cross group boundaries, by upweighting edges which (1) are closer to the groups' peripheries or (2) connect different groups in the network. CrossWalk pulls nodes that are near groups' peripheries towards their neighbors from other groups in the embedding space, while preserving the necessary structural properties of the graph. Extensive experiments show the effectiveness of our algorithm to enhance fairness in various graph algorithms, including influence maximization, link prediction and node classification in synthetic and real networks, with only a very small decrease in performance.",[],[],"['Ahmad Khajehnejad', 'Moein Khajehnejad', 'Mahmoudreza Babaei', 'Krishna P. Gummadi', 'Adrian Weller', 'Baharan Mirzasoleiman']",[],[]
https://arxiv.org/abs/2109.04392,Fairness & Bias,Fair Conformal Predictors for Applications in Medical Imaging.,"Deep learning has the potential to automate many clinically useful tasks in medical imaging. However translation of deep learning into clinical practice has been hindered by issues such as lack of the transparency and interpretability in these ""black box"" algorithms compared to traditional statistical methods. Specifically, many clinical deep learning models lack rigorous and robust techniques for conveying certainty (or lack thereof) in their predictions -- ultimately limiting their appeal for extensive use in medical decision-making. Furthermore, numerous demonstrations of algorithmic bias have increased hesitancy towards deployment of deep learning for clinical applications. To this end, we explore how conformal predictions can complement existing deep learning approaches by providing an intuitive way of expressing uncertainty while facilitating greater transparency to clinical users. In this paper, we conduct field interviews with radiologists to assess possible use-cases for conformal predictors. Using insights gathered from these interviews, we devise two clinical use-cases and empirically evaluate several methods of conformal predictions on a dermatology photography dataset for skin lesion classification. We show how to modify conformal predictions to be more adaptive to subgroup differences in patient skin tones through equalized coverage. Finally, we compare conformal prediction against measures of epistemic uncertainty.",[],[],"['Charles Lu', 'Andreanne Lemay', 'Ken Chang', 'Katharina Hoebel', 'Jayashree Kalpathy-Cramer']",[],[]
https://arxiv.org/abs/2203.13369,Fairness & Bias,Gender and Racial Stereotype Detection in Legal Opinion Word Embeddings.,"Studies have shown that some Natural Language Processing (NLP) systems encode and replicate harmful biases with potential adverse ethical effects in our society. In this article, we propose an approach for identifying gender and racial stereotypes in word embeddings trained on judicial opinions from U.S. case law. Embeddings containing stereotype information may cause harm when used by downstream systems for classification, information extraction, question answering, or other machine learning systems used to build legal research tools. We first explain how previously proposed methods for identifying these biases are not well suited for use with word embeddings trained on legal opinion text. We then propose a domain adapted method for identifying gender and racial biases in the legal domain. Our analyses using these methods suggest that racial and gender biases are encoded into word embeddings trained on legal opinions. These biases are not mitigated by exclusion of historical data, and appear across multiple large topical areas of the law. Implications for downstream systems that use legal opinion word embeddings and suggestions for potential mitigation strategies based on our observations are also discussed.",[],[],"['Sean Matthews', 'John Hudzina', 'Dawn Sepehr']",[],[]
https://arxiv.org/abs/2202.11812,Fairness & Bias,Investigations of Performance and Bias in Human-AI Teamwork in Hiring.,"In AI-assisted decision-making, effective hybrid (human-AI) teamwork is not solely dependent on AI performance alone, but also on its impact on human decision-making. While prior work studies the effects of model accuracy on humans, we endeavour here to investigate the complex dynamics of how both a model's predictive performance and bias may transfer to humans in a recommendation-aided decision task. We consider the domain of ML-assisted hiring, where humans -- operating in a constrained selection setting -- can choose whether they wish to utilize a trained model's inferences to help select candidates from written biographies. We conduct a large-scale user study leveraging a re-created dataset of real bios from prior work, where humans predict the ground truth occupation of given candidates with and without the help of three different NLP classifiers (random, bag-of-words, and deep neural network). Our results demonstrate that while high-performance models significantly improve human performance in a hybrid setting, some models mitigate hybrid bias while others accentuate it. We examine these findings through the lens of decision conformity and observe that our model architecture choices have an impact on human-AI conformity and bias, motivating the explicit need to assess these complex dynamics prior to deployment.",[],[],"['Andi Peng', 'Besmira Nushi', 'Emre Kiciman', 'Kori Inkpen', 'Ece Kamar']",[],[]
