link,category,title,abstract,keywords,ccs_concepts,author_names,author_affiliations,author_countries
https://arxiv.org/abs/2107.06831,Security,Parallel and High-Fidelity Text-to-Lip Generation.,"As a key component of talking face generation, lip movements generation determines the naturalness and coherence of the generated talking face video. Prior literature mainly focuses on speech-to-lip generation while there is a paucity in text-to-lip (T2L) generation. T2L is a challenging task and existing end-to-end works depend on the attention mechanism and autoregressive (AR) decoding manner. However, the AR decoding manner generates current lip frame conditioned on frames generated previously, which inherently hinders the inference speed, and also has a detrimental effect on the quality of generated lip frames due to error propagation. This encourages the research of parallel T2L generation. In this work, we propose a parallel decoding model for fast and high-fidelity text-to-lip generation (ParaLip). Specifically, we predict the duration of the encoded linguistic features and model the target lip frames conditioned on the encoded linguistic features with their duration in a non-autoregressive manner. Furthermore, we incorporate the structural similarity index loss and adversarial learning to improve perceptual quality of generated lip frames and alleviate the blurry prediction problem. Extensive experiments conducted on GRID and TCD-TIMIT datasets demonstrate the superiority of proposed methods. Video samples are available via \url{this https URL}.",[],[],"['Jinglin Liu', 'Zhiying Zhu', 'Yi Ren', 'Wencan Huang', 'Baoxing Huai', 'Nicholas Yuan', 'Zhou Zhao']",[],[]
https://arxiv.org/abs/2112.14894,Security,Feature Generation and Hypothesis Verification for Reliable Face Anti-spoofing.,"Although existing face anti-spoofing (FAS) methods achieve high accuracy in intra-domain experiments, their effects drop severely in cross-domain scenarios because of poor generalization. Recently, multifarious techniques have been explored, such as domain generalization and representation disentanglement. However, the improvement is still limited by two issues: 1) It is difficult to perfectly map all faces to a shared feature space. If faces from unknown domains are not mapped to the known region in the shared feature space, accidentally inaccurate predictions will be obtained. 2) It is hard to completely consider various spoof traces for disentanglement. In this paper, we propose a Feature Generation and Hypothesis Verification framework to alleviate the two issues. Above all, feature generation networks which generate hypotheses of real faces and known attacks are introduced for the first time in the FAS task. Subsequently, two hypothesis verification modules are applied to judge whether the input face comes from the real-face space and the real-face distribution respectively. Furthermore, some analyses of the relationship between our framework and Bayesian uncertainty estimation are given, which provides theoretical support for reliable defense in unknown domains. Experimental results show our framework achieves promising results and outperforms the state-of-the-art approaches on extensive public datasets.",[],[],"['Shice Liu', 'Shitao Lu', 'Hongyi Xu', 'Jing Yang', 'Shouhong Ding', 'Lizhuang Ma']",[],[]
https://arxiv.org/abs/2112.13522,Security,Dual Contrastive Learning for General Face Forgery Detection.,"With various facial manipulation techniques arising, face forgery detection has drawn growing attention due to security concerns. Previous works always formulate face forgery detection as a classification problem based on cross-entropy loss, which emphasizes category-level differences rather than the essential discrepancies between real and fake faces, limiting model generalization in unseen domains. To address this issue, we propose a novel face forgery detection framework, named Dual Contrastive Learning (DCL), which specially constructs positive and negative paired data and performs designed contrastive learning at different granularities to learn generalized feature representation. Concretely, combined with the hard sample selection strategy, Inter-Instance Contrastive Learning (Inter-ICL) is first proposed to promote task-related discriminative features learning by especially constructing instance pairs. Moreover, to further explore the essential discrepancies, Intra-Instance Contrastive Learning (Intra-ICL) is introduced to focus on the local content inconsistencies prevalent in the forged faces by constructing local-region pairs inside instances. Extensive experiments and visualizations on several datasets demonstrate the generalization of our method against the state-of-the-art competitors.",[],[],"['Ke Sun', 'Taiping Yao', 'Shen Chen', 'Shouhong Ding', 'Jilin L', 'Rongrong Ji']",[],[]
https://arxiv.org/abs/2109.05830,Security,Adversarial Bone Length Attack on Action Recognition.,"Skeleton-based action recognition models have recently been shown to be vulnerable to adversarial attacks. Compared to adversarial attacks on images, perturbations to skeletons are typically bounded to a lower dimension of approximately 100 per frame. This lower-dimensional setting makes it more difficult to generate imperceptible perturbations. Existing attacks resolve this by exploiting the temporal structure of the skeleton motion so that the perturbation dimension increases to thousands. In this paper, we show that adversarial attacks can be performed on skeleton-based action recognition models, even in a significantly low-dimensional setting without any temporal manipulation. Specifically, we restrict the perturbations to the lengths of the skeleton's bones, which allows an adversary to manipulate only approximately 30 effective dimensions. We conducted experiments on the NTU RGB+D and HDM05 datasets and demonstrate that the proposed attack successfully deceived models with sometimes greater than 90% success rate by small perturbations. Furthermore, we discovered an interesting phenomenon: in our low-dimensional setting, the adversarial training with the bone length attack shares a similar property with data augmentation, and it not only improves the adversarial robustness but also improves the classification accuracy on the original data. This is an interesting counterexample of the trade-off between adversarial robustness and clean accuracy, which has been widely observed in studies on adversarial training in the high-dimensional regime.",[],[],"['Nariki Tanaka', 'Hiroshi Kera', 'Kazuhiko Kawamoto']",[],[]
https://arxiv.org/abs/2109.07193,Security,FCA: Learning a 3D Full-Coverage Vehicle Camouflage for Multi-View Physical Adversarial Attack.,"Physical adversarial attacks in object detection have attracted increasing attention. However, most previous works focus on hiding the objects from the detector by generating an individual adversarial patch, which only covers the planar part of the vehicle's surface and fails to attack the detector in physical scenarios for multi-view, long-distance and partially occluded objects. To bridge the gap between digital attacks and physical attacks, we exploit the full 3D vehicle surface to propose a robust Full-coverage Camouflage Attack (FCA) to fool detectors. Specifically, we first try rendering the nonplanar camouflage texture over the full vehicle surface. To mimic the real-world environment conditions, we then introduce a transformation function to transfer the rendered camouflaged vehicle into a photo realistic scenario. Finally, we design an efficient loss function to optimize the camouflage texture. Experiments show that the full-coverage camouflage attack can not only outperform state-of-the-art methods under various test cases but also generalize to different environments, vehicles, and object detectors. The code of FCA will be available at: this https URL.",[],[],"['Donghua Wang', 'Tingsong Jiang', 'Jialiang Sun', 'Weien Zhou', 'Xiaoya Zhang', 'Zhiqiang Gong', 'Wen Yao', 'Xiaoqian Chen']",[],[]
https://arxiv.org/abs/2110.09075,Security,Boosting the Transferability of Video Adversarial Examples via Temporal Translation.,"Although deep-learning based video recognition models have achieved remarkable success, they are vulnerable to adversarial examples that are generated by adding human-imperceptible perturbations on clean video samples. As indicated in recent studies, adversarial examples are transferable, which makes it feasible for black-box attacks in real-world applications. Nevertheless, most existing adversarial attack methods have poor transferability when attacking other video models and transfer-based attacks on video models are still unexplored. To this end, we propose to boost the transferability of video adversarial examples for black-box attacks on video recognition models. Through extensive analysis, we discover that different video recognition models rely on different discriminative temporal patterns, leading to the poor transferability of video adversarial examples. This motivates us to introduce a temporal translation attack method, which optimizes the adversarial perturbations over a set of temporal translated video clips. By generating adversarial examples over translated videos, the resulting adversarial examples are less sensitive to temporal patterns existed in the white-box model being attacked and thus can be better transferred. Extensive experiments on the Kinetics-400 dataset and the UCF-101 dataset demonstrate that our method can significantly boost the transferability of video adversarial examples. For transfer-based attack against video recognition models, it achieves a 61.56% average attack success rate on the Kinetics-400 and 48.60% on the UCF-101. Code is available at this https URL.",[],[],"['Zhipeng Wei', 'Jingjing Chen', 'Zuxuan Wu', 'Yu-Gang Jiang']",[],[]
https://arxiv.org/abs/2109.04176,Security,Towards Transferable Adversarial Attacks on Vision Transformers.,"Vision transformers (ViTs) have demonstrated impressive performance on a series of computer vision tasks, yet they still suffer from adversarial examples. % crafted in a similar fashion as CNNs. In this paper, we posit that adversarial attacks on transformers should be specially tailored for their architecture, jointly considering both patches and self-attention, in order to achieve high transferability. More specifically, we introduce a dual attack framework, which contains a Pay No Attention (PNA) attack and a PatchOut attack, to improve the transferability of adversarial samples across different ViTs. We show that skipping the gradients of attention during backpropagation can generate adversarial examples with high transferability. In addition, adversarial perturbations generated by optimizing randomly sampled subsets of patches at each iteration achieve higher attack success rates than attacks using all patches. We evaluate the transferability of attacks on state-of-the-art ViTs, CNNs and robustly trained CNNs. The results of these experiments demonstrate that the proposed dual attack can greatly boost transferability between ViTs and from ViTs to CNNs. In addition, the proposed method can easily be combined with existing transfer methods to boost performance. Code is available at this https URL.",[],[],"['Zhipeng Wei', 'Jingjing Chen', 'Micah Goldblum', 'Zuxuan Wu', 'Tom Goldstein', 'Yu-Gang Jiang']",[],[]
https://arxiv.org/abs/2212.14230,Security,Patch Diffusion: A General Module for Face Manipulation Detection.,"Face manipulation detection has been receiving a lot of attention for the reliability and security of the face images. Recent studies focus on using auxiliary information or prior knowledge to capture robust manipulation traces, which are shown to be promising. As one of the important face features, the face depth map, which has shown to be effective in other areas such as the face recognition or face detection, is unfortunately paid little attention to in literature for detecting the manipulated face images. In this paper, we explore the possibility of incorporating the face depth map as auxiliary information to tackle the problem of face manipulation detection in real world applications. To this end, we first propose a Face Depth Map Transformer (FDMT) to estimate the face depth map patch by patch from a RGB face image, which is able to capture the local depth anomaly created due to manipulation. The estimated face depth map is then considered as auxiliary information to be integrated with the backbone features using a Multi-head Depth Attention (MDA) mechanism that is newly designed. Various experiments demonstrate the advantage of our proposed method for face manipulation detection.",[],[],"['Haoyue Wang', 'Meiling Li', 'Sheng Li', 'Zhenxing Qian', 'Xinpeng Zhang']",[],[]
https://arxiv.org/abs/2007.03838,Security,Making Adversarial Examples More Transferable and Indistinguishable.,"Fast gradient sign attack series are popular methods that are used to generate adversarial examples. However, most of the approaches based on fast gradient sign attack series cannot balance the indistinguishability and transferability due to the limitations of the basic sign structure. To address this problem, we propose a method, called Adam Iterative Fast Gradient Tanh Method (AI-FGTM), to generate indistinguishable adversarial examples with high transferability. Besides, smaller kernels and dynamic step size are also applied to generate adversarial examples for further increasing the attack success rates. Extensive experiments on an ImageNet-compatible dataset show that our method generates more indistinguishable adversarial examples and achieves higher attack success rates without extra running time and resource. Our best transfer-based attack NI-TI-DI-AITM can fool six classic defense models with an average success rate of 89.3% and three advanced defense models with an average success rate of 82.7%, which are higher than the state-of-the-art gradient-based attacks. Additionally, our method can also reduce nearly 20% mean perturbation. We expect that our method will serve as a new baseline for generating adversarial examples with better transferability and indistinguishability.",[],[],"['Junhua Zou', 'Yexin Duan', 'Boyu Li', 'Wu Zhang', 'Yu Pan', 'Zhisong Pan']",[],[]
https://arxiv.org/abs/2109.06332,Security,Achieving Zero Constraint Violation for Constrained Reinforcement Learning via Primal-Dual Approach.,"Reinforcement learning is widely used in applications where one needs to perform sequential decisions while interacting with the environment. The problem becomes more challenging when the decision requirement includes satisfying some safety constraints. The problem is mathematically formulated as constrained Markov decision process (CMDP). In the literature, various algorithms are available to solve CMDP problems in a model-free manner to achieve $\epsilon$-optimal cumulative reward with $\epsilon$ feasible policies. An $\epsilon$-feasible policy implies that it suffers from constraint violation. An important question here is whether we can achieve $\epsilon$-optimal cumulative reward with zero constraint violations or not. To achieve that, we advocate the use of randomized primal-dual approach to solve the CMDP problems and propose a conservative stochastic primal-dual algorithm (CSPDA) which is shown to exhibit $\tilde{\mathcal{O}}\left(1/\epsilon^2\right)$ sample complexity to achieve $\epsilon$-optimal cumulative reward with zero constraint violations. In the prior works, the best available sample complexity for the $\epsilon$-optimal policy with zero constraint violation is $\tilde{\mathcal{O}}\left(1/\epsilon^5\right)$. Hence, the proposed algorithm provides a significant improvement as compared to the state of the art.",[],[],"['Qinbo Bai', 'Amrit Singh Bedi', 'Mridul Agarwal', 'Alec Koppel', 'Vaneet Aggarwal']",[],[]
https://arxiv.org/abs/2310.09574,Security,The SoftCumulative Constraint with Quadratic Penalty.,"Recent advances in constrained reinforcement learning (RL) have endowed reinforcement learning with certain safety guarantees. However, deploying existing constrained RL algorithms in continuous control tasks with general hard constraints remains challenging, particularly in those situations with non-convex hard constraints. Inspired by the generalized reduced gradient (GRG) algorithm, a classical constrained optimization technique, we propose a reduced policy optimization (RPO) algorithm that combines RL with GRG to address general hard constraints. RPO partitions actions into basic actions and nonbasic actions following the GRG method and outputs the basic actions via a policy network. Subsequently, RPO calculates the nonbasic actions by solving equations based on equality constraints using the obtained basic actions. The policy network is then updated by implicitly differentiating nonbasic actions with respect to basic actions. Additionally, we introduce an action projection procedure based on the reduced gradient and apply a modified Lagrangian relaxation technique to ensure inequality constraints are satisfied. To the best of our knowledge, RPO is the first attempt that introduces GRG to RL as a way of efficiently handling both equality and inequality hard constraints. It is worth noting that there is currently a lack of RL environments with complex hard constraints, which motivates us to develop three new benchmarks: two robotics manipulation tasks and a smart grid operation control task. With these benchmarks, RPO achieves better performance than previous constrained RL algorithms in terms of both cumulative reward and constraint violation. We believe RPO, along with the new benchmarks, will open up new opportunities for applying RL to real-world problems with complex constraints.",[],[],"['Shutong Ding', 'Jingya Wang', 'Yali Du', 'Ye Shi']",[],[]
https://arxiv.org/abs/2201.08193,Security,TextHoaxer: Budgeted Hard-Label Adversarial Attacks on Text.,"Existing textual adversarial attacks usually utilize the gradient or prediction confidence to generate adversarial examples, making it hard to be deployed in real-world applications. To this end, we consider a rarely investigated but more rigorous setting, namely hard-label attack, in which the attacker can only access the prediction label. In particular, we find we can learn the importance of different words via the change on prediction label caused by word substitutions on the adversarial examples. Based on this observation, we propose a novel adversarial attack, termed Text Hard-label attacker (TextHacker). TextHacker randomly perturbs lots of words to craft an adversarial example. Then, TextHacker adopts a hybrid local search algorithm with the estimation of word importance from the attack history to minimize the adversarial perturbation. Extensive evaluations for text classification and textual entailment show that TextHacker significantly outperforms existing hard-label attacks regarding the attack performance as well as adversary quality.",[],[],"['Zhen Yu', 'Xiaosen Wang', 'Wanxiang Che', 'Kun He']",[],[]
https://arxiv.org/abs/2109.12846,Security,HAGEN: Homophily-Aware Graph Convolutional Recurrent Network for Crime Forecasting.,"The crime forecasting is an important problem as it greatly contributes to urban safety. Typically, the goal of the problem is to predict different types of crimes for each geographical region (like a neighborhood or censor tract) in the near future. Since nearby regions usually have similar socioeconomic characteristics which indicate similar crime patterns, recent state-of-the-art solutions constructed a distance-based region graph and utilized Graph Neural Network (GNN) techniques for crime forecasting, because the GNN techniques could effectively exploit the latent relationships between neighboring region nodes in the graph. However, this distance-based pre-defined graph cannot fully capture crime correlation between regions that are far from each other but share similar crime patterns. Hence, to make an accurate crime prediction, the main challenge is to learn a better graph that reveals the dependencies between regions in crime occurrences and meanwhile captures the temporal patterns from historical crime records. To address these challenges, we propose an end-to-end graph convolutional recurrent network called HAGEN with several novel designs for crime prediction. Specifically, our framework could jointly capture the crime correlation between regions and the temporal crime dynamics by combining an adaptive region graph learning module with the Diffusion Convolution Gated Recurrent Unit (DCGRU). Based on the homophily assumption of GNN, we propose a homophily-aware constraint to regularize the optimization of the region graph so that neighboring region nodes on the learned graph share similar crime patterns, thus fitting the mechanism of diffusion convolution. It also incorporates crime embedding to model the interdependencies between regions and crime categories. Empirical experiments and comprehensive analysis on two real-world datasets showcase the effectiveness of HAGEN.",[],[],"['Chenyu Wang', 'Zongyu Lin', 'Xiaochen Yang', 'Jiao Sun', 'Mingxuan Yue', 'Cyrus Shahabi']",[],[]
https://arxiv.org/abs/2012.02486,Security,Unsupervised Adversarially Robust Representation Learning on Graphs.,"Unsupervised/self-supervised pre-training methods for graph representation learning have recently attracted increasing research interests, and they are shown to be able to generalize to various downstream applications. Yet, the adversarial robustness of such pre-trained graph learning models remains largely unexplored. More importantly, most existing defense techniques designed for end-to-end graph representation learning methods require pre-specified label definitions, and thus cannot be directly applied to the pre-training methods. In this paper, we propose an unsupervised defense technique to robustify pre-trained deep graph models, so that the perturbations on the input graph can be successfully identified and blocked before the model is applied to different downstream tasks. Specifically, we introduce a mutual information-based measure, \textit{graph representation vulnerability (GRV)}, to quantify the robustness of graph encoders on the representation space. We then formulate an optimization problem to learn the graph representation by carefully balancing the trade-off between the expressive power and the robustness (\emph{i.e.}, GRV) of the graph encoder. The discrete nature of graph topology and the joint space of graph data make the optimization problem intractable to solve. To handle the above difficulty and to reduce computational expense, we further relax the problem and thus provide an approximate solution. Additionally, we explore a provable connection between the robustness of the unsupervised graph encoder and that of models on downstream tasks. Extensive experiments demonstrate that even without access to labels and tasks, our model is still able to enhance robustness against adversarial attacks on three downstream tasks (node classification, link prediction, and community detection) by an average of +16.5% compared with existing methods.",[],[],"['Jiarong Xu', 'Yang Yang', 'Junru Chen', 'Chunping Wang', 'Xin Jiang', 'Jiangang Lu', 'Yizhou Sun']",[],[]
https://arxiv.org/abs/2012.06757,Security,Blindfolded Attackers Still Threatening: Strict Black-Box Adversarial Attacks on Graphs.,"Adversarial attacks on graphs have attracted considerable research interests. Existing works assume the attacker is either (partly) aware of the victim model, or able to send queries to it. These assumptions are, however, unrealistic. To bridge the gap between theoretical graph attacks and real-world scenarios, in this work, we propose a novel and more realistic setting: strict black-box graph attack, in which the attacker has no knowledge about the victim model at all and is not allowed to send any queries. To design such an attack strategy, we first propose a generic graph filter to unify different families of graph-based models. The strength of attacks can then be quantified by the change in the graph filter before and after attack. By maximizing this change, we are able to find an effective attack strategy, regardless of the underlying model. To solve this optimization problem, we also propose a relaxation technique and approximation theories to reduce the difficulty as well as the computational expense. Experiments demonstrate that, even with no exposure to the model, the Macro-F1 drops 6.4% in node classification and 29.5% in graph classification, which is a significant result compared with existent works.",[],[],"['Jiarong Xu', 'Yizhou Sun', 'Xin Jiang', 'Yanhao Wang', 'Yang Yang', 'Chunping Wang', 'Jiangang Lu']",[],[]
