link,category,title,abstract,keywords,ccs_concepts,author_names,author_affiliations,author_countries
https://arxiv.org/abs/1808.00089,Fairness & Bias,Towards Composable Bias Rating of AI Systems,"A new wave of decision-support systems are being built today using AI services that draw insights from data (like text and video) and incorporate them in human-in-the-loop assistance. However, just as we expect humans to be ethical, the same expectation needs to be met by automated systems that increasingly get delegated to act on their behalf. A very important aspect of an ethical behavior is to avoid (intended, perceived, or accidental) bias. Bias occurs when the data distribution is not representative enough of the natural phenomenon one wants to model and reason about. The possibly biased behavior of a service is hard to detect and handle if the AI service is merely being used and not developed from scratch, since the training data set is not available. In this situation, we envisage a 3rd party rating agency that is independent of the API producer or consumer and has its own set of biased and unbiased data, with customizable distributions. We propose a 2-step rating approach that generates bias ratings signifying whether the AI service is unbiased compensating, data-sensitive biased, or biased. The approach also works on composite services. We implement it in the context of text translation and report interesting results.",[],[],"['Biplav Srivastava', 'Francesca Rossi']",[],[]
https://arxiv.org/abs/2008.13404,Privacy & Data Governance, On the distinction between implicit and explicit ethical agency,"Personalization should take the human person seriously. This requires a deeper understanding of how recommender systems can shape both our self-understanding and identity. We unpack key European humanistic and philosophical ideas underlying the General Data Protection Regulation (GDPR) and propose a new paradigm of humanistic personalization. Humanistic personalization responds to the IEEE's call for Ethically Aligned Design (EAD) and is based on fundamental human capacities and values. Humanistic personalization focuses on narrative accuracy: the subjective fit between a person's self-narrative and both the input (personal data) and output of a recommender system. In doing so, we re-frame the distinction between implicit and explicit data collection as one of nonconscious (""organismic"") behavior and conscious (""reflective"") action. This distinction raises important ethical and interpretive issues related to agency, self-understanding, and political participation. Finally, we discuss how an emphasis on narrative accuracy can reduce opportunities for epistemic injustice done to data subjects.",[],[],"['Travis Greene', 'Galit Shmueli']","['Western Norway University of Applied Sciences, Bergen, Norway', 'University of Bergen, Bergen, Norway', 'University of Bergen, Bergen, Norway']","['Norway', 'Norway', 'Norway']"
https://arxiv.org/abs/2212.14736,Privacy & Data Governance,Privacy-preserving Machine Learning Based Data Analytics on Edge Devices,"Consumer healthcare Internet of Things (IoT) devices are gaining popularity in our homes and hospitals. These devices provide continuous monitoring at a low cost and can be used to augment high-precision medical equipment. However, major challenges remain in applying pre-trained global models for anomaly detection on smart health monitoring, for a diverse set of individuals that they provide care for. In this paper, we propose PRISM, an edge-based system for experimenting with in-home smart healthcare devices. We develop a rigorous methodology that relies on automated IoT experimentation. We use a rich real-world dataset from in-home patient monitoring from 44 households of People Living With Dementia (PLWD) over two years. Our results indicate that anomalies can be identified with accuracy up to 99% and mean training times as low as 0.88 seconds. While all models achieve high accuracy when trained on the same patient, their accuracy degrades when evaluated on different patients.",[],[],"['Savvas Hadjixenophontos', 'Anna Maria Mandalari', 'Yuchen Zhao', 'Hamed Haddadi']","['University of Cambridge, Cambridge, United Kingdom', 'University of Cambridge, Cambridge, United Kingdom', 'University of Cambridge, Cambridge, United Kingdom', 'University of Cambridge, Cambridge, United Kingdom']","['United Kingdom', 'United Kingdom', 'United Kingdom', 'United Kingdom']"
https://arxiv.org/abs/2308.16538,Privacy & Data Governance, Opportunities and Challenges for Artificial Intelligence in India,"This report examines Artificial Intelligence (AI) in the financial sector, outlining its potential to revolutionise the industry and identify its challenges. It underscores the criticality of a well-rounded understanding of AI, its capabilities, and its implications to effectively leverage its potential while mitigating associated risks. The potential of AI potential extends from augmenting existing operations to paving the way for novel applications in the finance sector. The application of AI in the financial sector is transforming the industry. Its use spans areas from customer service enhancements, fraud detection, and risk management to credit assessments and high-frequency trading. However, along with these benefits, AI also presents several challenges. These include issues related to transparency, interpretability, fairness, accountability, and trustworthiness. The use of AI in the financial sector further raises critical questions about data privacy and security. A further issue identified in this report is the systemic risk that AI can introduce to the financial sector. Being prone to errors, AI can exacerbate existing systemic risks, potentially leading to financial crises. Regulation is crucial to harnessing the benefits of AI while mitigating its potential risks. Despite the global recognition of this need, there remains a lack of clear guidelines or legislation for AI use in finance. This report discusses key principles that could guide the formation of effective AI regulation in the financial sector, including the need for a risk-based approach, the inclusion of ethical considerations, and the importance of maintaining a balance between innovation and consumer protection. The report provides recommendations for academia, the finance industry, and regulators.",[],[],"['Carsten Maple', 'Lukasz Szpruch', 'Gregory Epiphaniou', 'Kalina Staykova', 'Simran Singh', 'William Penwarden', 'Yisi Wen', 'Zijian Wang', 'Jagdish Hariharan', 'Pavle Avramovic']","['Indian Institute of Technology Bombay, Mumbai, India', 'Embrace Innovations, Bangalore, India', ""King's College London, London, United Kingdom"", 'Rao Law Chambers, Azim Premji University, Bangalore, India']","['India', 'India', 'United Kingdom', 'India']"
https://arxiv.org/abs/1803.02852,Security,"Value Alignment, Fair Play, and the Rights of Service Robots","Ethics and safety research in artificial intelligence is increasingly framed in terms of ""alignment"" with human values and interests. I argue that Turing's call for ""fair play for machines"" is an early and often overlooked contribution to the alignment literature. Turing's appeal to fair play suggests a need to correct human behavior to accommodate our machines, a surprising inversion of how value alignment is treated today. Reflections on ""fair play"" motivate a novel interpretation of Turing's notorious ""imitation game"" as a condition not of intelligence but instead of value alignment: a machine demonstrates a minimal degree of alignment (with the norms of conversation, for instance) when it can go undetected when interrogated by a human. I carefully distinguish this interpretation from the Moral Turing Test, which is not motivated by a principle of fair play, but instead depends on imitation of human moral behavior. Finally, I consider how the framework of fair play can be used to situate the debate over robot rights within the alignment literature. I argue that extending rights to service robots operating in public spaces is ""fair"" in precisely the sense that it encourages an alignment of interests between humans and machines.",[],[],['Daniel Estrada'],[],[]
https://arxiv.org/abs/2203.02662,Security,Regulating for ânormal AI accidentsâ: operational lessons for the responsible governance of AI deployment,"Metaverse, as an evolving paradigm of the next-generation Internet, aims to build a fully immersive, hyper spatiotemporal, and self-sustaining virtual shared space for humans to play, work, and socialize. Driven by recent advances in emerging technologies such as extended reality, artificial intelligence, and blockchain, metaverse is stepping from science fiction to an upcoming reality. However, severe privacy invasions and security breaches (inherited from underlying technologies or emerged in the new digital ecology) of metaverse can impede its wide deployment. At the same time, a series of fundamental challenges (e.g., scalability and interoperability) can arise in metaverse security provisioning owing to the intrinsic characteristics of metaverse, such as immersive realism, hyper spatiotemporality, sustainability, and heterogeneity. In this paper, we present a comprehensive survey of the fundamentals, security, and privacy of metaverse. Specifically, we first investigate a novel distributed metaverse architecture and its key characteristics with ternary-world interactions. Then, we discuss the security and privacy threats, present the critical challenges of metaverse systems, and review the state-of-the-art countermeasures. Finally, we draw open research directions for building future metaverse systems.",[],[],"['Yuntao Wang', 'Zhou Su', 'Ning Zhang', 'Rui Xing', 'Dongxiao Liu', 'Tom H. Luan', 'Xuemin Shen']",[],[]
https://arxiv.org/abs/1711.09050,Security,Ethical Challenges in Data-Driven Dialogue Systems,"The use of dialogue systems as a medium for human-machine interaction is an increasingly prevalent paradigm. A growing number of dialogue systems use conversation strategies that are learned from large datasets. There are well documented instances where interactions with these system have resulted in biased or even offensive conversations due to the data-driven training process. Here, we highlight potential ethical issues that arise in dialogue systems research, including: implicit biases in data-driven systems, the rise of adversarial examples, potential sources of privacy violations, safety concerns, special considerations for reinforcement learning systems, and reproducibility concerns. We also suggest areas stemming from these issues that deserve further investigation. Through this initial survey, we hope to spur research leading to robust, safe, and ethically sound dialogue systems.",[],[],"['Peter Henderson', 'Koustuv Sinha', 'Nicolas Angelard-Gontier', 'Nan Rosemary Ke', 'Genevieve Fried', 'Ryan Lowe', 'Joelle Pineau']","['McGill University, Montreal, PQ, Canada', 'McGill University, Montreal, PQ, Canada', 'McGill University, Montreal, PQ, Canada', 'Polytechnique Montréal, Montreal, PQ, Canada', 'McGill University, Montreal, PQ, Canada', 'McGill University, Montreal, PQ, Canada', 'McGill University, Montreal, PQ, Canada']","['Canada', 'Canada', 'Canada', 'Canada', 'Canada', 'Canada', 'Canada']"
https://arxiv.org/abs/2102.02928,Security,Sociotechnical Systems and Ethics in the Large,"The expansion of artificial intelligence (AI) and autonomous systems has shown the potential to generate enormous social good while also raising serious ethical and safety concerns. AI technology is increasingly adopted in transportation. A survey of various in-vehicle technologies found that approximately 64% of the respondents used a smartphone application to assist with their travel. The top-used applications were navigation and real-time traffic information systems. Among those who used smartphones during their commutes, the top-used applications were navigation and entertainment. There is a pressing need to address relevant social concerns to allow for the development of systems of intelligent agents that are informed and cognizant of ethical standards. Doing so will facilitate the responsible integration of these systems in society. To this end, we have applied Multi-Criteria Decision Analysis (MCDA) to develop a formal Multi-Attribute Impact Assessment (MAIA) questionnaire for examining the social and ethical issues associated with the uptake of AI. We have focused on the domain of autonomous vehicles (AVs) because of their imminent expansion. However, AVs could serve as a stand-in for any domain where intelligent, autonomous agents interact with humans, either on an individual level (e.g., pedestrians, passengers) or a societal level.",[],[],"['Veljko Dubljević', 'George F. List', 'Jovan Milojevich', 'Nirav Ajmeri', 'William Bauer', 'Munindar P. Singh', 'Eleni Bardaka', 'Thomas Birkland', 'Charles Edwards', 'Roger Mayer', 'Ioan Muntean', 'Thomas Powers', 'Hesham Rakha', 'Vance Ricks', 'M. Shoaib Samandar']","['Lancaster University, Lancaster, United Kingdom', 'North Carolina State University, Raleigh, NC, USA']","['United Kingdom', 'US']"
https://arxiv.org/abs/2308.16538,Security, Opportunities and Challenges for Artificial Intelligence in India,"This report examines Artificial Intelligence (AI) in the financial sector, outlining its potential to revolutionise the industry and identify its challenges. It underscores the criticality of a well-rounded understanding of AI, its capabilities, and its implications to effectively leverage its potential while mitigating associated risks. The potential of AI potential extends from augmenting existing operations to paving the way for novel applications in the finance sector. The application of AI in the financial sector is transforming the industry. Its use spans areas from customer service enhancements, fraud detection, and risk management to credit assessments and high-frequency trading. However, along with these benefits, AI also presents several challenges. These include issues related to transparency, interpretability, fairness, accountability, and trustworthiness. The use of AI in the financial sector further raises critical questions about data privacy and security. A further issue identified in this report is the systemic risk that AI can introduce to the financial sector. Being prone to errors, AI can exacerbate existing systemic risks, potentially leading to financial crises. Regulation is crucial to harnessing the benefits of AI while mitigating its potential risks. Despite the global recognition of this need, there remains a lack of clear guidelines or legislation for AI use in finance. This report discusses key principles that could guide the formation of effective AI regulation in the financial sector, including the need for a risk-based approach, the inclusion of ethical considerations, and the importance of maintaining a balance between innovation and consumer protection. The report provides recommendations for academia, the finance industry, and regulators.",[],[],"['Carsten Maple', 'Lukasz Szpruch', 'Gregory Epiphaniou', 'Kalina Staykova', 'Simran Singh', 'William Penwarden', 'Yisi Wen', 'Zijian Wang', 'Jagdish Hariharan', 'Pavle Avramovic']","['Indian Institute of Technology Bombay, Mumbai, India', 'Embrace Innovations, Bangalore, India', ""King's College London, London, United Kingdom"", 'Rao Law Chambers, Azim Premji University, Bangalore, India']","['India', 'India', 'United Kingdom', 'India']"
https://arxiv.org/abs/1801.07593,Security,Mitigating Unwanted Biases with Adversarial Learning,"Machine learning is a tool for building models that accurately represent input training data. When undesired biases concerning demographic groups are in the training data, well-trained models will reflect those biases. We present a framework for mitigating such biases by including a variable for the group of interest and simultaneously learning a predictor and an adversary. The input to the network X, here text or census data, produces a prediction Y, such as an analogy completion or income bracket, while the adversary tries to model a protected variable Z, here gender or zip code. The objective is to maximize the predictor's ability to predict Y while minimizing the adversary's ability to predict Z. Applied to analogy completion, this method results in accurate predictions that exhibit less evidence of stereotyping Z. When applied to a classification task using the UCI Adult (Census) Dataset, it results in a predictive model that does not lose much accuracy while achieving very close to equality of odds (Hardt, et al., 2016). The method is flexible and applicable to multiple definitions of fairness as well as a wide range of gradient-based learning models, including both regression and classification tasks.",[],[],"['Brian Hu Zhang', 'Blake Lemoine', 'Margaret Mitchell']","['Stanford University, Stanford, CA, USA', 'Google, Mountain View, CA, USA', 'Google, Mountain View, CA, USA']","['US', 'US', 'US']"