link,category,title,abstract,keywords,ccs_concepts,author_names,author_affiliations,author_countries
https://arxiv.org/abs/1807.03819,Fairness & Bias,Universal Transformers,"Recurrent neural networks (RNNs) sequentially process data by updating their state with each new data point, and have long been the de facto choice for sequence modeling tasks. However, their inherently sequential computation makes them slow to train. Feed-forward and convolutional architectures have recently been shown to achieve superior results on some sequence modeling tasks such as machine translation, with the added advantage that they concurrently process all inputs in the sequence, leading to easy parallelization and faster training times. Despite these successes, however, popular feed-forward sequence models like the Transformer fail to generalize in many simple tasks that recurrent models handle with ease, e.g. copying strings or even simple logical inference when the string or formula lengths exceed those observed at training time. We propose the Universal Transformer (UT), a parallel-in-time self-attentive recurrent sequence model which can be cast as a generalization of the Transformer model and which addresses these issues. UTs combine the parallelizability and global receptive field of feed-forward sequence models like the Transformer with the recurrent inductive bias of RNNs. We also add a dynamic per-position halting mechanism and find that it improves accuracy on several tasks. In contrast to the standard Transformer, under certain assumptions, UTs can be shown to be Turing-complete. Our experiments show that UTs outperform standard Transformers on a wide range of algorithmic and language understanding tasks, including the challenging LAMBADA language modeling task where UTs achieve a new state of the art, and machine translation where UTs achieve a 0.9 BLEU improvement over Transformers on the WMT14 En-De dataset.",[],[],"['Mostafa Dehghani', 'Stephan Gouws', 'Oriol Vinyals', 'Jakob Uszkoreit', 'Łukasz Kaiser']",[],[]
https://arxiv.org/abs/1807.11143,Fairness & Bias,ARM: Augment-REINFORCE-Merge Gradient for Stochastic Binary Networks,"To backpropagate the gradients through stochastic binary layers, we propose the augment-REINFORCE-merge (ARM) estimator that is unbiased, exhibits low variance, and has low computational complexity. Exploiting variable augmentation, REINFORCE, and reparameterization, the ARM estimator achieves adaptive variance reduction for Monte Carlo integration by merging two expectations via common random numbers. The variance-reduction mechanism of the ARM estimator can also be attributed to either antithetic sampling in an augmented space, or the use of an optimal anti-symmetric ""self-control"" baseline function together with the REINFORCE estimator in that augmented space. Experimental results show the ARM estimator provides state-of-the-art performance in auto-encoding variational inference and maximum likelihood estimation, for discrete latent variable models with one or multiple stochastic binary layers. Python code for reproducible research is publicly available.",[],[],"['Mingzhang Yin', 'Mingyuan Zhou']",[],[]
https://arxiv.org/abs/1809.03207,Fairness & Bias,Learning from Positive and Unlabeled Data with a Selection Bias,"Most positive and unlabeled data is subject to selection biases. The labeled examples can, for example, be selected from the positive set because they are easier to obtain or more obviously positive. This paper investigates how learning can be ena BHbled in this setting. We propose and theoretically analyze an empirical-risk-based method for incorporating the labeling mechanism. Additionally, we investigate under which assumptions learning is possible when the labeling mechanism is not fully understood and propose a practical method to enable this. Our empirical analysis supports the theoretical results and shows that taking into account the possibility of a selection bias, even when the labeling mechanism is unknown, improves the trained classifiers.",[],[],"['Jessa Bekker', 'Pieter Robberechts', 'Jesse Davis']",[],[]
https://arxiv.org/abs/1805.08522,Fairness & Bias,Deep learning generalizes because the parameter-function map is biased towards simple functions,"Deep neural networks (DNNs) generalize remarkably well without explicit regularization even in the strongly over-parametrized regime where classical learning theory would instead predict that they would severely overfit. While many proposals for some kind of implicit regularization have been made to rationalise this success, there is no consensus for the fundamental reason why DNNs do not strongly overfit. In this paper, we provide a new explanation. By applying a very general probability-complexity bound recently derived from algorithmic information theory (AIT), we argue that the parameter-function map of many DNNs should be exponentially biased towards simple functions. We then provide clear evidence for this strong simplicity bias in a model DNN for Boolean functions, as well as in much larger fully connected and convolutional networks applied to CIFAR10 and MNIST. As the target functions in many real problems are expected to be highly structured, this intrinsic simplicity bias helps explain why deep networks generalize well on real world problems. This picture also facilitates a novel PAC-Bayes approach where the prior is taken over the DNN input-output function space, rather than the more conventional prior over parameter space. If we assume that the training algorithm samples parameters close to uniformly within the zero-error region then the PAC-Bayes theorem can be used to guarantee good expected generalization for target functions producing high-likelihood training sets. By exploiting recently discovered connections between DNNs and Gaussian processes to estimate the marginal likelihood, we produce relatively tight generalization PAC-Bayes error bounds which correlate well with the true error on realistic datasets such as MNIST and CIFAR10 and for architectures including convolutional and fully connected networks.",[],[],"['Guillermo Valle-Pérez', 'Chico Q. Camargo', 'Ard A. Louis']",[],[]
https://arxiv.org/abs/1812.08999,Fairness & Bias,Feature-Wise Bias Amplification,"We study the phenomenon of bias amplification in classifiers, wherein a machine learning model learns to predict classes with a greater disparity than the underlying ground truth. We demonstrate that bias amplification can arise via an inductive bias in gradient descent methods that results in the overestimation of the importance of moderately-predictive ""weak"" features if insufficient training data is available. This overestimation gives rise to feature-wise bias amplification -- a previously unreported form of bias that can be traced back to the features of a trained model. Through analysis and experiments, we show that while some bias cannot be mitigated without sacrificing accuracy, feature-wise bias amplification can be mitigated through targeted feature selection. We present two new feature selection algorithms for mitigating bias amplification in linear models, and show how they can be adapted to convolutional neural networks efficiently. Our experiments on synthetic and real data demonstrate that these algorithms consistently lead to reduced bias without harming accuracy, in some cases eliminating predictive bias altogether while providing modest gains in accuracy.",[],[],"['Klas Leino', 'Emily Black', 'Matt Fredrikson', 'Shayak Sen', 'Anupam Datta']",[],[]
https://arxiv.org/abs/1805.08206,Fairness & Bias,Bias-Reduced Uncertainty Estimation for Deep Neural Classifiers,"We consider the problem of uncertainty estimation in the context of (non-Bayesian) deep neural classification. In this context, all known methods are based on extracting uncertainty signals from a trained network optimized to solve the classification problem at hand. We demonstrate that such techniques tend to introduce biased estimates for instances whose predictions are supposed to be highly confident. We argue that this deficiency is an artifact of the dynamics of training with SGD-like optimizers, and it has some properties similar to overfitting. Based on this observation, we develop an uncertainty estimation algorithm that selectively estimates the uncertainty of highly confident points, using earlier snapshots of the trained model, before their estimates are jittered (and way before they are ready for actual classification). We present extensive experiments indicating that the proposed algorithm provides uncertainty estimates that are consistently better than all known methods.",[],[],"['Yonatan Geifman', 'Guy Uziel', 'Ran El-Yaniv']",[],[]
https://arxiv.org/abs/1810.01566,Fairness & Bias,"Learning Particle Dynamics for Manipulating Rigid Bodies, Deformable Objects, and Fluids","Real-life control tasks involve matters of various substances---rigid or soft bodies, liquid, gas---each with distinct physical behaviors. This poses challenges to traditional rigid-body physics engines. Particle-based simulators have been developed to model the dynamics of these complex scenes; however, relying on approximation techniques, their simulation often deviates from real-world physics, especially in the long term. In this paper, we propose to learn a particle-based simulator for complex control tasks. Combining learning with particle-based systems brings in two major benefits: first, the learned simulator, just like other particle-based systems, acts widely on objects of different materials; second, the particle-based representation poses strong inductive bias for learning: particles of the same type have the same dynamics within. This enables the model to quickly adapt to new environments of unknown dynamics within a few observations. We demonstrate robots achieving complex manipulation tasks using the learned simulator, such as manipulating fluids and deformable foam, with experiments both in simulation and in the real world. Our study helps lay the foundation for robot learning of dynamic scenes with particle-based representations.",[],[],"['Yunzhu Li', 'Jiajun Wu', 'Russ Tedrake', 'Joshua B. Tenenbaum', 'Antonio Torralba']",[],[]
https://arxiv.org/abs/1810.04152,Fairness & Bias,Doubly Reparameterized Gradient Estimators for Monte Carlo Objectives,"Deep latent variable models have become a popular model choice due to the scalable learning algorithms introduced by (Kingma & Welling, 2013; Rezende et al., 2014). These approaches maximize a variational lower bound on the intractable log likelihood of the observed data. Burda et al. (2015) introduced a multi-sample variational bound, IWAE, that is at least as tight as the standard variational lower bound and becomes increasingly tight as the number of samples increases. Counterintuitively, the typical inference network gradient estimator for the IWAE bound performs poorly as the number of samples increases (Rainforth et al., 2018; Le et al., 2018). Roeder et al. (2017) propose an improved gradient estimator, however, are unable to show it is unbiased. We show that it is in fact biased and that the bias can be estimated efficiently with a second application of the reparameterization trick. The doubly reparameterized gradient (DReG) estimator does not suffer as the number of samples increases, resolving the previously raised issues. The same idea can be used to improve many recently introduced training techniques for latent variable models. In particular, we show that this estimator reduces the variance of the IWAE gradient, the reweighted wake-sleep update (RWS) (Bornschein & Bengio, 2014), and the jackknife variational inference (JVI) gradient (Nowozin, 2018). Finally, we show that this computationally efficient, unbiased drop-in gradient estimator translates to improved performance for all three objectives on several modeling tasks.",[],[],"['George Tucker', 'Dieterich Lawson', 'Shixiang Gu', 'Chris J. Maddison']",[],[]
https://arxiv.org/abs/1803.01682,Fairness & Bias,Beyond Greedy Ranking: Slate Optimization via List-CVAE,"The conventional solution to the recommendation problem greedily ranks individual document candidates by prediction scores. However, this method fails to optimize the slate as a whole, and hence, often struggles to capture biases caused by the page layout and document interdepedencies. The slate recommendation problem aims to directly find the optimally ordered subset of documents (i.e. slates) that best serve users' interests. Solving this problem is hard due to the combinatorial explosion in all combinations of document candidates and their display positions on the page. Therefore we propose a paradigm shift from the traditional viewpoint of solving a ranking problem to a direct slate generation framework. In this paper, we introduce List Conditional Variational Auto-Encoders (List-CVAE), which learns the joint distribution of documents on the slate conditioned on user responses, and directly generates full slates. Experiments on simulated and real-world data show that List-CVAE outperforms popular comparable ranking methods consistently on various scales of documents corpora.",[],[],"['Ray Jiang', 'Sven Gowal', 'Timothy A. Mann', 'Danilo J. Rezende']",[],[]
https://arxiv.org/abs/1906.09338,Privacy & Data Governance,PATE-GAN: Generating Synthetic Data with Differential Privacy Guarantees,"Recent advances in machine learning have largely benefited from the massive accessible training data. However, large-scale data sharing has raised great privacy concerns. In this work, we propose a novel privacy-preserving data Generative model based on the PATE framework (G-PATE), aiming to train a scalable differentially private data generator that preserves high generated data utility. Our approach leverages generative adversarial nets to generate data, combined with private aggregation among different discriminators to ensure strong privacy guarantees. Compared to existing approaches, G-PATE significantly improves the use of privacy budgets. In particular, we train a student data generator with an ensemble of teacher discriminators and propose a novel private gradient aggregation mechanism to ensure differential privacy on all information that flows from teacher discriminators to the student generator. In addition, with random projection and gradient discretization, the proposed gradient aggregation mechanism is able to effectively deal with high-dimensional gradient vectors. Theoretically, we prove that G-PATE ensures differential privacy for the data generator. Empirically, we demonstrate the superiority of G-PATE over prior work through extensive experiments. We show that G-PATE is the first work being able to generate high-dimensional image data with high data utility under limited privacy budgets ($\epsilon \le 1$). Our code is available at this https URL.",[],[],"['Yunhui Long', 'Boxin Wang', 'Zhuolin Yang', 'Bhavya Kailkhura', 'Aston Zhang', 'Carl A. Gunter', 'Bo Li']",[],[]
https://arxiv.org/abs/2307.02222,Privacy & Data Governance,Amortized Bayesian Meta-Learning,"Federated learning is a decentralized and privacy-preserving technique that enables multiple clients to collaborate with a server to learn a global model without exposing their private data. However, the presence of statistical heterogeneity among clients poses a challenge, as the global model may struggle to perform well on each client's specific task. To address this issue, we introduce a new perspective on personalized federated learning through Amortized Bayesian Meta-Learning. Specifically, we propose a novel algorithm called \emph{FedABML}, which employs hierarchical variational inference across clients. The global prior aims to capture representations of common intrinsic structures from heterogeneous clients, which can then be transferred to their respective tasks and aid in the generation of accurate client-specific approximate posteriors through a few local updates. Our theoretical analysis provides an upper bound on the average generalization error and guarantees the generalization performance on unseen data. Finally, several empirical results are implemented to demonstrate that \emph{FedABML} outperforms several competitive baselines.",[],[],"['Shiyu Liu', 'Shaogao Lv', 'Dun Zeng', 'Zenglin Xu', 'Hui Wang', 'Yue Yu']",[],[]
https://arxiv.org/abs/1804.07729,Security,ADef: an Iterative Algorithm to Construct Adversarial Deformations,"While deep neural networks have proven to be a powerful tool for many recognition and classification tasks, their stability properties are still not well understood. In the past, image classifiers have been shown to be vulnerable to so-called adversarial attacks, which are created by additively perturbing the correctly classified image. In this paper, we propose the ADef algorithm to construct a different kind of adversarial attack created by iteratively applying small deformations to the image, found through a gradient descent step. We demonstrate our results on MNIST with convolutional neural networks and on ImageNet with Inception-v3 and ResNet-101.",[],[],"['Rima Alaifari', 'Giovanni S. Alberti', 'Tandri Gauksson']",[],[]
https://arxiv.org/abs/1807.00374,Security,Augmented Cyclic Adversarial Learning for Low Resource Domain Adaptation,"Training a model to perform a task typically requires a large amount of data from the domains in which the task will be applied. However, it is often the case that data are abundant in some domains but scarce in others. Domain adaptation deals with the challenge of adapting a model trained from a data-rich source domain to perform well in a data-poor target domain. In general, this requires learning plausible mappings between domains. CycleGAN is a powerful framework that efficiently learns to map inputs from one domain to another using adversarial training and a cycle-consistency constraint. However, the conventional approach of enforcing cycle-consistency via reconstruction may be overly restrictive in cases where one or more domains have limited training data. In this paper, we propose an augmented cyclic adversarial learning model that enforces the cycle-consistency constraint via an external task specific model, which encourages the preservation of task-relevant content as opposed to exact reconstruction. We explore digit classification in a low-resource setting in supervised, semi and unsupervised situation, as well as high resource unsupervised. In low-resource supervised setting, the results show that our approach improves absolute performance by 14% and 4% when adapting SVHN to MNIST and vice versa, respectively, which outperforms unsupervised domain adaptation methods that require high-resource unlabeled target domain. Moreover, using only few unsupervised target data, our approach can still outperforms many high-resource unsupervised models. In speech domains, we similarly adopt a speech recognition model from each domain as the task specific model. Our approach improves absolute performance of speech recognition by 2% for female speakers in the TIMIT dataset, where the majority of training samples are from male voices.",[],[],"['Ehsan Hosseini-Asl', 'Yingbo Zhou', 'Caiming Xiong', 'Richard Socher']",[],[]
https://arxiv.org/abs/1808.02651,Security,Beyond Pixel Norm-Balls: Parametric Adversaries using an Analytically Differentiable Renderer,"Many machine learning image classifiers are vulnerable to adversarial attacks, inputs with perturbations designed to intentionally trigger misclassification. Current adversarial methods directly alter pixel colors and evaluate against pixel norm-balls: pixel perturbations smaller than a specified magnitude, according to a measurement norm. This evaluation, however, has limited practical utility since perturbations in the pixel space do not correspond to underlying real-world phenomena of image formation that lead to them and has no security motivation attached. Pixels in natural images are measurements of light that has interacted with the geometry of a physical scene. As such, we propose the direct perturbation of physical parameters that underly image formation: lighting and geometry. As such, we propose a novel evaluation measure, parametric norm-balls, by directly perturbing physical parameters that underly image formation. One enabling contribution we present is a physically-based differentiable renderer that allows us to propagate pixel gradients to the parametric space of lighting and geometry. Our approach enables physically-based adversarial attacks, and our differentiable renderer leverages models from the interactive rendering literature to balance the performance and accuracy trade-offs necessary for a memory-efficient and scalable adversarial data augmentation workflow.",[],[],"['Hsueh-Ti Derek Liu', 'Michael Tao', 'Chun-Liang Li', 'Derek Nowrouzezahrai', 'Alec Jacobson']",[],[]
https://arxiv.org/abs/1802.07896,Security,L2-Nonexpansive Neural Networks,"This paper proposes a class of well-conditioned neural networks in which a unit amount of change in the inputs causes at most a unit amount of change in the outputs or any of the internal layers. We develop the known methodology of controlling Lipschitz constants to realize its full potential in maximizing robustness, with a new regularization scheme for linear layers, new ways to adapt nonlinearities and a new loss function. With MNIST and CIFAR-10 classifiers, we demonstrate a number of advantages. Without needing any adversarial training, the proposed classifiers exceed the state of the art in robustness against white-box L2-bounded adversarial attacks. They generalize better than ordinary networks from noisy data with partially random labels. Their outputs are quantitatively meaningful and indicate levels of confidence and generalization, among other desirable properties.",[],[],"['Haifeng Qian', 'Mark N. Wegman']",[],[]
https://arxiv.org/abs/1806.00088,Security,PeerNets: Exploiting Peer Wisdom Against Adversarial Attacks,"Deep learning systems have become ubiquitous in many aspects of our lives. Unfortunately, it has been shown that such systems are vulnerable to adversarial attacks, making them prone to potential unlawful uses. Designing deep neural networks that are robust to adversarial attacks is a fundamental step in making such systems safer and deployable in a broader variety of applications (e.g. autonomous driving), but more importantly is a necessary step to design novel and more advanced architectures built on new computational paradigms rather than marginally building on the existing ones. In this paper we introduce PeerNets, a novel family of convolutional networks alternating classical Euclidean convolutions with graph convolutions to harness information from a graph of peer samples. This results in a form of non-local forward propagation in the model, where latent features are conditioned on the global structure induced by the graph, that is up to 3 times more robust to a variety of white- and black-box adversarial attacks compared to conventional architectures with almost no drop in accuracy.",[],[],"['Jan Svoboda', 'Jonathan Masci', 'Federico Monti', 'Michael M. Bronstein', 'Leonidas Guibas']",[],[]
https://arxiv.org/abs/1909.04326,Security,CAMOU: Learning Physical Vehicle Camouflages to Adversarially Attack Detectors in the Wild,"In this paper, we study physical adversarial attacks on object detectors in the wild. Previous works mostly craft instance-dependent perturbations only for rigid or planar objects. To this end, we propose to learn an adversarial pattern to effectively attack all instances belonging to the same object category, referred to as Universal Physical Camouflage Attack (UPC). Concretely, UPC crafts camouflage by jointly fooling the region proposal network, as well as misleading the classifier and the regressor to output errors. In order to make UPC effective for non-rigid or non-planar objects, we introduce a set of transformations for mimicking deformable properties. We additionally impose optimization constraint to make generated patterns look natural to human observers. To fairly evaluate the effectiveness of different physical-world attacks, we present the first standardized virtual database, AttackScenes, which simulates the real 3D world in a controllable and reproducible environment. Extensive experiments suggest the superiority of our proposed UPC compared with existing physical adversarial attackers not only in virtual environments (AttackScenes), but also in real-world physical environments. Code and dataset are available at this https URL.",[],[],"['Lifeng Huang', 'Chengying Gao', 'Yuyin Zhou', 'Cihang Xie', 'Alan Yuille', 'Changqing Zou', 'Ning Liu']",[],[]
http://arxiv.org/abs/1903.12261,Security,Benchmarking Neural Network Robustness to Common Corruptions and Perturbations,"In this paper we establish rigorous benchmarks for image classifier robustness. Our first benchmark, ImageNet-C, standardizes and expands the corruption robustness topic, while showing which classifiers are preferable in safety-critical applications. Then we propose a new dataset called ImageNet-P which enables researchers to benchmark a classifier's robustness to common perturbations. Unlike recent robustness research, this benchmark evaluates performance on common corruptions and perturbations not worst-case adversarial perturbations. We find that there are negligible changes in relative corruption robustness from AlexNet classifiers to ResNet classifiers. Afterward we discover ways to enhance corruption and perturbation robustness. We even find that a bypassed adversarial defense provides substantial common perturbation robustness. Together our benchmarks may aid future work toward networks that robustly generalize.",[],[],"['Dan Hendrycks', 'Thomas Dietterich']",[],[]
