link,category,title,abstract,keywords,ccs_concepts,author_names,author_affiliations,author_countries
https://arxiv.org/abs/2105.02693,Fairness & Bias,INVASE: Instance-wise Variable Selection using Neural Networks,"In this paper, we present an uncertainty-aware INVASE to quantify predictive confidence of healthcare problem. By introducing learnable Gaussian distributions, we lever-age their variances to measure the degree of uncertainty. Based on the vanilla INVASE, two additional modules are proposed, i.e., an uncertainty quantification module in the predictor, and a reward shaping module in the selector. We conduct extensive experiments on UCI-WDBC dataset. Notably, our method eliminates almost all predictive bias with only about 20% queries, while the uncertainty-agnostic counterpart requires nearly 100% queries. The open-source implementation with a detailed tutorial is available at this https URL.",[],[],"['Jia-Xing Zhong', 'Hongbo Zhang']",[],[]
https://arxiv.org/abs/1812.01647,Fairness & Bias,Rigorous Agent Evaluation: An Adversarial Approach to Uncover Catastrophic Failures,"This paper addresses the problem of evaluating learning systems in safety critical domains such as autonomous driving, where failures can have catastrophic consequences. We focus on two problems: searching for scenarios when learned agents fail and assessing their probability of failure. The standard method for agent evaluation in reinforcement learning, Vanilla Monte Carlo, can miss failures entirely, leading to the deployment of unsafe agents. We demonstrate this is an issue for current agents, where even matching the compute used for training is sometimes insufficient for evaluation. To address this shortcoming, we draw upon the rare event probability estimation literature and propose an adversarial evaluation approach. Our approach focuses evaluation on adversarially chosen situations, while still providing unbiased estimates of failure probabilities. The key difficulty is in identifying these adversarial situations -- since failures are rare there is little signal to drive optimization. To solve this we propose a continuation approach that learns failure modes in related but less robust agents. Our approach also allows reuse of data already collected for training the agent. We demonstrate the efficacy of adversarial evaluation on two standard domains: humanoid control and simulated driving. Experimental results show that our methods can find catastrophic failures and estimate failures rates of agents multiple orders of magnitude faster than standard evaluation schemes, in minutes to hours rather than days.",[],[],"['Jonathan Uesato', 'Ananya Kumar', 'Csaba Szepesvari', 'Tom Erez', 'Avraham Ruderman', 'Keith Anderson', 'Krishmamurthy', 'Dvijotham', 'Nicolas Heess', 'Pushmeet Kohli']",[],[]
https://arxiv.org/abs/1806.01830,Fairness & Bias,Deep reinforcement learning with relational inductive biases,"We introduce an approach for deep reinforcement learning (RL) that improves upon the efficiency, generalization capacity, and interpretability of conventional approaches through structured perception and relational reasoning. It uses self-attention to iteratively reason about the relations between entities in a scene and to guide a model-free policy. Our results show that in a novel navigation and planning task called Box-World, our agent finds interpretable solutions that improve upon baselines in terms of sample complexity, ability to generalize to more complex scenes than experienced during training, and overall performance. In the StarCraft II Learning Environment, our agent achieves state-of-the-art performance on six mini-games -- surpassing human grandmaster performance on four. By considering architectural inductive biases, our work opens new directions for overcoming important, but stubborn, challenges in deep RL.",[],[],"['Vinicius Zambaldi', 'David Raposo', 'Adam Santoro', 'Victor Bapst', 'Yujia Li', 'Igor Babuschkin', 'Karl Tuyls', 'David Reichert', 'Timothy Lillicrap', 'Edward Lockhart', 'Murray Shanahan', 'Victoria Langston', 'Razvan Pascanu', 'Matthew Botvinick', 'Oriol Vinyals', 'Peter Battaglia']",[],[]
https://arxiv.org/abs/1811.12231,Fairness & Bias,ImageNet-trained CNNs are biased towards texture; increasing shape bias improves accuracy and robustness,"Convolutional Neural Networks (CNNs) are commonly thought to recognise objects by learning increasingly complex representations of object shapes. Some recent studies suggest a more important role of image textures. We here put these conflicting hypotheses to a quantitative test by evaluating CNNs and human observers on images with a texture-shape cue conflict. We show that ImageNet-trained CNNs are strongly biased towards recognising textures rather than shapes, which is in stark contrast to human behavioural evidence and reveals fundamentally different classification strategies. We then demonstrate that the same standard architecture (ResNet-50) that learns a texture-based representation on ImageNet is able to learn a shape-based representation instead when trained on ""Stylized-ImageNet"", a stylized version of ImageNet. This provides a much better fit for human behavioural performance in our well-controlled psychophysical lab setting (nine experiments totalling 48,560 psychophysical trials across 97 observers) and comes with a number of unexpected emergent benefits such as improved object detection performance and previously unseen robustness towards a wide range of image distortions, highlighting advantages of a shape-based representation.",[],[],"['Robert Geirhos', 'Patricia Rubisch', 'Claudio Michaelis', 'Matthias Bethge', 'Felix A. Wichmann', 'Wieland Brendel']",[],[]
https://arxiv.org/abs/1811.06272,Fairness & Bias,"Woulda, Coulda, Shoulda: Counterfactually-Guided Policy Search","Learning policies on data synthesized by models can in principle quench the thirst of reinforcement learning algorithms for large amounts of real experience, which is often costly to acquire. However, simulating plausible experience de novo is a hard problem for many complex environments, often resulting in biases for model-based policy evaluation and search. Instead of de novo synthesis of data, here we assume logged, real experience and model alternative outcomes of this experience under counterfactual actions, actions that were not actually taken. Based on this, we propose the Counterfactually-Guided Policy Search (CF-GPS) algorithm for learning policies in POMDPs from off-policy experience. It leverages structural causal models for counterfactual evaluation of arbitrary policies on individual off-policy episodes. CF-GPS can improve on vanilla model-based RL algorithms by making use of available logged data to de-bias model predictions. In contrast to off-policy algorithms based on Importance Sampling which re-weight data, CF-GPS leverages a model to explicitly consider alternative outcomes, allowing the algorithm to make better use of experience data. We find empirically that these advantages translate into improved policy evaluation and search results on a non-trivial grid-world task. Finally, we show that CF-GPS generalizes the previously proposed Guided Policy Search and that reparameterization-based algorithms such Stochastic Value Gradient can be interpreted as counterfactual methods.",[],[],"['Lars Buesing', 'Theophane Weber', 'Yori Zwols', 'Sebastien Racaniere', 'Arthur Guez', 'Jean-Baptiste Lespiau', 'Nicolas Heess']",[],[]
https://arxiv.org/abs/1810.01367,Fairness & Bias,FFJORD: Free-Form Continuous Dynamics for Scalable Reversible Generative Models,"A promising class of generative models maps points from a simple distribution to a complex distribution through an invertible neural network. Likelihood-based training of these models requires restricting their architectures to allow cheap computation of Jacobian determinants. Alternatively, the Jacobian trace can be used if the transformation is specified by an ordinary differential equation. In this paper, we use Hutchinson's trace estimator to give a scalable unbiased estimate of the log-density. The result is a continuous-time invertible generative model with unbiased density estimation and one-pass sampling, while allowing unrestricted neural network architectures. We demonstrate our approach on high-dimensional density estimation, image generation, and variational inference, achieving the state-of-the-art among exact likelihood methods with efficient sampling.",[],[],"['Will Grathwohl', 'Ricky T. Q. Chen', 'Jesse Bettencourt', 'Ilya Sutskever', 'David Duvenaud']",[],[]
https://arxiv.org/abs/1807.02264,Fairness & Bias,Variance Reduction for Reinforcement Learning in Input-Driven Environments,"We consider reinforcement learning in input-driven environments, where an exogenous, stochastic input process affects the dynamics of the system. Input processes arise in many applications, including queuing systems, robotics control with disturbances, and object tracking. Since the state dynamics and rewards depend on the input process, the state alone provides limited information for the expected future returns. Therefore, policy gradient methods with standard state-dependent baselines suffer high variance during training. We derive a bias-free, input-dependent baseline to reduce this variance, and analytically show its benefits over state-dependent baselines. We then propose a meta-learning approach to overcome the complexity of learning a baseline that depends on a long sequence of inputs. Our experimental results show that across environments from queuing systems, computer networks, and MuJoCo robotic locomotion, input-dependent baselines consistently improve training stability and result in better eventual policies.",[],[],"['Hongzi Mao', 'Shaileshh Bojja Venkatakrishnan', 'Malte Schwarzkopf', 'Mohammad Alizadeh']",[],[]
https://arxiv.org/abs/1912.12345,Fairness & Bias,Synthetic Datasets for Neural Program Synthesis,"The goal of program synthesis is to automatically generate programs in a particular language from corresponding specifications, e.g. input-output behavior. Many current approaches achieve impressive results after training on randomly generated I/O examples in limited domain-specific languages (DSLs), as with string transformations in RobustFill. However, we empirically discover that applying test input generation techniques for languages with control flow and rich input space causes deep networks to generalize poorly to certain data distributions; to correct this, we propose a new methodology for controlling and evaluating the bias of synthetic data distributions over both programs and specifications. We demonstrate, using the Karel DSL and a small Calculator DSL, that training deep networks on these distributions leads to improved cross-distribution generalization performance.",[],[],"['Richard Shin', 'Neel Kant', 'Kavi Gupta', 'Christopher Bender', 'Brandon Trabucco', 'Rishabh Singh', 'Dawn Song']",[],[]
https://arxiv.org/abs/2102.10362,Fairness & Bias,Marginal Policy Gradients: A Unified Family of Estimators for Bounded Action Spaces with Applications,"Policy gradient methods can solve complex tasks but often fail when the dimensionality of the action-space or objective multiplicity grow very large. This occurs, in part, because the variance on score-based gradient estimators scales quadratically. In this paper, we address this problem through a factor baseline which exploits independence structure encoded in a novel action-target influence network. Factored policy gradients (FPGs), which follow, provide a common framework for analysing key state-of-the-art algorithms, are shown to generalise traditional policy gradients, and yield a principled way of incorporating prior knowledge of a problem domain's generative processes. We provide an analysis of the proposed estimator and identify the conditions under which variance is reduced. The algorithmic aspects of FPGs are discussed, including optimal policy factorisation, as characterised by minimum biclique coverings, and the implications for the bias-variance trade-off of incorrectly specifying the network. Finally, we demonstrate the performance advantages of our algorithm on large-scale bandit and traffic intersection problems, providing a novel contribution to the latter in the form of a spatial approximation.",[],[],"['Thomas Spooner', 'Nelson Vadori', 'Sumitra Ganesh']",[],[]
https://arxiv.org/abs/1809.02925,Fairness & Bias,Discriminator-Actor-Critic: Addressing Sample Inefficiency and Reward Bias in Adversarial Imitation Learning,"We identify two issues with the family of algorithms based on the Adversarial Imitation Learning framework. The first problem is implicit bias present in the reward functions used in these algorithms. While these biases might work well for some environments, they can also lead to sub-optimal behavior in others. Secondly, even though these algorithms can learn from few expert demonstrations, they require a prohibitively large number of interactions with the environment in order to imitate the expert for many real-world applications. In order to address these issues, we propose a new algorithm called Discriminator-Actor-Critic that uses off-policy Reinforcement Learning to reduce policy-environment interaction sample complexity by an average factor of 10. Furthermore, since our reward function is designed to be unbiased, we can apply our algorithm to many problems without making any task-specific adjustments.",[],[],"['Ilya Kostrikov', 'Kumar Krishna Agrawal', 'Debidatta Dwibedi', 'Sergey Levine', 'Jonathan Tompson']",[],[]
https://arxiv.org/abs/1810.00143,Fairness & Bias,AdaShift: Decorrelation and Convergence of Adaptive Learning Rate Methods,"Adam is shown not being able to converge to the optimal solution in certain cases. Researchers recently propose several algorithms to avoid the issue of non-convergence of Adam, but their efficiency turns out to be unsatisfactory in practice. In this paper, we provide new insight into the non-convergence issue of Adam as well as other adaptive learning rate methods. We argue that there exists an inappropriate correlation between gradient $g_t$ and the second-moment term $v_t$ in Adam ($t$ is the timestep), which results in that a large gradient is likely to have small step size while a small gradient may have a large step size. We demonstrate that such biased step sizes are the fundamental cause of non-convergence of Adam, and we further prove that decorrelating $v_t$ and $g_t$ will lead to unbiased step size for each gradient, thus solving the non-convergence problem of Adam. Finally, we propose AdaShift, a novel adaptive learning rate method that decorrelates $v_t$ and $g_t$ by temporal shifting, i.e., using temporally shifted gradient $g_{t-n}$ to calculate $v_t$. The experiment results demonstrate that AdaShift is able to address the non-convergence issue of Adam, while still maintaining a competitive performance with Adam in terms of both training speed and generalization.",[],[],"['Zhiming Zhou', 'Qingru Zhang', 'Guansong Lu', 'Hongwei Wang', 'Weinan Zhang', 'Yong Yu']",[],[]
https://arxiv.org/abs/1903.03088,Fairness & Bias,Self-Tuning Networks: Bilevel Optimization of Hyperparameters using Structured Best-Response Functions,"Hyperparameter optimization can be formulated as a bilevel optimization problem, where the optimal parameters on the training set depend on the hyperparameters. We aim to adapt regularization hyperparameters for neural networks by fitting compact approximations to the best-response function, which maps hyperparameters to optimal weights and biases. We show how to construct scalable best-response approximations for neural networks by modeling the best-response as a single network whose hidden units are gated conditionally on the regularizer. We justify this approximation by showing the exact best-response for a shallow linear network with L2-regularized Jacobian can be represented by a similar gating mechanism. We fit this model using a gradient-based hyperparameter optimization algorithm which alternates between approximating the best-response around the current hyperparameters and optimizing the hyperparameters using the approximate best-response function. Unlike other gradient-based approaches, we do not require differentiating the training loss with respect to the hyperparameters, allowing us to tune discrete hyperparameters, data augmentation hyperparameters, and dropout probabilities. Because the hyperparameters are adapted online, our approach discovers hyperparameter schedules that can outperform fixed hyperparameter values. Empirically, our approach outperforms competing hyperparameter optimization methods on large-scale deep learning problems. We call our networks, which update their own hyperparameters online during training, Self-Tuning Networks (STNs).",[],[],"['Matthew MacKay', 'Paul Vicol', 'Jon Lorraine', 'David Duvenaud', 'Roger Grosse']",[],[]
https://arxiv.org/abs/1808.00232,Fairness & Bias,Off-Policy Evaluation and Learning from Logged Bandit Feedback: Error Reduction via Surrogate Policy,"When learning from a batch of logged bandit feedback, the discrepancy between the policy to be learned and the off-policy training data imposes statistical and computational challenges. Unlike classical supervised learning and online learning settings, in batch contextual bandit learning, one only has access to a collection of logged feedback from the actions taken by a historical policy, and expect to learn a policy that takes good actions in possibly unseen contexts. Such a batch learning setting is ubiquitous in online and interactive systems, such as ad platforms and recommendation systems. Existing approaches based on inverse propensity weights, such as Inverse Propensity Scoring (IPS) and Policy Optimizer for Exponential Models (POEM), enjoy unbiasedness but often suffer from large mean squared error. In this work, we introduce a new approach named Maximum Likelihood Inverse Propensity Scoring (MLIPS) for batch learning from logged bandit feedback. Instead of using the given historical policy as the proposal in inverse propensity weights, we estimate a maximum likelihood surrogate policy based on the logged action-context pairs, and then use this surrogate policy as the proposal. We prove that MLIPS is asymptotically unbiased, and moreover, has a smaller nonasymptotic mean squared error than IPS. Such an error reduction phenomenon is somewhat surprising as the estimated surrogate policy is less accurate than the given historical policy. Results on multi-label classification problems and a large- scale ad placement dataset demonstrate the empirical effectiveness of MLIPS. Furthermore, the proposed surrogate policy technique is complementary to existing error reduction techniques, and when combined, is able to consistently boost the performance of several widely used approaches.",[],[],"['Yuan Xie', 'Boyi Liu', 'Qiang Liu', 'Zhaoran Wang', 'Yuan Zhou', 'Jian Peng']",[],[]
https://arxiv.org/abs/2212.07469,Fairness & Bias,The Comparative Power of ReLU Networks and Polynomial Kernels in the Presence of Sparse Latent Structure,"Existing analyses of neural network training often operate under the unrealistic assumption of an extremely small learning rate. This lies in stark contrast to practical wisdom and empirical studies, such as the work of J. Cohen et al. (ICLR 2021), which exhibit startling new phenomena (the ""edge of stability"" or ""unstable convergence"") and potential benefits for generalization in the large learning rate regime. Despite a flurry of recent works on this topic, however, the latter effect is still poorly understood. In this paper, we take a step towards understanding genuinely non-convex training dynamics with large learning rates by performing a detailed analysis of gradient descent for simplified models of two-layer neural networks. For these models, we provably establish the edge of stability phenomenon and discover a sharp phase transition for the step size below which the neural network fails to learn ""threshold-like"" neurons (i.e., neurons with a non-zero first-layer bias). This elucidates one possible mechanism by which the edge of stability can in fact lead to better generalization, as threshold neurons are basic building blocks with useful inductive bias for many tasks.",[],[],"['Kwangjun Ahn', 'Sébastien Bubeck', 'Sinho Chewi', 'Yin Tat Lee', 'Felipe Suarez', 'Yi Zhang']",[],[]
https://arxiv.org/abs/2101.05536,Fairness & Bias,Initialized Equilibrium Propagation for Backprop-Free Training,"Equilibrium Propagation (EP) is a biologically-inspired counterpart of Backpropagation Through Time (BPTT) which, owing to its strong theoretical guarantees and the locality in space of its learning rule, fosters the design of energy-efficient hardware dedicated to learning. In practice, however, EP does not scale to visual tasks harder than MNIST. In this work, we show that a bias in the gradient estimate of EP, inherent in the use of finite nudging, is responsible for this phenomenon and that cancelling it allows training deep ConvNets by EP, including architectures with distinct forward and backward connections. These results highlight EP as a scalable approach to compute error gradients in deep neural networks, thereby motivating its hardware implementation.",[],[],"['Axel Laborieux', 'Maxence Ernoult', 'Benjamin Scellier', 'Yoshua Bengio', 'Julie Grollier', 'Damien Querlioz']",[],[]
https://arxiv.org/abs/1810.09536,Fairness & Bias,Ordered Neurons: Integrating Tree Structures into Recurrent Neural Networks,"Natural language is hierarchically structured: smaller units (e.g., phrases) are nested within larger units (e.g., clauses). When a larger constituent ends, all of the smaller constituents that are nested within it must also be closed. While the standard LSTM architecture allows different neurons to track information at different time scales, it does not have an explicit bias towards modeling a hierarchy of constituents. This paper proposes to add such an inductive bias by ordering the neurons; a vector of master input and forget gates ensures that when a given neuron is updated, all the neurons that follow it in the ordering are also updated. Our novel recurrent architecture, ordered neurons LSTM (ON-LSTM), achieves good performance on four different tasks: language modeling, unsupervised parsing, targeted syntactic evaluation, and logical inference.",[],[],"['Yikang Shen', 'Shawn Tan', 'Alessandro Sordoni', 'Aaron Courville']",[],[]
https://arxiv.org/abs/1902.09701,Fairness & Bias,Learning Implicitly Recurrent CNNs Through Parameter Sharing,"We introduce a parameter sharing scheme, in which different layers of a convolutional neural network (CNN) are defined by a learned linear combination of parameter tensors from a global bank of templates. Restricting the number of templates yields a flexible hybridization of traditional CNNs and recurrent networks. Compared to traditional CNNs, we demonstrate substantial parameter savings on standard image classification tasks, while maintaining accuracy.Our simple parameter sharing scheme, though defined via soft weights, in practice often yields trained networks with near strict recurrent structure; with negligible side effects, they convert into networks with actual loops. Training these networks thus implicitly involves discovery of suitable recurrent architectures. Though considering only the design aspect of recurrent links, our trained networks achieve accuracy competitive with those built using state-of-the-art neural architecture search (NAS) procedures.Our hybridization of recurrent and convolutional networks may also represent a beneficial architectural bias. Specifically, on synthetic tasks which are algorithmic in nature, our hybrid networks both train faster and extrapolate better to test examples outside the span of the training set.",[],[],"['Pedro Savarese', 'Michael Maire']",[],[]
https://arxiv.org/abs/1806.05337,Fairness & Bias,Hierarchical interpretations for neural network predictions,"Deep neural networks (DNNs) have achieved impressive predictive performance due to their ability to learn complex, non-linear relationships between variables. However, the inability to effectively visualize these relationships has led to DNNs being characterized as black boxes and consequently limited their applications. To ameliorate this problem, we introduce the use of hierarchical interpretations to explain DNN predictions through our proposed method, agglomerative contextual decomposition (ACD). Given a prediction from a trained DNN, ACD produces a hierarchical clustering of the input features, along with the contribution of each cluster to the final prediction. This hierarchy is optimized to identify clusters of features that the DNN learned are predictive. Using examples from Stanford Sentiment Treebank and ImageNet, we show that ACD is effective at diagnosing incorrect predictions and identifying dataset bias. Through human experiments, we demonstrate that ACD enables users both to identify the more accurate of two DNNs and to better trust a DNN's outputs. We also find that ACD's hierarchy is largely robust to adversarial perturbations, implying that it captures fundamental aspects of the input and ignores spurious noise.",[],[],"['Chandan Singh', 'W. James Murdoch', 'Bin Yu']",[],[]
