link,category,title,abstract,keywords,ccs_concepts,author_names,author_affiliations,author_countries
https://arxiv.org/abs/2205.10423,Transparency & Explainability,Learning Protein Structure with a Differentiable Simulator,"Massive molecular simulations of drug-target proteins have been used as a tool to understand disease mechanism and develop therapeutics. This work focuses on learning a generative neural network on a structural ensemble of a drug-target protein, e.g. SARS-CoV-2 Spike protein, obtained from computationally expensive molecular simulations. Model tasks involve characterizing the distinct structural fluctuations of the protein bound to various drug molecules, as well as efficient generation of protein conformations that can serve as an complement of a molecular simulation engine. Specifically, we present a geometric autoencoder framework to learn separate latent space encodings of the intrinsic and extrinsic geometries of the protein structure. For this purpose, the proposed Protein Geometric AutoEncoder (ProGAE) model is trained on the protein contact map and the orientation of the backbone bonds of the protein. Using ProGAE latent embeddings, we reconstruct and generate the conformational ensemble of a protein at or near the experimental resolution, while gaining better interpretability and controllability in term of protein structure generation from the learned latent space. Additionally, ProGAE models are transferable to a different state of the same protein or to a new protein of different size, where only the dense layer decoding from the latent representation needs to be retrained. Results show that our geometric learning-based method enjoys both accuracy and efficiency for generating complex structural variations, charting the path toward scalable and improved approaches for analyzing and enhancing high-cost simulations of drug-target proteins.",[],[],"['N. Joseph Tatro', 'Payel Das', 'Pin-Yu Chen', 'Vijil Chenthamarakshan', 'Rongjie Lai']",[],[]
https://arxiv.org/abs/1805.06846,Transparency & Explainability,RotDCF: Decomposition of Convolutional Filters for Rotation-Equivariant Deep Networks,"Explicit encoding of group actions in deep features makes it possible for convolutional neural networks (CNNs) to handle global deformations of images, which is critical to success in many vision tasks. This paper proposes to decompose the convolutional filters over joint steerable bases across the space and the group geometry simultaneously, namely a rotation-equivariant CNN with decomposed convolutional filters (RotDCF). This decomposition facilitates computing the joint convolution, which is proved to be necessary for the group equivariance. It significantly reduces the model size and computational complexity while preserving performance, and truncation of the bases expansion serves implicitly to regularize the filters. On datasets involving in-plane and out-of-plane object rotations, RotDCF deep features demonstrate greater robustness and interpretability than regular CNNs. The stability of the equivariant representation to input variations is also proved theoretically under generic assumptions on the filters in the decomposed form. The RotDCF framework can be extended to groups other than rotations, providing a general approach which achieves both group equivariance and representation stability at a reduced model size.",[],[],"['Xiuyuan Cheng', 'Qiang Qiu', 'Robert Calderbank', 'Guillermo Sapiro']",[],[]
https://arxiv.org/abs/1806.02199,Transparency & Explainability,SOM-VAE: Interpretable Discrete Representation Learning on Time Series,"High-dimensional time series are common in many domains. Since human cognition is not optimized to work well in high-dimensional spaces, these areas could benefit from interpretable low-dimensional representations. However, most representation learning algorithms for time series data are difficult to interpret. This is due to non-intuitive mappings from data features to salient properties of the representation and non-smoothness over time. To address this problem, we propose a new representation learning framework building on ideas from interpretable discrete dimensionality reduction and deep generative modeling. This framework allows us to learn discrete representations of time series, which give rise to smooth and interpretable embeddings with superior clustering performance. We introduce a new way to overcome the non-differentiability in discrete representation learning and present a gradient-based version of the traditional self-organizing map algorithm that is more performant than the original. Furthermore, to allow for a probabilistic interpretation of our method, we integrate a Markov model in the representation space. This model uncovers the temporal transition structure, improves clustering performance even further and provides additional explanatory insights as well as a natural representation of uncertainty. We evaluate our model in terms of clustering performance and interpretability on static (Fashion-)MNIST data, a time series of linearly interpolated (Fashion-)MNIST images, a chaotic Lorenz attractor system with two macro states, as well as on a challenging real world medical time series application on the eICU data set. Our learned representations compare favorably with competitor methods and facilitate downstream tasks on the real world data.",[],[],"['Vincent Fortuin', 'Matthias Hüser', 'Francesco Locatello', 'Heiko Strathmann', 'Gunnar Rätsch']",[],[]
https://arxiv.org/abs/1904.07785,Transparency & Explainability,Graph Wavelet Neural Network,"We present graph wavelet neural network (GWNN), a novel graph convolutional neural network (CNN), leveraging graph wavelet transform to address the shortcomings of previous spectral graph CNN methods that depend on graph Fourier transform. Different from graph Fourier transform, graph wavelet transform can be obtained via a fast algorithm without requiring matrix eigendecomposition with high computational cost. Moreover, graph wavelets are sparse and localized in vertex domain, offering high efficiency and good interpretability for graph convolution. The proposed GWNN significantly outperforms previous spectral graph CNNs in the task of graph-based semi-supervised classification on three benchmark datasets: Cora, Citeseer and Pubmed.",[],[],"['Bingbing Xu', 'Huawei Shen', 'Qi Cao', 'Yunqi Qiu', 'Xueqi Cheng']",[],[]
https://arxiv.org/abs/1808.01664,Transparency & Explainability,Structured Adversarial Attack:  Towards General Implementation and Better Interpretability,"When generating adversarial examples to attack deep neural networks (DNNs), Lp norm of the added perturbation is usually used to measure the similarity between original image and adversarial example. However, such adversarial attacks perturbing the raw input spaces may fail to capture structural information hidden in the input. This work develops a more general attack model, i.e., the structured attack (StrAttack), which explores group sparsity in adversarial perturbations by sliding a mask through images aiming for extracting key spatial structures. An ADMM (alternating direction method of multipliers)-based framework is proposed that can split the original problem into a sequence of analytically solvable subproblems and can be generalized to implement other attacking methods. Strong group sparsity is achieved in adversarial perturbations even with the same level of Lp norm distortion as the state-of-the-art attacks. We demonstrate the effectiveness of StrAttack by extensive experimental results onMNIST, CIFAR-10, and ImageNet. We also show that StrAttack provides better interpretability (i.e., better correspondence with discriminative image regions)through adversarial saliency map (Papernot et al., 2016b) and class activation map(Zhou et al., 2016).",[],[],"['Kaidi Xu', 'Sijia Liu', 'Pu Zhao', 'Pin-Yu Chen', 'Huan Zhang', 'Quanfu Fan', 'Deniz Erdogmus', 'Yanzhi Wang', 'Xue Lin']",[],[]
https://arxiv.org/abs/1806.01830,Transparency & Explainability,Deep reinforcement learning with relational inductive biases,"We introduce an approach for deep reinforcement learning (RL) that improves upon the efficiency, generalization capacity, and interpretability of conventional approaches through structured perception and relational reasoning. It uses self-attention to iteratively reason about the relations between entities in a scene and to guide a model-free policy. Our results show that in a novel navigation and planning task called Box-World, our agent finds interpretable solutions that improve upon baselines in terms of sample complexity, ability to generalize to more complex scenes than experienced during training, and overall performance. In the StarCraft II Learning Environment, our agent achieves state-of-the-art performance on six mini-games -- surpassing human grandmaster performance on four. By considering architectural inductive biases, our work opens new directions for overcoming important, but stubborn, challenges in deep RL.",[],[],"['Vinicius Zambaldi', 'David Raposo', 'Adam Santoro', 'Victor Bapst', 'Yujia Li', 'Igor Babuschkin', 'Karl Tuyls', 'David Reichert', 'Timothy Lillicrap', 'Edward Lockhart', 'Murray Shanahan', 'Victoria Langston', 'Razvan Pascanu', 'Matthew Botvinick', 'Oriol Vinyals', 'Peter Battaglia']",[],[]
https://arxiv.org/abs/1810.03947,Transparency & Explainability,textTOvec: DEEP CONTEXTUALIZED NEURAL AUTOREGRESSIVE TOPIC MODELS OF LANGUAGE WITH DISTRIBUTED COMPOSITIONAL PRIOR,"We address two challenges of probabilistic topic modelling in order to better estimate the probability of a word in a given context, i.e., P(word|context): (1) No Language Structure in Context: Probabilistic topic models ignore word order by summarizing a given context as a ""bag-of-word"" and consequently the semantics of words in the context is lost. The LSTM-LM learns a vector-space representation of each word by accounting for word order in local collocation patterns and models complex characteristics of language (e.g., syntax and semantics), while the TM simultaneously learns a latent representation from the entire document and discovers the underlying thematic structure. We unite two complementary paradigms of learning the meaning of word occurrences by combining a TM (e.g., DocNADE) and a LM in a unified probabilistic framework, named as ctx-DocNADE. (2) Limited Context and/or Smaller training corpus of documents: In settings with a small number of word occurrences (i.e., lack of context) in short text or data sparsity in a corpus of few documents, the application of TMs is challenging. We address this challenge by incorporating external knowledge into neural autoregressive topic models via a language modelling approach: we use word embeddings as input of a LSTM-LM with the aim to improve the word-topic mapping on a smaller and/or short-text corpus. The proposed DocNADE extension is named as ctx-DocNADEe.We present novel neural autoregressive topic model variants coupled with neural LMs and embeddings priors that consistently outperform state-of-the-art generative TMs in terms of generalization (perplexity), interpretability (topic coherence) and applicability (retrieval and classification) over 6 long-text and 8 short-text datasets from diverse domains.",[],[],"['Pankaj Gupta', 'Yatin Chaudhary', 'Florian Buettner', 'Hinrich Schütze']",[],[]
https://arxiv.org/abs/1811.12386,Transparency & Explainability,Tree-Structured Recurrent Switching Linear Dynamical Systems for Multi-Scale Modeling,"Many real-world systems studied are governed by complex, nonlinear dynamics. By modeling these dynamics, we can gain insight into how these systems work, make predictions about how they will behave, and develop strategies for controlling them. While there are many methods for modeling nonlinear dynamical systems, existing techniques face a trade off between offering interpretable descriptions and making accurate predictions. Here, we develop a class of models that aims to achieve both simultaneously, smoothly interpolating between simple descriptions and more complex, yet also more accurate models. Our probabilistic model achieves this multi-scale property through a hierarchy of locally linear dynamics that jointly approximate global nonlinear dynamics. We call it the tree-structured recurrent switching linear dynamical system. To fit this model, we present a fully-Bayesian sampling procedure using Polya-Gamma data augmentation to allow for fast and conjugate Gibbs sampling. Through a variety of synthetic and real examples, we show how these models outperform existing methods in both interpretability and predictive capability.",[],[],"['Josue Nassar', 'Scott W. Linderman', 'Monica Bugallo', 'Il Memming Park']",[],[]
https://arxiv.org/abs/1902.09727,Transparency & Explainability,Harmonic Unpaired Image-to-image Translation,"The recent direction of unpaired image-to-image translation is on one hand very exciting as it alleviates the big burden in obtaining label-intensive pixel-to-pixel supervision, but it is on the other hand not fully satisfactory due to the presence of artifacts and degenerated transformations. In this paper, we take a manifold view of the problem by introducing a smoothness term over the sample graph to attain harmonic functions to enforce consistent mappings during the translation. We develop HarmonicGAN to learn bi-directional translations between the source and the target domains. With the help of similarity-consistency, the inherent self-consistency property of samples can be maintained. Distance metrics defined on two types of features including histogram and CNN are exploited. Under an identical problem setting as CycleGAN, without additional manual inputs and only at a small training-time cost, HarmonicGAN demonstrates a significant qualitative and quantitative improvement over the state of the art, as well as improved interpretability. We show experimental results in a number of applications including medical imaging, object transfiguration, and semantic labeling. We outperform the competing methods in all tasks, and for a medical imaging task in particular our method turns CycleGAN from a failure to a success, halving the mean-squared error, and generating images that radiologists prefer over competing methods in 95% of cases.",[],[],"['Rui Zhang', 'Tomas Pfister', 'Jia Li']",[],[]
https://arxiv.org/abs/1811.12530,Transparency & Explainability,Learning Finite State Representations of Recurrent Policy Networks,"Recurrent neural networks (RNNs) are an effective representation of control policies for a wide range of reinforcement and imitation learning problems. RNN policies, however, are particularly difficult to explain, understand, and analyze due to their use of continuous-valued memory vectors and observation features. In this paper, we introduce a new technique, Quantized Bottleneck Insertion, to learn finite representations of these vectors and features. The result is a quantized representation of the RNN that can be analyzed to improve our understanding of memory use and general behavior. We present results of this approach on synthetic environments and six Atari games. The resulting finite representations are surprisingly small in some cases, using as few as 3 discrete memory states and 10 observations for a perfect Pong policy. We also show that these finite policy representations lead to improved interpretability.",[],[],"['Anurag Koul', 'Sam Greydanus', 'Alan Fern']",[],[]
https://arxiv.org/abs/1810.07217,Transparency & Explainability,Hierarchical Generative Modeling for Controllable Speech Synthesis,"This paper proposes a neural sequence-to-sequence text-to-speech (TTS) model which can control latent attributes in the generated speech that are rarely annotated in the training data, such as speaking style, accent, background noise, and recording conditions. The model is formulated as a conditional generative model based on the variational autoencoder (VAE) framework, with two levels of hierarchical latent variables. The first level is a categorical variable, which represents attribute groups (e.g. clean/noisy) and provides interpretability. The second level, conditioned on the first, is a multivariate Gaussian variable, which characterizes specific attribute configurations (e.g. noise level, speaking rate) and enables disentangled fine-grained control over these attributes. This amounts to using a Gaussian mixture model (GMM) for the latent distribution. Extensive evaluation demonstrates its ability to control the aforementioned attributes. In particular, we train a high-quality controllable TTS model on real found data, which is capable of inferring speaker and style attributes from a noisy utterance and use it to synthesize clean speech with controllable speaking style.",[],[],"['Wei-Ning Hsu', 'Yu Zhang', 'Ron J. Weiss', 'Heiga Zen', 'Yonghui Wu', 'Yuxuan Wang', 'Yuan Cao', 'Ye Jia', 'Zhifeng Chen', 'Jonathan Shen', 'Patrick Nguyen', 'Ruoming Pang']",[],[]
https://arxiv.org/abs/2205.05871,Fairness & Bias,Overcoming the Disentanglement vs Reconstruction Trade-off via Jacobian Supervision,"Disentangled sequential autoencoders (DSAEs) represent a class of probabilistic graphical models that describes an observed sequence with dynamic latent variables and a static latent variable. The former encode information at a frame rate identical to the observation, while the latter globally governs the entire sequence. This introduces an inductive bias and facilitates unsupervised disentanglement of the underlying local and global factors. In this paper, we show that the vanilla DSAE suffers from being sensitive to the choice of model architecture and capacity of the dynamic latent variables, and is prone to collapse the static latent variable. As a countermeasure, we propose TS-DSAE, a two-stage training framework that first learns sequence-level prior distributions, which are subsequently employed to regularise the model and facilitate auxiliary objectives to promote disentanglement. The proposed framework is fully unsupervised and robust against the global factor collapse problem across a wide range of model configurations. It also avoids typical solutions such as adversarial training which usually involves laborious parameter tuning, and domain-specific data augmentation. We conduct quantitative and qualitative evaluations to demonstrate its robustness in terms of disentanglement on both artificial and real-world music audio datasets.",[],[],"['Yin-Jyun Luo', 'Sebastian Ewert', 'Simon Dixon']",[],[]
https://arxiv.org/abs/2303.15377,Fairness & Bias,Unsupervised Adversarial Image Reconstruction,"Unsupervised domain adaptive object detection is a challenging vision task where object detectors are adapted from a label-rich source domain to an unlabeled target domain. Recent advances prove the efficacy of the adversarial based domain alignment where the adversarial training between the feature extractor and domain discriminator results in domain-invariance in the feature space. However, due to the domain shift, domain discrimination, especially on low-level features, is an easy task. This results in an imbalance of the adversarial training between the domain discriminator and the feature extractor. In this work, we achieve a better domain alignment by introducing an auxiliary regularization task to improve the training balance. Specifically, we propose Adversarial Image Reconstruction (AIR) as the regularizer to facilitate the adversarial training of the feature extractor. We further design a multi-level feature alignment module to enhance the adaptation performance. Our evaluations across several datasets of challenging domain shifts demonstrate that the proposed method outperforms all previous methods, of both one- and two-stage, in most settings.",[],[],"['Kunyang Sun', 'Wei Lin', 'Haoqin Shi', 'Zhengming Zhang', 'Yongming Huang', 'Horst Bischof']",[],[]
https://arxiv.org/abs/1808.05587,Fairness & Bias,Deep Convolutional Networks as shallow Gaussian Processes,"We show that the output of a (residual) convolutional neural network (CNN) with an appropriate prior over the weights and biases is a Gaussian process (GP) in the limit of infinitely many convolutional filters, extending similar results for dense networks. For a CNN, the equivalent kernel can be computed exactly and, unlike ""deep kernels"", has very few parameters: only the hyperparameters of the original CNN. Further, we show that this kernel has two properties that allow it to be computed efficiently; the cost of evaluating the kernel for a pair of images is similar to a single forward pass through the original CNN with only one filter per layer. The kernel equivalent to a 32-layer ResNet obtains 0.84% classification error on MNIST, a new record for GPs with a comparable number of parameters.",[],[],"['Adrià Garriga-Alonso', 'Carl Edward Rasmussen', 'Laurence Aitchison']",[],[]
https://arxiv.org/abs/1808.10585,Fairness & Bias,On the Minimal Supervision for Training Any Binary Classifier from Only Unlabeled Data,"Empirical risk minimization (ERM), with proper loss function and regularization, is the common practice of supervised classification. In this paper, we study training arbitrary (from linear to deep) binary classifier from only unlabeled (U) data by ERM. We prove that it is impossible to estimate the risk of an arbitrary binary classifier in an unbiased manner given a single set of U data, but it becomes possible given two sets of U data with different class priors. These two facts answer a fundamental question---what the minimal supervision is for training any binary classifier from only U data. Following these findings, we propose an ERM-based learning method from two sets of U data, and then prove it is consistent. Experiments demonstrate the proposed method could train deep models and outperform state-of-the-art methods for learning from two sets of U data.",[],[],"['Nan Lu', 'Gang Niu', 'Aditya Krishna Menon', 'Masashi Sugiyama']",[],[]
https://arxiv.org/abs/1810.10703,Fairness & Bias,K for the Price of 1: Parameter-efficient Multi-task and Transfer Learning,"We introduce a novel method that enables parameter-efficient transfer and multi-task learning with deep neural networks. The basic approach is to learn a model patch - a small set of parameters - that will specialize to each task, instead of fine-tuning the last layer or the entire network. For instance, we show that learning a set of scales and biases is sufficient to convert a pretrained network to perform well on qualitatively different problems (e.g. converting a Single Shot MultiBox Detection (SSD) model into a 1000-class image classification model while reusing 98% of parameters of the SSD feature extractor). Similarly, we show that re-learning existing low-parameter layers (such as depth-wise convolutions) while keeping the rest of the network frozen also improves transfer-learning accuracy significantly. Our approach allows both simultaneous (multi-task) as well as sequential transfer learning. In several multi-task learning problems, despite using much fewer parameters than traditional logits-only fine-tuning, we match single-task performance.",[],[],"['Pramod Kaushik Mudrakarta', 'Mark Sandler', 'Andrey Zhmoginov', 'Andrew Howard']",[],[]
https://arxiv.org/abs/1903.09239,Fairness & Bias,Multi-Domain Adversarial Learning,"Multi-domain learning (MDL) aims at obtaining a model with minimal average risk across multiple domains. Our empirical motivation is automated microscopy data, where cultured cells are imaged after being exposed to known and unknown chemical perturbations, and each dataset displays significant experimental bias. This paper presents a multi-domain adversarial learning approach, MuLANN, to leverage multiple datasets with overlapping but distinct class sets, in a semi-supervised setting. Our contributions include: i) a bound on the average- and worst-domain risk in MDL, obtained using the H-divergence; ii) a new loss to accommodate semi-supervised multi-domain learning and domain adaptation; iii) the experimental validation of the approach, improving on the state of the art on two standard image benchmarks, and a novel bioimage dataset, Cell.",[],[],"['Alice Schoenauer-Sebag', 'Louise Heinrich', 'Marc Schoenauer', 'Michele Sebag', 'Lani F. Wu', 'Steve J. Altschuler']",[],[]
https://arxiv.org/abs/1901.06020,Fairness & Bias,GO Gradient for Expectation-Based Objectives,"Within many machine learning algorithms, a fundamental problem concerns efficient calculation of an unbiased gradient wrt parameters $\gammav$ for expectation-based objectives $\Ebb_{q_{\gammav} (\yv)} [f(\yv)]$. Most existing methods either (i) suffer from high variance, seeking help from (often) complicated variance-reduction techniques; or (ii) they only apply to reparameterizable continuous random variables and employ a reparameterization trick. To address these limitations, we propose a General and One-sample (GO) gradient that (i) applies to many distributions associated with non-reparameterizable continuous or discrete random variables, and (ii) has the same low-variance as the reparameterization trick. We find that the GO gradient often works well in practice based on only one Monte Carlo sample (although one can of course use more samples if desired). Alongside the GO gradient, we develop a means of propagating the chain rule through distributions, yielding statistical back-propagation, coupling neural networks to common random variables.",[],[],"['Yulai Cong', 'Miaoyun Zhao', 'Ke Bai', 'Lawrence Carin']",[],[]
