link,category,title,abstract,keywords,ccs_concepts,author_names,author_affiliations,author_countries
https://arxiv.org/abs/1903.09239,Security,Multi-Domain Adversarial Learning,"Multi-domain learning (MDL) aims at obtaining a model with minimal average risk across multiple domains. Our empirical motivation is automated microscopy data, where cultured cells are imaged after being exposed to known and unknown chemical perturbations, and each dataset displays significant experimental bias. This paper presents a multi-domain adversarial learning approach, MuLANN, to leverage multiple datasets with overlapping but distinct class sets, in a semi-supervised setting. Our contributions include: i) a bound on the average- and worst-domain risk in MDL, obtained using the H-divergence; ii) a new loss to accommodate semi-supervised multi-domain learning and domain adaptation; iii) the experimental validation of the approach, improving on the state of the art on two standard image benchmarks, and a novel bioimage dataset, Cell.",[],[],"['Alice Schoenauer-Sebag', 'Louise Heinrich', 'Marc Schoenauer', 'Michele Sebag', 'Lani F. Wu', 'Steve J. Altschuler']",[],[]
https://arxiv.org/abs/2212.11119,Security,RelGAN: Relational Generative Adversarial Networks for Text Generation,"This work presents a thorough review concerning recent studies and text generation advancements using Generative Adversarial Networks. The usage of adversarial learning for text generation is promising as it provides alternatives to generate the so-called ""natural"" language. Nevertheless, adversarial text generation is not a simple task as its foremost architecture, the Generative Adversarial Networks, were designed to cope with continuous information (image) instead of discrete data (text). Thus, most works are based on three possible options, i.e., Gumbel-Softmax differentiation, Reinforcement Learning, and modified training objectives. All alternatives are reviewed in this survey as they present the most recent approaches for generating text using adversarial-based techniques. The selected works were taken from renowned databases, such as Science Direct, IEEEXplore, Springer, Association for Computing Machinery, and arXiv, whereas each selected work has been critically analyzed and assessed to present its objective, methodology, and experimental results.",[],[],"['Gustavo Henrique de Rosa', 'João Paulo Papa']",[],[]
https://arxiv.org/abs/1806.03287,Security,"Slalom: Fast, Verifiable and Private Execution of Neural Networks in Trusted Hardware","As Machine Learning (ML) gets applied to security-critical or sensitive domains, there is a growing need for integrity and privacy for outsourced ML computations. A pragmatic solution comes from Trusted Execution Environments (TEEs), which use hardware and software protections to isolate sensitive computations from the untrusted software stack. However, these isolation guarantees come at a price in performance, compared to untrusted alternatives. This paper initiates the study of high performance execution of Deep Neural Networks (DNNs) in TEEs by efficiently partitioning DNN computations between trusted and untrusted devices. Building upon an efficient outsourcing scheme for matrix multiplication, we propose Slalom, a framework that securely delegates execution of all linear layers in a DNN from a TEE (e.g., Intel SGX or Sanctum) to a faster, yet untrusted, co-located processor. We evaluate Slalom by running DNNs in an Intel SGX enclave, which selectively delegates work to an untrusted GPU. For canonical DNNs (VGG16, MobileNet and ResNet variants) we obtain 6x to 20x increases in throughput for verifiable inference, and 4x to 11x for verifiable and private inference.",[],[],"['Florian Tramèr', 'Dan Boneh']",[],[]
https://arxiv.org/abs/1810.01279,Security,Adv-BNN: Improved Adversarial Defense through Robust Bayesian Neural Network,"We present a new algorithm to train a robust neural network against adversarial attacks. Our algorithm is motivated by the following two ideas. First, although recent work has demonstrated that fusing randomness can improve the robustness of neural networks (Liu 2017), we noticed that adding noise blindly to all the layers is not the optimal way to incorporate randomness. Instead, we model randomness under the framework of Bayesian Neural Network (BNN) to formally learn the posterior distribution of models in a scalable way. Second, we formulate the mini-max problem in BNN to learn the best model distribution under adversarial attacks, leading to an adversarial-trained Bayesian neural net. Experiment results demonstrate that the proposed algorithm achieves state-of-the-art performance under strong attacks. On CIFAR-10 with VGG network, our model leads to 14\% accuracy improvement compared with adversarial training (Madry 2017) and random self-ensemble (Liu 2017) under PGD attack with $0.035$ distortion, and the gap becomes even larger on a subset of ImageNet.",[],[],"['Xuanqing Liu', 'Yao Li', 'Chongruo Wu', 'Cho-Jui Hsieh']",[],[]
https://arxiv.org/abs/1809.06404,Security,Adversarial Imitation via Variational Inverse Reinforcement Learning,"We consider a problem of learning the reward and policy from expert examples under unknown dynamics. Our proposed method builds on the framework of generative adversarial networks and introduces the empowerment-regularized maximum-entropy inverse reinforcement learning to learn near-optimal rewards and policies. Empowerment-based regularization prevents the policy from overfitting to expert demonstrations, which advantageously leads to more generalized behaviors that result in learning near-optimal rewards. Our method simultaneously learns empowerment through variational information maximization along with the reward and policy under the adversarial learning formulation. We evaluate our approach on various high-dimensional complex control tasks. We also test our learned rewards in challenging transfer learning problems where training and testing environments are made to be different from each other in terms of dynamics or structure. The results show that our proposed method not only learns near-optimal rewards and policies that are matching expert behavior but also performs significantly better than state-of-the-art inverse reinforcement learning algorithms.",[],[],"['Ahmed H. Qureshi', 'Byron Boots', 'Michael C. Yip']",[],[]
https://arxiv.org/abs/1902.08412,Security,Adversarial Attacks on Graph Neural Networks via Meta Learning,"Deep learning models for graphs have advanced the state of the art on many tasks. Despite their recent success, little is known about their robustness. We investigate training time attacks on graph neural networks for node classification that perturb the discrete graph structure. Our core principle is to use meta-gradients to solve the bilevel problem underlying training-time attacks, essentially treating the graph as a hyperparameter to optimize. Our experiments show that small graph perturbations consistently lead to a strong decrease in performance for graph convolutional networks, and even transfer to unsupervised embeddings. Remarkably, the perturbations created by our algorithm can misguide the graph neural networks such that they perform worse than a simple baseline that ignores all relational information. Our attacks do not assume any knowledge about or access to the target classifiers.",[],[],"['Daniel Zügner', 'Stephan Günnemann']",[],[]
https://arxiv.org/abs/1807.07978,Security,Prior Convictions: Black-box Adversarial Attacks with Bandits and Priors,"We study the problem of generating adversarial examples in a black-box setting in which only loss-oracle access to a model is available. We introduce a framework that conceptually unifies much of the existing work on black-box attacks, and we demonstrate that the current state-of-the-art methods are optimal in a natural sense. Despite this optimality, we show how to improve black-box attacks by bringing a new element into the problem: gradient priors. We give a bandit optimization-based algorithm that allows us to seamlessly integrate any such priors, and we explicitly identify and incorporate two examples. The resulting methods use two to four times fewer queries and fail two to five times less often than the current state-of-the-art.",[],[],"['Andrew Ilyas', 'Logan Engstrom', 'Aleksander Madry']",[],[]
https://arxiv.org/abs/1904.08444,Security,Defensive Quantization: When Efficiency Meets Robustness,"Neural network quantization is becoming an industry standard to efficiently deploy deep learning models on hardware platforms, such as CPU, GPU, TPU, and FPGAs. However, we observe that the conventional quantization approaches are vulnerable to adversarial attacks. This paper aims to raise people's awareness about the security of the quantized models, and we designed a novel quantization methodology to jointly optimize the efficiency and robustness of deep learning models. We first conduct an empirical study to show that vanilla quantization suffers more from adversarial attacks. We observe that the inferior robustness comes from the error amplification effect, where the quantization operation further enlarges the distance caused by amplified noise. Then we propose a novel Defensive Quantization (DQ) method by controlling the Lipschitz constant of the network during quantization, such that the magnitude of the adversarial noise remains non-expansive during inference. Extensive experiments on CIFAR-10 and SVHN datasets demonstrate that our new quantization method can defend neural networks against adversarial examples, and even achieves superior robustness than their full-precision counterparts while maintaining the same hardware efficiency as vanilla quantization approaches. As a by-product, DQ can also improve the accuracy of quantized models without adversarial attack.",[],[],"['Ji Lin', 'Chuang Gan', 'Song Han']",[],[]
https://arxiv.org/abs/1809.02104,Security,Are adversarial examples inevitable?,"A wide range of defenses have been proposed to harden neural networks against adversarial attacks. However, a pattern has emerged in which the majority of adversarial defenses are quickly broken by new attacks. Given the lack of success at generating robust defenses, we are led to ask a fundamental question: Are adversarial attacks inevitable? This paper analyzes adversarial examples from a theoretical perspective, and identifies fundamental bounds on the susceptibility of a classifier to adversarial attacks. We show that, for certain classes of problems, adversarial examples are inescapable. Using experiments, we explore the implications of theoretical guarantees for real-world problems and discuss how factors such as dimensionality and image complexity limit a classifier's robustness against adversarial examples.",[],[],"['Ali Shafahi', 'W. Ronny Huang', 'Christoph Studer', 'Soheil Feizi', 'Tom Goldstein']",[],[]
https://arxiv.org/abs/1808.01664,Security,Structured Adversarial Attack:  Towards General Implementation and Better Interpretability,"When generating adversarial examples to attack deep neural networks (DNNs), Lp norm of the added perturbation is usually used to measure the similarity between original image and adversarial example. However, such adversarial attacks perturbing the raw input spaces may fail to capture structural information hidden in the input. This work develops a more general attack model, i.e., the structured attack (StrAttack), which explores group sparsity in adversarial perturbations by sliding a mask through images aiming for extracting key spatial structures. An ADMM (alternating direction method of multipliers)-based framework is proposed that can split the original problem into a sequence of analytically solvable subproblems and can be generalized to implement other attacking methods. Strong group sparsity is achieved in adversarial perturbations even with the same level of Lp norm distortion as the state-of-the-art attacks. We demonstrate the effectiveness of StrAttack by extensive experimental results onMNIST, CIFAR-10, and ImageNet. We also show that StrAttack provides better interpretability (i.e., better correspondence with discriminative image regions)through adversarial saliency map (Papernot et al., 2016b) and class activation map(Zhou et al., 2016).",[],[],"['Kaidi Xu', 'Sijia Liu', 'Pu Zhao', 'Pin-Yu Chen', 'Huan Zhang', 'Quanfu Fan', 'Deniz Erdogmus', 'Yanzhi Wang', 'Xue Lin']",[],[]
https://arxiv.org/abs/1806.11146,Security,Adversarial Reprogramming of Neural Networks,"Deep neural networks are susceptible to \emph{adversarial} attacks. In computer vision, well-crafted perturbations to images can cause neural networks to make mistakes such as confusing a cat with a computer. Previous adversarial attacks have been designed to degrade performance of models or cause machine learning models to produce specific outputs chosen ahead of time by the attacker. We introduce attacks that instead {\em reprogram} the target model to perform a task chosen by the attacker---without the attacker needing to specify or compute the desired output for each test-time input. This attack finds a single adversarial perturbation, that can be added to all test-time inputs to a machine learning model in order to cause the model to perform a task chosen by the adversary---even if the model was not trained to do this task. These perturbations can thus be considered a program for the new task. We demonstrate adversarial reprogramming on six ImageNet classification models, repurposing these models to perform a counting task, as well as classification tasks: classification of MNIST and CIFAR-10 examples presented as inputs to the ImageNet model.",[],[],"['Gamaleldin F. Elsayed', 'Ian Goodfellow', 'Jascha Sohl-Dickstein']",[],[]
https://arxiv.org/abs/1811.00401,Security,Excessive Invariance Causes Adversarial Vulnerability,"Despite their impressive performance, deep neural networks exhibit striking failures on out-of-distribution inputs. One core idea of adversarial example research is to reveal neural network errors under such distribution shifts. We decompose these errors into two complementary sources: sensitivity and invariance. We show deep networks are not only too sensitive to task-irrelevant changes of their input, as is well-known from epsilon-adversarial examples, but are also too invariant to a wide range of task-relevant changes, thus making vast regions in input space vulnerable to adversarial attacks. We show such excessive invariance occurs across various tasks and architecture types. On MNIST and ImageNet one can manipulate the class-specific content of almost any image without changing the hidden activations. We identify an insufficiency of the standard cross-entropy loss as a reason for these failures. Further, we extend this objective based on an information-theoretic analysis so it encourages the model to consider all task-dependent features in its decision. This provides the first approach tailored explicitly to overcome excessive invariance and resulting vulnerabilities.",[],[],"['Jörn-Henrik Jacobsen', 'Jens Behrmann', 'Richard Zemel', 'Matthias Bethge']",[],[]
https://arxiv.org/abs/1810.03756,Security,SPIGAN: Privileged Adversarial Learning from Simulation,"Deep Learning for Computer Vision depends mainly on the source of supervision.Photo-realistic simulators can generate large-scale automatically labeled syntheticdata, but introduce a domain gap negatively impacting performance. We propose anew unsupervised domain adaptation algorithm, called SPIGAN, relying on Sim-ulator Privileged Information (PI) and Generative Adversarial Networks (GAN).We use internal data from the simulator as PI during the training of a target tasknetwork. We experimentally evaluate our approach on semantic segmentation. Wetrain the networks on real-world Cityscapes and Vistas datasets, using only unla-beled real-world images and synthetic labeled data with z-buffer (depth) PI fromthe SYNTHIA dataset. Our method improves over no adaptation and state-of-the-art unsupervised domain adaptation techniques.",[],[],"['Kuan-Hui Lee', 'German Ros', 'Jie Li', 'Adrien Gaidon']",[],[]
https://arxiv.org/abs/1805.09190,Security,Towards the first adversarially robust neural network model on MNIST,"Despite much effort, deep neural networks remain highly susceptible to tiny input perturbations and even for MNIST, one of the most common toy datasets in computer vision, no neural network model exists for which adversarial perturbations are large and make semantic sense to humans. We show that even the widely recognized and by far most successful defense by Madry et al. (1) overfits on the L-infinity metric (it's highly susceptible to L2 and L0 perturbations), (2) classifies unrecognizable images with high certainty, (3) performs not much better than simple input binarization and (4) features adversarial perturbations that make little sense to humans. These results suggest that MNIST is far from being solved in terms of adversarial robustness. We present a novel robust classification model that performs analysis by synthesis using learned class-conditional data distributions. We derive bounds on the robustness and go to great length to empirically evaluate our model using maximally effective adversarial attacks by (a) applying decision-based, score-based, gradient-based and transfer-based attacks for several different Lp norms, (b) by designing a new attack that exploits the structure of our defended model and (c) by devising a novel decision-based attack that seeks to minimize the number of perturbed pixels (L0). The results suggest that our approach yields state-of-the-art robustness on MNIST against L0, L2 and L-infinity perturbations and we demonstrate that most adversarial examples are strongly perturbed towards the perceptual boundary between the original and the adversarial class.",[],[],"['Lukas Schott', 'Jonas Rauber', 'Matthias Bethge', 'Wieland Brendel']",[],[]
https://arxiv.org/abs/1905.09591,Security,A Direct Approach to Robust Deep Learning Using Adversarial Networks,"Deep neural networks have been shown to perform well in many classical machine learning problems, especially in image classification tasks. However, researchers have found that neural networks can be easily fooled, and they are surprisingly sensitive to small perturbations imperceptible to humans. Carefully crafted input images (adversarial examples) can force a well-trained neural network to provide arbitrary outputs. Including adversarial examples during training is a popular defense mechanism against adversarial attacks. In this paper we propose a new defensive mechanism under the generative adversarial network (GAN) framework. We model the adversarial noise using a generative network, trained jointly with a classification discriminative network as a minimax game. We show empirically that our adversarial network approach works well against black box attacks, with performance on par with state-of-art methods such as ensemble adversarial training and adversarial training with projected gradient descent.",[],[],"['Huaxia Wang', 'Chun-Nam Yu']",[],[]
https://arxiv.org/abs/1812.01647,Security,Rigorous Agent Evaluation: An Adversarial Approach to Uncover Catastrophic Failures,"This paper addresses the problem of evaluating learning systems in safety critical domains such as autonomous driving, where failures can have catastrophic consequences. We focus on two problems: searching for scenarios when learned agents fail and assessing their probability of failure. The standard method for agent evaluation in reinforcement learning, Vanilla Monte Carlo, can miss failures entirely, leading to the deployment of unsafe agents. We demonstrate this is an issue for current agents, where even matching the compute used for training is sometimes insufficient for evaluation. To address this shortcoming, we draw upon the rare event probability estimation literature and propose an adversarial evaluation approach. Our approach focuses evaluation on adversarially chosen situations, while still providing unbiased estimates of failure probabilities. The key difficulty is in identifying these adversarial situations -- since failures are rare there is little signal to drive optimization. To solve this we propose a continuation approach that learns failure modes in related but less robust agents. Our approach also allows reuse of data already collected for training the agent. We demonstrate the efficacy of adversarial evaluation on two standard domains: humanoid control and simulated driving. Experimental results show that our methods can find catastrophic failures and estimate failures rates of agents multiple orders of magnitude faster than standard evaluation schemes, in minutes to hours rather than days.",[],[],"['Jonathan Uesato', 'Ananya Kumar', 'Csaba Szepesvari', 'Tom Erez', 'Avraham Ruderman', 'Keith Anderson', 'Krishmamurthy', 'Dvijotham', 'Nicolas Heess', 'Pushmeet Kohli']",[],[]
https://arxiv.org/abs/1810.00740,Security,Improving the Generalization of Adversarial Training with Domain Adaptation,"By injecting adversarial examples into training data, adversarial training is promising for improving the robustness of deep learning models. However, most existing adversarial training approaches are based on a specific type of adversarial attack. It may not provide sufficiently representative samples from the adversarial domain, leading to a weak generalization ability on adversarial examples from other attacks. Moreover, during the adversarial training, adversarial perturbations on inputs are usually crafted by fast single-step adversaries so as to scale to large datasets. This work is mainly focused on the adversarial training yet efficient FGSM adversary. In this scenario, it is difficult to train a model with great generalization due to the lack of representative adversarial samples, aka the samples are unable to accurately reflect the adversarial domain. To alleviate this problem, we propose a novel Adversarial Training with Domain Adaptation (ATDA) method. Our intuition is to regard the adversarial training on FGSM adversary as a domain adaption task with limited number of target domain samples. The main idea is to learn a representation that is semantically meaningful and domain invariant on the clean domain as well as the adversarial domain. Empirical evaluations on Fashion-MNIST, SVHN, CIFAR-10 and CIFAR-100 demonstrate that ATDA can greatly improve the generalization of adversarial training and the smoothness of the learned models, and outperforms state-of-the-art methods on standard benchmark datasets. To show the transfer ability of our method, we also extend ATDA to the adversarial training on iterative attacks such as PGD-Adversial Training (PAT) and the defense performance is improved considerably.",[],[],"['Chuanbiao Song', 'Kun He', 'Liwei Wang', 'John E. Hopcroft']",[],[]
https://arxiv.org/abs/2006.04349,Security,DISTRIBUTIONAL CONCAVITY REGULARIZATION FOR GANS,"Robustness to adversarial attacks is an important concern due to the fragility of deep neural networks to small perturbations and has received an abundance of attention in recent years. Distributionally Robust Optimization (DRO), a particularly promising way of addressing this challenge, studies robustness via divergence-based uncertainty sets and has provided valuable insights into robustification strategies such as regularization. In the context of machine learning, the majority of existing results have chosen $f$-divergences, Wasserstein distances and more recently, the Maximum Mean Discrepancy (MMD) to construct uncertainty sets. We extend this line of work for the purposes of understanding robustness via regularization by studying uncertainty sets constructed with Integral Probability Metrics (IPMs) - a large family of divergences including the MMD, Total Variation and Wasserstein distances. Our main result shows that DRO under \textit{any} choice of IPM corresponds to a family of regularization penalties, which recover and improve upon existing results in the setting of MMD and Wasserstein distances. Due to the generality of our result, we show that other choices of IPMs correspond to other commonly used penalties in machine learning. Furthermore, we extend our results to shed light on adversarial generative modelling via $f$-GANs, constituting the first study of distributional robustness for the $f$-GAN objective. Our results unveil the inductive properties of the discriminator set with regards to robustness, allowing us to give positive comments for several penalty-based GAN methods such as Wasserstein-, MMD- and Sobolev-GANs. In summary, our results intimately link GANs to distributional robustness, extend previous results on DRO and contribute to our understanding of the link between regularization and robustness at large.",[],[],['Hisham Husain'],[],[]
