link,category,title,abstract,keywords,ccs_concepts,author_names,author_affiliations,author_countries
https://nips.cc/virtual/2020/poster/17097,Privacy & Data Governance,Adversarial Training is a Form of Data-dependent Operator Norm Regularization,"We establish a theoretical link between adversarial training and operator norm regularization for deep neural networks. Specifically, we prove that $l_p$-norm constrained projected gradient ascent based adversarial training with an $l_q$-norm loss on the logits of clean and perturbed inputs is equivalent to data-dependent (p, q) operator norm regularization. This fundamental connection confirms the long-standing argument that a network’s sensitivity to adversarial examples is tied to its spectral properties and hints at novel ways to robustify and defend against adversarial attacks. We provide extensive empirical evidence on state-of-the-art network architectures to support our theoretical results",[],[],"['Kevin Roth', 'Yannic Kilcher', 'Thomas Hofmann']","['Dept of Computer Science, ETH Zürich', 'Dept of Computer Science, ETH Zürich', 'Dept of Computer Science, ETH Zürich']",[]
https://nips.cc/virtual/2020/poster/18719,Privacy & Data Governance,The Autoencoding Variational Autoencoder,"Does a Variational AutoEncoder (VAE) consistently encode typical samples generated from its decoder? This paper shows that the perhaps surprising answer to this question is `No'; a (nominally trained) VAE does not necessarily amortize inference for typical samples that it is capable of generating. We study the implications of this behaviour on the learned representations and also the consequences of fixing it by introducing a notion of self consistency. Our approach hinges on an alternative construction of the variational approximation distribution to the true posterior of an extended VAE model with a Markov chain alternating between the encoder and the decoder. The method can be used to train a VAE model from scratch or given an already trained VAE, it can be run as a post processing step in an entirely self supervised way without access to the original training data. Our experimental analysis reveals that encoders trained with our self-consistency approach lead to representations that are robust (insensitive) to perturbations in the input introduced by adversarial attacks. We provide experimental results on the ColorMnist and CelebA benchmark datasets that quantify the properties of the learned representations and compare the approach with a baseline that is specifically trained for the desired property.",[],[],"['Taylan Cemgil', 'Sumedh Ghaisas', 'Krishnamurthy Dvijotham', 'Sven Gowal', 'Pushmeet Kohli']","['DeepMind', 'DeepMind', 'DeepMind', 'DeepMind', 'DeepMind']",[]
https://nips.cc/virtual/2020/poster/17515,Privacy & Data Governance,Election Coding for Distributed Learning: Protecting SignSGD against Byzantine Attacks,"Current distributed learning systems suffer from serious performance degradation under Byzantine attacks. This paper proposes Election Coding, a coding-theoretic framework to guarantee Byzantine-robustness for distributed learning algorithms based on signed stochastic gradient descent (SignSGD) that minimizes the worker-master communication load. The suggested framework explores new information-theoretic limits of finding the majority opinion when some workers could be attacked by adversary, and paves the road to implement robust and communication-efficient distributed learning algorithms. Under this framework, we construct two types of codes, random Bernoulli codes and deterministic algebraic codes, that tolerate Byzantine attacks with a controlled amount of computational redundancy and guarantee convergence in general non-convex scenarios. For the Bernoulli codes, we provide an upper bound on the error probability in estimating the signs of the true gradients, which gives useful insights into code design for Byzantine tolerance. The proposed deterministic codes are proven to perfectly tolerate arbitrary Byzantine attacks. Experiments on real datasets confirm that the suggested codes provide substantial improvement in Byzantine tolerance of distributed learning systems employing SignSGD.",[],[],"['Jy-yong Sohn', 'Dong-Jun Han', 'Beongjun Choi', 'Jaekyun Moon']",[],[]
https://nips.cc/virtual/2020/poster/17352,Privacy & Data Governance,Domain Generalization via Entropy Regularization,"Domain generalization aims to learn from multiple source domains a predictive model that can generalize to unseen target domains. One essential problem in domain generalization is to learn discriminative domain-invariant features. To arrive at this, some methods introduce a domain discriminator through adversarial learning to match the feature distributions in multiple source domains. However, adversarial training can only guarantee that the learned features have invariant marginal distributions, while the invariance of conditional distributions is more important for prediction in new domains. To ensure the conditional invariance of learned features, we propose an entropy regularization term that measures the dependency between the learned features and the class labels. Combined with the typical task-related loss, e.g., cross-entropy loss for classification, and adversarial loss for domain discrimination, our overall objective is guaranteed to learn conditional-invariant features across all source domains and thus can learn classifiers with better generalization capabilities. We demonstrate the effectiveness of our method through comparison with state-of-the-art methods on both simulated and real-world datasets. Code is available at: https://github.com/sshan-zhao/DGviaER.",[],[],"['Shanshan Zhao', 'Mingming Gong', 'Tongliang Liu', 'Huan Fu', 'Dacheng Tao']","['The University of Sydney, Australia', 'University of Melbourne, Australia', 'The University of Sydney, Australia', 'Alibaba Group, China', 'The University of Sydney, Australia']","['Australia', 'Australia', 'Australia', 'China', 'Australia']"
https://nips.cc/virtual/2020/poster/18523,Privacy & Data Governance,A game-theoretic analysis of networked system control for common-pool resource management using multi-agent reinforcement learning,"Multi-agent reinforcement learning has recently shown great promise as an approach to networked system control. Arguably, one of the most difficult and important tasks for which large scale networked system control is applicable is common-pool resource management. Crucial common-pool resources include arable land, fresh water, wetlands, wildlife, fish stock, forests and the atmosphere, of which proper management is related to some of society's greatest challenges such as food security, inequality and climate change. Here we take inspiration from a recent research program investigating the game-theoretic incentives of humans in social dilemma situations such as the well-known \textit{tragedy of the commons}. However, instead of focusing on biologically evolved human-like agents, our concern is rather to better understand the learning and operating behaviour of engineered networked systems comprising general-purpose reinforcement learning agents, subject only to nonbiological constraints such as memory, computation and communication bandwidth. Harnessing tools from empirical game-theoretic analysis, we analyse the differences in resulting solution concepts that stem from employing different information structures in the design of networked multi-agent systems. These information structures pertain to the type of information shared between agents as well as the employed communication protocol and network topology. Our analysis contributes new insights into the consequences associated with certain design choices and provides an additional dimension of comparison between systems beyond efficiency, robustness, scalability and mean control performance.",[],[],"['Arnu Pretorius', 'Scott Cameron', 'Elan van Biljon', 'Thomas Makkink', 'Shahil Mawjee', 'Jeremy du Plessis', 'Jonathan Shock', 'Alexandre Laterre', 'Karim Beguir']",[],[]
https://nips.cc/virtual/2020/poster/18461,Privacy & Data Governance,Multi-Robot Collision Avoidance under Uncertainty with Probabilistic Safety Barrier Certificates,"Safety in terms of collision avoidance for multi-robot systems is a difficult challenge under uncertainty, non-determinism, and lack of complete information. This paper aims to propose a collision avoidance method that accounts for both measurement uncertainty and motion uncertainty. In particular, we propose Probabilistic Safety Barrier Certificates (PrSBC) using Control Barrier Functions to define the space of admissible control actions that are probabilistically safe with formally provable theoretical guarantee. By formulating the chance constrained safety set into deterministic control constraints with PrSBC, the method entails minimally modifying an existing controller to determine an alternative safe controller via quadratic programming constrained to PrSBC constraints. The key advantage of the approach is that no assumptions about the form of uncertainty are required other than finite support, also enabling worst-case guarantees. We demonstrate effectiveness of the approach through experiments on realistic simulation environments.","['Algorithms -> Clustering; Algorithms -> Semi-Supervised Learning; Theory', 'Learning Theory', 'Active Learning', 'Algorithms']",[],"['Wenhao Luo', 'Wen Sun', 'Ashish Kapoor']",[],[]
https://nips.cc/virtual/2020/poster/18460,Privacy & Data Governance,Upper Confidence Primal-Dual Reinforcement Learning for CMDP with Adversarial Loss,"We consider online learning for episodic stochastically constrained Markov decision processes (CMDP), which plays a central role in ensuring the safety of reinforcement learning. Here the loss function can vary arbitrarily across the episodes, whereas both the loss received and the budget consumption are revealed at the end of each episode. Previous works solve this problem under the restrictive assumption that the transition model of the MDP is known a priori and establish regret bounds that depend polynomially on the cardinalities of the state space $\mathcal{S}$ and the action space $\mathcal{A}$. In this work, we propose a new \emph{upper confidence primal-dual} algorithm, which only requires the trajectories sampled from the transition model. In particular, we prove that the proposed algorithm achieves $\widetilde{\mathcal{O}}(L|\mathcal{S}|\sqrt{|\mathcal{A}|T})$ upper bounds of both the regret and the constraint violation, where $L$ is the length of each episode. Our analysis incorporates a new high-probability drift analysis of Lagrange multiplier processes into the celebrated regret analysis of upper confidence reinforcement learning, which demonstrates the power of   ``optimism in the face of uncertainty'' in constrained online learning",[],[],"['Shuang Qiu', 'Xiaohan Wei', 'Zhuoran Yang', 'Jieping Ye', 'Zhaoran Wang']",[],[]
https://nips.cc/virtual/2020/poster/19047,Privacy & Data Governance,PRANK: motion Prediction based on RANKing,"Predicting the motion of agents such as pedestrians or human-driven vehicles is one of the most critical problems in the autonomous driving domain. The overall safety of driving and the comfort of a passenger directly depend on its successful solution. The motion prediction problem also remains one of the most challenging problems in autonomous driving engineering, mainly due to high variance of the possible agent’s future behavior given a situation. The two phenomena responsible for the said variance are the multimodality caused by the uncertainty of the agent’s intent (e.g., turn right or move forward) and uncertainty in the realization of a given intent (e.g., which lane to turn into). To be useful within a real-time autonomous driving pipeline, a motion prediction system must provide efficient ways to describe and quantify this uncertainty, such as computing posterior modes and their probabilities or estimating density at the point corresponding to a given trajectory. It also should not put substantial density on physically impossible trajectories, as they can confuse the system processing the predictions. In this paper, we introduce the PRANK method, which satisfies these requirements. PRANK takes rasterized bird-eye images of agent’s surroundings as an input and extracts features of the scene with a convolutional neural network. It then produces the conditional distribution of agent’s trajectories plausible in the given scene. The key contribution of PRANK is a way to represent that distribution using nearest-neighbor methods in latent trajectory space, which allows for efficient inference in real time. We evaluate PRANK on the in-house and Argoverse datasets, where it shows competitive results.",[],[],"['Yuriy Biktairov', 'Maxim Stebelev', 'Irina Rudenko', 'Oleh Shliazhko', 'Boris Yangel']",[],[]
https://nips.cc/virtual/2020/poster/19034,Privacy & Data Governance,Incorporating Interpretable Output Constraints in Bayesian Neural Networks,"Domains where supervised models are deployed often come with task-specific constraints, such as prior expert knowledge on the ground-truth function, or desiderata like safety and fairness. We introduce a novel probabilistic framework for reasoning with such constraints and formulate a prior that enables us to effectively incorporate them into Bayesian neural networks (BNNs), including a variant that can be amortized over tasks. The resulting Output-Constrained BNN (OC-BNN) is fully consistent with the Bayesian framework for uncertainty quantification and is amenable to black-box inference. Unlike typical BNN inference in uninterpretable parameter space, OC-BNNs widen the range of functional knowledge that can be incorporated, especially for model users without expertise in machine learning. We demonstrate the efficacy of OC-BNNs on real-world datasets, spanning multiple domains such as healthcare, criminal justice, and credit scoring.",[],[],"['Wanqian Yang', 'Lars Lorch', 'Moritz Graule', 'Himabindu Lakkaraju', 'Finale Doshi-Velez']","['Harvard University, Cambridge, MA', 'ETH Zürich, Zürich, Switzerland', 'Harvard University, Cambridge, MA', 'Harvard University, Cambridge, MA', 'Harvard University, Cambridge, MA']",['Switzerland']
https://nips.cc/virtual/2020/poster/19008,Privacy & Data Governance,Adversarial Attacks on Deep Graph Matching,"Despite achieving remarkable performance, deep graph learning models, such as node classification and network embedding, suffer from harassment caused by small adversarial perturbations. However, the vulnerability analysis of graph matching under adversarial attacks has not been fully investigated yet. This paper proposes an adversarial attack model with two novel attack techniques to perturb the graph structure and degrade the quality of deep graph matching: (1) a kernel density estimation approach is utilized to estimate and maximize node densities to derive imperceptible perturbations, by pushing attacked nodes to dense regions in two graphs, such that they are indistinguishable from many neighbors; and (2) a meta learning-based projected gradient descent method is developed to well choose attack starting points and to improve the search performance for producing effective perturbations. We evaluate the effectiveness of the attack model on real datasets and validate that the attacks can be transferable to other graph learning models.",[],[],"['Zijie Zhang', 'Zeru Zhang', 'Yang Zhou', 'Yelong Shen', 'Ruoming Jin', 'Dejing Dou']",[],[]
https://nips.cc/virtual/2020/poster/17861,Privacy & Data Governance,Towards Safe Policy Improvement for Non-Stationary MDPs,"Many real-world sequential decision-making problems involve critical systems with financial risks and human-life risks. While several works in the past have proposed methods that are safe for deployment, they assume that the underlying problem is stationary. However, many real-world problems of interest exhibit non-stationarity, and when stakes are high, the cost associated with a false stationarity assumption may be unacceptable. We take the first steps towards ensuring safety, with high confidence, for smoothly-varying non-stationary decision problems. Our proposed method extends a type of safe algorithm, called a Seldonian algorithm, through a synthesis of model-free reinforcement learning with time-series analysis. Safety is ensured using sequential hypothesis testing of a policy’s forecasted performance, and confidence intervals are obtained using wild bootstrap.","['Applications -> Computer Vision; Deep Learning', 'Attention Models', 'Deep Learning']",[],"['Yash Chandak', 'Scott Jordan', 'Georgios Theocharous', 'Martha White', 'Philip S. Thomas']","['University of Massachusetts', 'University of Massachusetts', 'Adobe Research', 'University of Alberta & Amii', 'University of Massachusetts']",[]
https://nips.cc/virtual/2020/poster/18940,Privacy & Data Governance,De-Anonymizing Text by Fingerprinting Language Generation,"Components of machine learning systems are not (yet) perceived as security hotspots.  Secure coding practices, such as ensuring that no execution paths depend on confidential inputs, have not yet been adopted by ML developers.  We initiate the study of code security of ML systems by investigating how nucleus sampling---a popular approach for generating text, used for applications such as auto-completion---unwittingly leaks texts typed by users. Our main result is that the series of nucleus sizes for many natural English word sequences is a unique fingerprint.  We then show how an attacker can infer typed text by measuring these fingerprints via a suitable side channel (e.g., cache access times), explain how this attack could help de-anonymize anonymous texts, and discuss defenses.",[],[],"['Zhen Sun', 'Roei Schuster', 'Vitaly Shmatikov']",[],[]
https://nips.cc/virtual/2020/poster/18912,Privacy & Data Governance,Robust Deep Reinforcement Learning against Adversarial Perturbations on State Observations,"A deep reinforcement learning (DRL) agent observes its states through observations, which may contain natural measurement errors or adversarial noises. Since the observations deviate from the true states, they can mislead the agent into making suboptimal actions. Several works have shown this vulnerability via adversarial attacks, but how to improve the robustness of DRL under this setting has not been well studied. We show that naively applying existing techniques on improving robustness for classification tasks, like adversarial training, are ineffective for many RL tasks. We propose the state-adversarial Markov decision process (SA-MDP) to study the fundamental properties of this problem, and develop a theoretically principled policy regularization which can be applied to a large family of DRL algorithms, including deep deterministic policy gradient (DDPG), proximal policy optimization (PPO) and deep Q networks (DQN), for both discrete and continuous action control problems. We significantly improve the robustness of DDPG, PPO and DQN agents under a suite of strong white box adversarial attacks, including two new attacks of our own. Additionally, we find that a robust policy noticeably improves DRL performance in a number of environments.",[],[],"['Huan Zhang', 'Hongge  Chen', 'Chaowei Xiao', 'Bo Li', 'Mingyan Liu', 'Duane Boning', 'Cho-Jui Hsieh']",[],[]
https://nips.cc/virtual/2020/poster/18876,Privacy & Data Governance,Guided Adversarial Attack for Evaluating and Enhancing Adversarial Defenses,"Advances in the development of adversarial attacks have been fundamental to the progress of adversarial defense research. Efficient and effective attacks are crucial for reliable evaluation of defenses, and also for developing robust models. Adversarial attacks are often generated by maximizing standard losses such as the cross-entropy loss or maximum-margin loss within a constraint set using Projected Gradient Descent (PGD). In this work, we introduce a relaxation term to the standard loss, that finds more suitable gradient-directions, increases attack efficacy and leads to more efficient adversarial training. We propose Guided Adversarial Margin Attack (GAMA), which utilizes function mapping of the clean image to guide the generation of adversaries, thereby resulting in stronger attacks. We evaluate our attack against multiple defenses and show improved performance when compared to existing attacks. Further, we propose Guided Adversarial Training (GAT), which achieves state-of-the-art performance amongst single-step defenses by utilizing the proposed relaxation term for both attack generation and training.",[],[],"['Gaurang Sriramanan', 'Sravanti Addepalli', 'Arya Baburaj', 'Venkatesh Babu R']",[],[]
https://nips.cc/virtual/2020/poster/18150,Privacy & Data Governance,Identifying Causal-Effect Inference Failure with Uncertainty-Aware Models,"Recommending the best course of action for an individual is a major application of individual-level causal effect estimation. This application is often needed in safety-critical domains such as healthcare, where estimating and communicating uncertainty to decision-makers is crucial. We introduce a practical approach for integrating uncertainty estimation into a class of state-of-the-art neural network methods used for individual-level causal estimates. We show that our methods enable us to deal gracefully with situations of ""no-overlap"", common in high-dimensional data, where standard applications of causal effect approaches fail. Further, our methods allow us to handle covariate shift, where the train and test distributions differ, common when systems are deployed in practice. We show that when such a covariate shift occurs, correctly modeling uncertainty can keep us from giving overconfident and potentially harmful recommendations. We demonstrate our methodology with a range of state-of-the-art models. Under both covariate shift and lack of overlap, our uncertainty-equipped methods can alert decision makers when predictions are not to be trusted while outperforming standard methods that use the propensity score to identify lack of overlap.","['Theory', 'Learning Theory']",[],"['Andrew Jesson', 'Sören Mindermann', 'Uri Shalit', 'Yarin Gal']","['Department of Computer Science University of Oxford Oxford, UK', 'Department of Computer Science University of Oxford Oxford, UK', 'Technion Haifa, Israel', 'Department of Computer Science University of Oxford Oxford, UK']","['UK', 'UK', 'Israel', 'UK']"
https://nips.cc/virtual/2020/poster/18869,Privacy & Data Governance,Certifiably Adversarially Robust Detection of Out-of-Distribution Data,"Deep neural networks are known to be overconfident when applied to out-of-distribution (OOD) inputs which clearly do not belong to any class. This is a problem in safety-critical applications since a reliable assessment of the uncertainty of a classifier is a key property, allowing to trigger human intervention or to transfer into a safe state. In this paper, we are aiming for certifiable worst case guarantees for OOD detection by  enforcing not only low confidence at the OOD point but also in an $l_\infty$-ball around it. For this purpose, we use interval bound propagation (IBP) to upper bound the maximal confidence in the $l_\infty$-ball and minimize this upper bound during training time. We show that non-trivial bounds on the confidence for OOD data generalizing beyond the OOD dataset seen at training time are possible. Moreover, in contrast to certified adversarial robustness which typically comes with significant loss in prediction performance, certified guarantees for worst case OOD detection are possible without much loss in accuracy.",[],[],"['Julian Bitterwolf', 'Alexander Meinke', 'Matthias Hein']",[],[]
