link,category,title,abstract,keywords,ccs_concepts,author_names,author_affiliations,author_countries
https://nips.cc/virtual/2020/poster/17569,Fairness & Bias,Stochastic Stein Discrepancies,"Stein discrepancies (SDs) monitor convergence and non-convergence in approximate inference when exact integration and sampling are intractable. However, the computation of a Stein discrepancy can be prohibitive if the Stein operator -- often a sum over likelihood terms or potentials -- is expensive to evaluate. To address this deficiency, we show that stochastic Stein discrepancies (SSDs) based on subsampled approximations of the Stein operator inherit the convergence control properties of standard SDs with probability 1. Along the way, we establish the convergence of Stein variational gradient descent (SVGD) on unbounded domains, resolving an open question of Liu (2017). In our experiments with biased Markov chain Monte Carlo (MCMC) hyperparameter tuning, approximate MCMC sampler selection, and stochastic SVGD, SSDs deliver comparable inferences to standard SDs with orders of magnitude fewer likelihood evaluations.","['Algorithms -> Classification; Deep Learning; Deep Learning', 'Supervised Deep Networks', 'Computer Vision', 'Applications']",[],"['Jackson Gorham', 'Anant Raj', 'Lester Mackey']",[],[]
https://nips.cc/virtual/2020/poster/17803,Fairness & Bias,Debiased Contrastive Learning,"A prominent technique for self-supervised representation learning has been to contrast semantically similar and dissimilar pairs of samples. Without access to labels, dissimilar (negative) points are typically taken to be randomly sampled datapoints, implicitly accepting that these points may, in reality, actually have the same label. Perhaps unsurprisingly, we observe that sampling negative examples from truly different labels improves performance, in a synthetic setting where labels are available. Motivated by this observation, we develop a debiased contrastive objective that corrects for the sampling of same-label datapoints, even without knowledge of the true labels. Empirically, the proposed objective consistently outperforms the state-of-the-art for representation learning in vision, language, and reinforcement learning benchmarks. Theoretically, we establish generalization bounds for the downstream classification task.",[],[],"['Ching-Yao Chuang', 'Joshua Robinson', 'Yen-Chen Lin', 'Antonio Torralba', 'Stefanie Jegelka']",[],[]
https://nips.cc/virtual/2020/poster/17778,Fairness & Bias,Robustness Analysis of Non-Convex Stochastic Gradient Descent using Biased Expectations,"This work proposes a novel analysis of stochastic gradient descent (SGD) for non-convex and smooth optimization. Our analysis sheds light on the impact of the probability distribution of the gradient noise on the convergence rate of the norm of the gradient. In the case of sub-Gaussian and centered noise, we prove that, with probability $1-\delta$, the number of iterations to reach a precision $\varepsilon$ for the squared gradient norm is $O(\varepsilon^{-2}\ln(1/\delta))$. In the case of centered and integrable heavy-tailed noise, we show that, while the expectation of the iterates may be infinite, the squared gradient norm still converges with probability $1-\delta$ in $O(\varepsilon^{-p}\delta^{-q})$ iterations, where $p,q > 2$. This result shows that heavy-tailed noise on the gradient slows down the convergence of SGD without preventing it, proving that SGD is robust to gradient noise with unbounded variance, a setting of interest for Deep Learning. In addition, it indicates that choosing a step size proportional to $T^{-1/b}$ where $b$ is the tail-parameter of the noise and $T$ is the number of iterations leads to the best convergence rates. Both results are simple corollaries of a unified analysis using the novel concept of biased expectations, a simple and intuitive mathematical tool to obtain concentration inequalities. Using this concept, we propose a new quantity to measure the amount of noise added to the gradient, and discuss its value in multiple scenarios",[],[],"['Kevin Scaman', 'Cedric Malherbe']",[],[]
https://nips.cc/virtual/2020/poster/17435,Fairness & Bias,Neuron Shapley: Discovering the Responsible Neurons,"We develop Neuron Shapley as a new framework to quantify the contribution of individual neurons to the prediction and performance of a deep network. By accounting for interactions across neurons, Neuron Shapley is more effective in identifying important filters compared to common approaches based on activation patterns. Interestingly, removing just 30 filters with the highest Shapley scores effectively destroys the prediction accuracy of Inception-v3 on ImageNet. Visualization of these few critical filters provides insights into how the network functions. Neuron Shapley is a flexible framework and can be applied to identify responsible neurons in many tasks. We illustrate additional applications of identifying filters that are responsible for biased prediction in facial recognition and filters that are vulnerable to adversarial attacks. Removing these filters is a quick way to repair models. Computing exact Shapley values is computationally infeasible and therefore sampling-based approximations are used in practice. We introduce a new multi-armed bandit algorithm that is able to efficiently  detect neurons with the largest Shapley value orders of magnitude faster than existing Shapley value approximation methods.",[],[],"['Amirata Ghorbani', 'James Y. Zou']","['Department of Electrical Engineering, Stanford University, Stanford, CA', 'Department of Biomedical Data Science, Stanford University, Stanford, CA']",[]
https://nips.cc/virtual/2020/poster/17775,Fairness & Bias,Graph Meta Learning via Local Subgraphs,"Prevailing methods for graphs require abundant label and edge information for learning. When data for a new task are scarce, meta-learning can learn from prior experiences and form much-needed inductive biases for fast adaption to new tasks. Here, we introduce G-Meta, a novel meta-learning algorithm for graphs. G-Meta uses local subgraphs to transfer subgraph-specific information and learn transferable knowledge faster via meta gradients. G-Meta learns how to quickly adapt to a new task using only a handful of nodes or edges in the new task and does so by learning from data points in other graphs or related, albeit disjoint label sets. G-Meta is theoretically justified as we show that the evidence for a prediction can be found in the local subgraph surrounding the target node or edge. Experiments on seven datasets and nine baseline methods show that G-Meta outperforms existing methods by up to 16.3%. Unlike previous methods, G-Meta successfully learns in challenging, few-shot learning settings that require generalization to completely new graphs and never-before-seen labels. Finally, G-Meta scales to large graphs, which we demonstrate on a new Tree-of-Life dataset comprising of 1,840 graphs, a two-orders of magnitude increase in the number of graphs used in prior work. ",[],[],"['Kexin Huang', 'Marinka Zitnik']","['Harvard University', 'Harvard University']",[]
https://nips.cc/virtual/2020/poster/17733,Fairness & Bias,Balanced Meta-Softmax for Long-Tailed Visual Recognition,"Deep classifiers have achieved great success in visual recognition. However, real-world data is long-tailed by nature, leading to the mismatch between training and testing distributions. In this paper, we show that the Softmax function, though used in most classification tasks, gives a biased gradient estimation under the long-tailed setup. This paper presents Balanced Softmax, an elegant unbiased extension of Softmax, to accommodate the label distribution shift between training and testing. Theoretically, we derive the generalization bound for multiclass Softmax regression and show our loss minimizes the bound. In addition, we introduce Balanced Meta-Softmax, applying a complementary Meta Sampler to estimate the optimal class sample rate and further improve long-tailed learning. In our experiments, we demonstrate that Balanced Meta-Softmax outperforms state-of-the-art long-tailed classification solutions on both visual recognition and instance segmentation tasks.",[],[],"['Jiawei Ren', 'Cunjun Yu', 'shunan sheng', 'Xiao Ma', 'Haiyu Zhao', 'Shuai Yi', 'hongsheng Li']",[],[]
https://nips.cc/virtual/2020/poster/17726,Fairness & Bias,Neutralizing Self-Selection Bias in Sampling for Sortition,"Sortition is a political system in which decisions are made by panels of randomly selected citizens. The process for selecting a sortition panel is traditionally thought of as uniform sampling without replacement, which has strong fairness properties. In practice, however, sampling without replacement is not possible since only a fraction of agents is willing to participate in a panel when invited, and different demographic groups participate at different rates. In order to still produce panels whose composition resembles that of the population, we develop a sampling algorithm that restores close-to-equal representation probabilities for all agents while satisfying meaningful demographic quotas. As part of its input, our algorithm requires probabilities indicating how likely each volunteer in the pool was to participate. Since these participation probabilities are not directly observable, we show how to learn them, and demonstrate our approach using data on a real sortition panel combined with information on the general population in the form of publicly available survey data.","['Adaptive Data Analysis', 'Algorithms', 'Theory', 'Learning Theory']",[],"['Bailey Flanigan', 'Paul Gölz', 'Anupam Gupta', 'Ariel D. Procaccia']",[],[]
https://nips.cc/virtual/2020/poster/17701,Fairness & Bias,VarGrad: A Low-Variance Gradient Estimator for Variational Inference,"We analyse the properties of an unbiased gradient estimator of the ELBO for variational inference, based on the score function method with leave-one-out control variates. We show that this gradient estimator can be obtained using a new loss, defined as the variance of the log-ratio between the exact posterior and the variational approximation, which we call the log-variance loss. Under certain conditions, the gradient of the log-variance loss equals the gradient of the (negative) ELBO. We show theoretically that this gradient estimator, which we call VarGrad due to its connection to the log-variance loss, exhibits lower variance than the score function method in certain settings, and that the leave-one-out control variate coefficients are close to the optimal ones. We empirically demonstrate that VarGrad offers a favourable variance versus computation trade-off compared to other state-of-the-art estimators on a discrete VAE.",[],[],"['Lorenz Richter', 'Ayman Boustati', 'Nikolas Nüsken', 'Francisco Ruiz', 'Omer Deniz Akyildiz']",[],[]
https://nips.cc/virtual/2020/poster/17662,Fairness & Bias,Can Implicit Bias Explain Generalization? Stochastic Convex Optimization as a Case Study,"The notion of implicit bias, or implicit regularization, has been suggested as a means to explain the surprising generalization ability of modern-days overparameterized learning algorithms. This notion refers to the tendency of the optimization algorithm towards a certain structured solution that often generalizes well. Recently, several papers have studied implicit regularization and were able to identify this phenomenon in various scenarios. We revisit this paradigm in arguably the simplest non-trivial setup, and study the implicit bias of Stochastic Gradient Descent (SGD) in the context of Stochastic Convex Optimization. As a first step, we provide a simple construction that rules out the existence of a \emph{distribution-independent} implicit regularizer that governs the generalization ability of SGD. We then demonstrate a learning problem that rules out a very general class of \emph{distribution-dependent} implicit regularizers from explaining generalization, which includes strongly convex regularizers as well as non-degenerate norm-based regularizations. Certain aspects of our constructions point out to significant difficulties in providing a comprehensive explanation of an algorithm's generalization performance by solely arguing about its implicit regularization properties.",[],[],"['Assaf Dauber', 'Meir Feder', 'Tomer Koren', 'Roi Livni']",[],[]
https://nips.cc/virtual/2020/poster/17610,Fairness & Bias,Stochastic Recursive Gradient Descent Ascent for Stochastic Nonconvex-Strongly-Concave Minimax Problems,"We consider nonconvex-concave minimax optimization problems of the form $\min_{\bf x}\max_{\bf y\in{\mathcal Y}} f({\bf x},{\bf y})$, where $f$ is strongly-concave in $\bf y$ but possibly nonconvex in $\bf x$ and ${\mathcal Y}$ is a convex and compact set. We focus on the stochastic setting, where we can only access an unbiased stochastic gradient estimate of $f$ at each iteration. This formulation includes many machine learning applications as special cases such as robust optimization and adversary training. We are interested in finding an ${\mathcal O}(\varepsilon)$-stationary point of the function $\Phi(\cdot)=\max_{\bf y\in{\mathcal Y}} f(\cdot, {\bf y})$. The most popular algorithm to solve this problem is stochastic gradient decent ascent, which requires $\mathcal O(\kappa^3\varepsilon^{-4})$ stochastic gradient evaluations, where $\kappa$ is the condition number. In this paper, we propose a novel method called Stochastic Recursive gradiEnt Descent Ascent (SREDA), which estimates gradients more efficiently using variance reduction. This method achieves the best known stochastic gradient complexity of ${\mathcal O}(\kappa^3\varepsilon^{-3})$, and its dependency on $\varepsilon$ is optimal for this problem.",[],[],"['Luo Luo', 'Haishan Ye', 'Zhichao Huang', 'Tong Zhang']","['Department of Mathematics, The Hong Kong University of Science and Technology', 'Shenzhen Research Institute of Big Data, The Chinese University of Hong Kong, Shenzhen', 'Department of Mathematics, The Hong Kong University of Science and Technology', 'Department of Mathematics, The Hong Kong University of Science and Technology']","['Hong Kong', 'Hong Kong', 'Hong Kong', 'Hong Kong']"
https://nips.cc/virtual/2020/poster/17602,Fairness & Bias,"On the Ergodicity, Bias and Asymptotic Normality of Randomized Midpoint Sampling Method","The randomized midpoint method, proposed by (Shen and Lee, 2019), has emerged as an optimal discretization procedure for simulating the continuous time underdamped Langevin diffusion. In this paper, we analyze several probabilistic properties of the randomized midpoint discretization method, considering both overdamped and underdamped Langevin dynamics. We first characterize the stationary distribution of the discrete chain obtained with constant step-size discretization and show that it is biased away from the target distribution. Notably, the step-size needs to go to zero to obtain asymptotic unbiasedness. Next, we establish the asymptotic normality of numerical integration using the randomized midpoint method and highlight the relative advantages and disadvantages over other discretizations. Our results collectively provide several insights into the behavior of the randomized midpoint discretization method, including obtaining confidence intervals for numerical integrations.",[],[],"['Ye He', 'Krishnakumar Balasubramanian', 'Murat A. Erdogdu']",[],[]
https://nips.cc/virtual/2020/poster/17583,Fairness & Bias,Probabilistic Circuits for Variational Inference in Discrete Graphical Models,"Inference in discrete graphical models with variational methods is difficult because of the inability to re-parameterize gradients of the Evidence Lower Bound (ELBO). Many sampling-based methods have been proposed for estimating these gradients, but they suffer from high bias or variance. In this paper, we propose a new approach that leverages the tractability of probabilistic circuit models, such as Sum Product Networks (SPN), to compute ELBO gradients exactly (without sampling) for a certain class of densities. In particular, we show that selective-SPNs are suitable as an expressive variational distribution, and prove that when the log-density of the target model is a polynomial the corresponding ELBO can be computed analytically. To scale to graphical models with thousands of variables, we develop an efficient and effective construction of selective-SPNs with size (O(kn)), where (n) is the number of variables and (k) is an adjustable hyperparameter. We demonstrate our approach on three types of graphical models -- Ising models, Latent Dirichlet Allocation, and factor graphs from the UAI Inference Competition. Selective-SPNs give a better lower bound than mean-field and structured mean-field, and is competitive with approximations that do not provide a lower bound, such as Loopy Belief Propagation and Tree-Reweighted Belief Propagation. Our results show that probabilistic circuits are promising tools for variational inference in discrete graphical models as they combine tractability and expressivity.",[],[],"['Andy Shih', 'Stefano Ermon']",[],[]
https://nips.cc/virtual/2020/poster/17585,Fairness & Bias,Self-training Avoids Using Spurious Features Under Domain Shift,"In unsupervised domain adaptation, existing theory focuses on situations where the source and target domains are close. In practice, conditional entropy minimization and pseudo-labeling work even when the domain shifts are much larger than those analyzed by existing theory. We identify and analyze one particular setting where the domain shift can be large, but these algorithms provably work: certain spurious features correlate with the label in the source domain but are independent of the label in the target. Our analysis considers linear classification where the spurious features are Gaussian and the non-spurious features are a mixture of log-concave distributions. For this setting, we prove that entropy minimization on unlabeled target data will avoid using the spurious feature if initialized with a decently accurate source classifier, even though the objective is non-convex and contains multiple bad local minima using the spurious features. We verify our theory for spurious domain shift tasks on semi-synthetic Celeb-A and MNIST datasets. Our results suggest that practitioners collect and self-train on large, diverse datasets to reduce biases in classifiers even if labeling is impractical.",[],[],"['Yining Chen', 'Colin Wei', 'Ananya Kumar', 'Tengyu Ma']","['Department of Computer Science, Stanford University', 'Department of Computer Science, Stanford University', 'Department of Computer Science, Stanford University', 'Department of Computer Science, Stanford University']",[]
https://nips.cc/virtual/2020/poster/17560,Fairness & Bias,Intra-Processing Methods for Debiasing Neural Networks,"As deep learning models become tasked with more and more decisions that impact human lives, such as criminal recidivism, loan repayment, and face recognition for law enforcement, bias is becoming a growing concern. Debiasing algorithms are typically split into three paradigms: pre-processing, in-processing, and post-processing. However, in computer vision or natural language applications, it is common to start with a large generic model and then fine-tune to a specific use-case. Pre- or in-processing methods would require retraining the entire model from scratch, while post-processing methods only have black-box access to the model, so they do not leverage the weights of the trained model. Creating debiasing algorithms specifically for this fine-tuning use-case has largely been neglected. In this work, we initiate the study of a new paradigm in debiasing research, intra-processing, which sits between in-processing and post-processing methods. Intra-processing methods are designed specifically to debias large models which have been trained on a generic dataset, and fine-tuned on a more specific task. We show how to repurpose existing in-processing methods for this use-case, and we also propose three baseline algorithms: random perturbation, layerwise optimization, and adversarial debiasing. We evaluate these methods across three popular datasets from the AIF360 toolkit, as well as on the CelebA faces dataset. Our code is available at https://github.com/abacusai/intraprocessing_debiasing.",[],[],"['Yash Savani', 'Colin White', 'Naveen Sundar Govindarajulu']",[],[]
https://nips.cc/virtual/2020/poster/17530,Fairness & Bias,Rotated Binary Neural Network,"Binary Neural Network (BNN) shows its predominance in reducing the complexity of deep neural networks. However, it suffers severe performance degradation. One of the major impediments is the large quantization error between the full-precision weight vector and its binary vector. Previous works focus on compensating for the norm gap while leaving the angular bias hardly touched. In this paper, for the first time, we explore the influence of angular bias on the quantization error and then introduce a Rotated Binary Neural Network (RBNN), which considers the angle alignment between the full-precision weight vector and its binarized version. At the beginning of each training epoch, we propose to rotate the full-precision weight vector to its binary vector to reduce the angular bias. To avoid the high complexity of learning a large rotation matrix, we further introduce a bi-rotation formulation that learns two smaller rotation matrices. In the training stage, we devise an adjustable rotated weight vector for binarization to escape the potential local optimum. Our rotation leads to around 50% weight flips which maximize the information gain. Finally, we propose a training-aware approximation of the sign function for the gradient backward. Experiments on CIFAR-10 and ImageNet demonstrate the superiorities of RBNN over many state-of-the-arts. Our source code, experimental settings, training logs and binary models are available at https://github.com/lmbxmu/RBNN.",[],[],"['Mingbao Lin', 'Rongrong Ji', 'Zihan Xu', 'Baochang Zhang', 'Yan Wang', 'Yongjian Wu', 'Feiyue Huang', 'Chia-Wen Lin']",[],[]
https://nips.cc/virtual/2020/poster/17520,Fairness & Bias,Sense and Sensitivity Analysis: Simple Post-Hoc Analysis of Bias Due to Unobserved Confounding,"It is a truth universally acknowledged that an observed association without known mechanism must be in want of a causal estimate. Causal estimates from observational data will be biased in the presence of ‘unobserved confounding’. However, we might hope that the influence of unobserved confounders is weak relative to a ‘large’ estimated effect. The purpose of this paper is to develop Austen plots, a sensitivity analysis tool to aid such judgments by making it easier to reason about potential bias induced by unobserved confounding. We formalize confounding strength in terms of how strongly the unobserved confounding influences treatment assignment and outcome. For a target level of bias, an Austen plot shows the minimum values of treatment and outcome influence required to induce that level of bias. Austen plots generalize the classic sensitivity analysis approach of Imbens [Imb03]. Critically, Austen plots allow any approach for modeling the observed data. We illustrate the tool by assessing biases for several real causal inference problems, using a variety of machine learning approaches for the initial data analysis. Code, demo data, and a tutorial are available at github.com/anishazaveri/austen_plots.","['MCMC', 'Probabilistic Methods', 'Probabilistic Methods']",[],"['Victor Veitch', 'Anisha Zaveri']",[],[]
https://nips.cc/virtual/2020/poster/17518,Fairness & Bias,Ultra-Low Precision 4-bit Training of Deep Neural Networks,"In this paper, we propose a number of novel techniques and numerical representation formats that enable, for the very first time, the precision of training systems to be aggressively scaled from 8-bits to 4-bits. To enable this advance, we explore a novel adaptive Gradient Scaling technique (Gradscale) that addresses the challenges of insufficient range and resolution in quantized gradients as well as explores the impact of quantization errors observed during model training. We theoretically analyze the role of bias in gradient quantization and propose solutions that mitigate the impact of this bias on model convergence. Finally, we examine our techniques on a spectrum of deep learning models in computer vision, speech, and NLP. In combination with previously proposed solutions for 4-bit quantization of weight and activation tensors, 4-bit training shows a non-significant loss in accuracy across application domains while enabling significant hardware acceleration (> 7X over state-of-the-art FP16 systems).",[],[],"['Xiao Sun', 'Naigang Wang', 'Chia-Yu Chen', 'Jiamin Ni', 'Ankur Agrawal', 'Xiaodong Cui', 'Swagath Venkataramani', 'Kaoutar El Maghraoui', 'Vijayalakshmi (Viji) Srinivasan', 'Kailash Gopalakrishnan']","['IBM T. J. Watson Research Center, Yorktown Heights, NY', 'IBM T. J. Watson Research Center, Yorktown Heights, NY', 'IBM T. J. Watson Research Center, Yorktown Heights, NY', 'IBM T. J. Watson Research Center, Yorktown Heights, NY', 'IBM T. J. Watson Research Center, Yorktown Heights, NY', 'IBM T. J. Watson Research Center, Yorktown Heights, NY', 'IBM T. J. Watson Research Center, Yorktown Heights, NY', 'IBM T. J. Watson Research Center, Yorktown Heights, NY', 'IBM T. J. Watson Research Center, Yorktown Heights, NY', 'IBM T. J. Watson Research Center, Yorktown Heights, NY']",[]
