link,category,title,abstract,keywords,ccs_concepts,author_names,author_affiliations,author_countries
https://nips.cc/virtual/2020/poster/17308,Transparency & Explainability,Online Structured Meta-learning,"Learning quickly is of great importance for machine intelligence deployed in online platforms. With the capability of transferring knowledge from learned tasks, meta-learning has shown its effectiveness in online scenarios by continuously updating the model with the learned prior. However, current online meta-learning algorithms are limited to learn a globally-shared meta-learner, which may lead to sub-optimal results when the tasks contain heterogeneous information that are difficult to share. We overcome this limitation by proposing an online structured meta-learning (OSML) framework. Inspired by the knowledge organization of human and hierarchical feature representation, OSML explicitly disentangles the meta-learner as a meta-hierarchical graph with different knowledge blocks. When a new task is encountered, it constructs a meta-knowledge pathway by either utilizing the most relevant knowledge blocks or exploring new blocks. Through the meta-knowledge pathway, the model is able to quickly adapt to the new task. In addition, new knowledge is further incorporated into the selected blocks. Experiments on three datasets empirically demonstrate the effectiveness and interpretability of our proposed framework, not only under heterogeneous tasks but also under homogeneous settings.",[],[],"['Huaxiu Yao', 'Yingbo Zhou', 'Mehrdad Mahdavi', 'Zhenhui (Jessie) Li', 'Richard Socher', 'Caiming Xiong']","['Pennsylvania State University', 'Salesforce Research', 'Pennsylvania State University', 'Pennsylvania State University', 'Salesforce Research', 'Salesforce Research']",[]
https://nips.cc/virtual/2020/poster/17289,Transparency & Explainability,BanditPAM: Almost Linear Time k-Medoids Clustering via Multi-Armed Bandits,"Clustering is a ubiquitous task in data science. Compared to the commonly used k-means clustering, k-medoids clustering requires the cluster centers to be actual data points and supports arbitrary distance metrics, which permits greater interpretability and the clustering of structured objects. Current state-of-the-art k-medoids clustering algorithms, such as Partitioning Around Medoids (PAM), are iterative and are quadratic in the dataset size n for each iteration, being prohibitively expensive for large datasets. We propose BanditPAM, a randomized algorithm inspired by techniques from multi-armed bandits, that reduces the complexity of each PAM iteration from O(n^2) to O(nlogn) and returns the same results with high probability, under assumptions on the data that often hold in practice. As such, BanditPAM matches state-of-the-art clustering loss while reaching solutions much faster. We empirically validate our results on several large real-world datasets, including a coding exercise submissions dataset from Code.org, the 10x Genomics 68k PBMC single-cell RNA sequencing dataset, and the MNIST handwritten digits dataset. In these experiments, we observe that BanditPAM returns the same results as state-of-the-art PAM-like algorithms up to 4x faster while performing up to 200x fewer distance computations. The improvements demonstrated by BanditPAM enable k-medoids clustering on a wide range of applications, including identifying cell types in large-scale single-cell data and providing scalable feedback for students learning computer science online. We also release highly optimized Python and C++ implementations of our algorithm.",[],[],"['Mo Tiwari', 'Martin J. Zhang', 'James Mayclin', 'Sebastian Thrun', 'Chris Piech', 'Ilan Shomorony']",[],[]
https://nips.cc/virtual/2020/poster/17266,Transparency & Explainability,Certified Monotonic Neural Networks,"Learning monotonic models with respect to a subset of the inputs is a desirable feature to effectively address the fairness, interpretability, and generalization issues in practice. Existing methods for learning monotonic neural networks either require specifically designed model structures to ensure monotonicity, which can be too restrictive/complicated, or enforce monotonicity by adjusting the learning process, which cannot provably guarantee the learned model is monotonic on selected features.   In this work,  we propose to certify the monotonicity of the general piece-wise linear neural networks by solving a mixed integer linear programming problem.  This provides a new general approach for learning monotonic neural networks with arbitrary model structures.  Our method allows us to train neural networks with heuristic monotonicity regularizations, and we can gradually increase the regularization magnitude until the learned network is certified monotonic. Compared to prior work, our method does not require human-designed constraints on the weight space and also yields more accurate approximation.   Empirical studies on various datasets demonstrate the efficiency of our approach over the state-of-the-art methods, such as Deep Lattice Networks",[],[],"['Xingchao Liu', 'Xing Han', 'Na Zhang', 'Qiang Liu']",[],[]
https://nips.cc/virtual/2020/poster/17237,Transparency & Explainability,Hard Shape-Constrained Kernel Machines,"Shape constraints (such as non-negativity, monotonicity, convexity) play a central role in a large number of applications, as they usually improve performance for small sample size and help interpretability. However enforcing these shape requirements in a hard fashion is an extremely challenging problem. Classically, this task is tackled (i) in a soft way (without out-of-sample guarantees), (ii) by specialized transformation of the variables on a case-by-case basis, or (iii) by using highly restricted function classes, such as polynomials or polynomial splines. In this paper, we prove that hard affine shape constraints on function derivatives can be encoded in kernel machines which represent one of the most flexible and powerful tools in machine learning and statistics. Particularly, we present a tightened second-order cone constrained reformulation, that can be readily implemented in convex solvers. We prove performance guarantees on the solution, and demonstrate the efficiency of the approach in joint quantile regression with applications to economics and to the analysis of aircraft trajectories, among others.",[],[],"['Pierre-Cyril Aubin-Frankowski', 'Zoltan Szabo']","['École des Ponts ParisTech and CAS, MINES ParisTech, PSL, Paris, France', 'Center of Applied Mathematics, CNRS, École Polytechnique, Institut Polytechnique de Paris, Route de Saclay, Palaiseau, France']","['France', 'France']"
https://nips.cc/virtual/2020/poster/17215,Transparency & Explainability,Learning outside the Black-Box: The pursuit of interpretable models,"Machine learning has proved its ability to produce accurate models -- but the deployment of these models outside the machine learning community has been hindered by the difficulties of interpreting these models. This paper proposes an algorithm that produces a continuous global interpretation of any given continuous black-box function. Our algorithm employs a variation of projection pursuit in which the ridge functions are chosen to be Meijer G-functions, rather than the usual polynomial splines. Because Meijer G-functions are differentiable in their parameters, we can ""tune"" the parameters of the representation by gradient descent; as a consequence, our algorithm is efficient. Using five familiar data sets from the UCI repository and two familiar machine learning algorithms, we demonstrate that our algorithm produces global interpretations that are both faithful (highly accurate) and parsimonious (involve a small number of terms). Our interpretations permit easy understanding of the relative importance of features and feature interactions. Our interpretation algorithm represents a leap forward from the previous state of the art.",[],[],"['Jonathan Crabbe', 'Yao Zhang', 'William Zame', 'Mihaela van der Schaar']",[],[]
https://nips.cc/virtual/2020/poster/17198,Transparency & Explainability,Domain Adaptation as a Problem of Inference on Graphical Models,"This paper is concerned with data-driven unsupervised domain adaptation, where it is unknown in advance how the joint distribution changes across domains, i.e., what factors or modules of the data distribution remain invariant or change across domains. To develop an automated way of domain adaptation with multiple source domains, we propose to use a graphical model as a compact way to encode the change property of the joint distribution, which can be learned from data, and then view domain adaptation as a problem of Bayesian inference on the graphical models. Such a graphical model  distinguishes between constant and varied modules of the distribution and specifies the properties of the changes across domains, which serves as prior knowledge of the changing modules for the purpose of deriving the posterior of the target variable $Y$ in the target domain.  This provides an end-to-end framework of domain adaptation, in which additional knowledge about how the joint distribution changes, if available, can be directly incorporated to improve the graphical representation.  We discuss how causality-based domain adaptation can be put under this umbrella. Experimental results on both synthetic and real data demonstrate the efficacy of the proposed framework for domain adaptation","['Graphical Models', 'Probabilistic Methods', 'Theory', 'Learning Theory']",[],"['Kun Zhang', 'Mingming Gong', 'Petar Stojanov', 'Biwei Huang', 'QINGSONG LIU', 'Clark Glymour']",[],[]
https://nips.cc/virtual/2020/poster/17142,Transparency & Explainability,How does This Interaction Affect Me? Interpretable Attribution for Feature Interactions,"Machine learning transparency calls for interpretable explanations of how inputs relate to predictions. Feature attribution is a way to analyze the impact of features on predictions. Feature interactions are the contextual dependence between features that jointly impact predictions. There are a number of methods that extract feature interactions in prediction models; however, the methods that assign attributions to interactions are either uninterpretable, model-specific, or non-axiomatic. We propose an interaction attribution and detection framework called Archipelago which addresses these problems and is also scalable in real-world settings. Our experiments on standard annotation labels indicate our approach provides significantly more interpretable explanations than comparable methods, which is important for analyzing the impact of interactions on predictions. We also provide accompanying visualizations of our approach that give new insights into deep neural networks.",[],[],"['Michael Tsang', 'Sirisha Rambhatla', 'Yan Liu']","['Department of Computer Science, University of Southern California', 'Department of Computer Science, University of Southern California', 'Department of Computer Science, University of Southern California']",[]
https://nips.cc/virtual/2020/poster/17129,Transparency & Explainability,Robust Optimization for Fairness with Noisy Protected Groups,"Many existing fairness criteria for machine learning involve equalizing some metric across protected groups such as race or gender. However, practitioners trying to audit or enforce such group-based criteria can easily face the problem of noisy or biased protected group information. First, we study the consequences of naively relying on noisy protected group labels: we provide an upper bound on the fairness violations on the true groups $G$ when the fairness criteria are satisfied on noisy groups $\hat{G}$. Second, we introduce two new approaches using robust optimization that, unlike the naive approach of only relying on $\hat{G}$, are guaranteed to satisfy fairness criteria on the true protected groups $G$ while minimizing a training objective. We provide theoretical guarantees that one such approach converges to an optimal feasible solution. Using two case studies, we show empirically that the robust approaches achieve better true group fairness guarantees than the naive approach.",[],[],"['Serena Wang', 'Wenshuo Guo', 'Harikrishna Narasimhan', 'Andrew Cotter', 'Maya Gupta', 'Michael Jordan']",[],[]
https://nips.cc/virtual/2020/poster/17106,Transparency & Explainability,Feature Importance Ranking for Deep Learning,"Feature importance ranking has become a powerful tool for explainable AI. However, its nature of combinatorial optimization poses a great challenge for deep learning. In this paper, we propose a novel dual-net architecture consisting of operator and selector for discovery of an optimal feature subset of a fixed size and ranking the importance of those features in the optimal subset simultaneously. During learning, the operator is trained for a supervised learning task via optimal feature subset candidates generated by the selector that learns predicting the learning performance of the operator working on different optimal subset candidates. We develop an alternate learning algorithm that trains two nets jointly and incorporates a stochastic local search procedure into learning to address the combinatorial optimization challenge. In deployment, the selector generates an optimal feature subset and ranks feature importance, while the operator makes predictions based on the optimal subset for test data. A thorough evaluation on synthetic, benchmark and real data sets suggests that our approach outperforms several state-of-the-art feature importance ranking and supervised feature selection methods. (Our source code is available: https://github.com/maksym33/FeatureImportanceDL)",[],[],"['Maksymilian Wojtas', 'Ke Chen']",[],[]
https://nips.cc/virtual/2020/poster/17094,Transparency & Explainability,Auditing Differentially Private Machine Learning: How Private is Private SGD?,"We investigate whether Differentially Private SGD offers better privacy in practice than what is guaranteed by its state-of-the-art analysis. We do so via novel data poisoning attacks, which we show correspond to realistic privacy attacks. While previous work (Ma et al., arXiv 2019) proposed this connection between differential privacy and data poisoning as a defense against data poisoning, our use as a tool for understanding the privacy of a specific mechanism is new. More generally, our work takes a quantitative, empirical approach to understanding the privacy afforded by specific implementations of differentially private algorithms that we believe has the potential to complement and influence analytical work on differential privacy.",[],[],"['Matthew Jagielski', 'Jonathan Ullman', 'Alina Oprea']","['Northeastern University', 'Northeastern University', 'Northeastern University']",[]
https://nips.cc/virtual/2020/poster/17093,Transparency & Explainability,ICAM: Interpretable Classification via Disentangled Representations and Feature Attribution Mapping,"Feature attribution (FA), or the assignment of class-relevance to different locations in an image, is important for many classification problems but is particularly crucial within the neuroscience domain, where accurate mechanistic models of behaviours, or disease, require knowledge of all features discriminative of a trait. At the same time, predicting class relevance from brain images is challenging as phenotypes are typically heterogeneous, and changes occur against a background of significant natural variation.  Here, we present a novel framework for creating class specific FA maps through image-to-image translation. We propose the use of a VAE-GAN to explicitly disentangle class relevance from background features for improved interpretability properties, which results in meaningful FA maps. We validate our method on 2D and 3D brain image datasets of dementia (ADNI dataset), ageing (UK Biobank), and (simulated) lesion detection. We show that FA maps generated by our method outperform baseline FA methods when validated against ground truth. More significantly, our approach is the first to use latent space sampling to support exploration of phenotype variation.","['Computer Vision', 'Applications', 'Deep Learning']",[],"['Cher Bass', 'Mariana da Silva', 'Carole Sudre', 'Petru-Daniel Tudosiu', 'Stephen Smith', 'Emma Robinson']","['Kings College London, London, UK', 'Kings College London, London, UK', 'Kings College London, London, UK', 'Kings College London, London, UK', 'University of Oxford, Oxford, UK', 'Kings College London, London, UK']","['UK', 'UK', 'UK', 'UK', 'UK', 'UK']"
https://nips.cc/virtual/2020/poster/17058,Transparency & Explainability,Learning Disentangled Representations and Group Structure of Dynamical Environments,"Learning disentangled representations is a key step towards effectively discovering and modelling the underlying structure of environments. In the natural sciences, physics has found great success by describing the universe in terms of symmetry preserving transformations. Inspired by this formalism, we propose a framework, built upon the theory of group representation, for learning representations of a dynamical environment structured around the transformations that generate its evolution. Experimentally, we learn the structure of explicitly symmetric environments without supervision from observational data generated by sequential interactions. We further introduce an intuitive disentanglement regularisation to ensure the interpretability of the learnt representations. We show that our method enables accurate long-horizon predictions, and demonstrate a correlation between the quality of predictions and disentanglement in the latent space.","['Algorithms', 'Bandit Algorithms', 'Theory', 'Learning Theory']",[],"['Robin Quessard', 'Thomas Barrett', 'William Clements']","['Indust.ai, Paris, France and École Normale Supérieure, Paris, France', 'University of Oxford, Oxford, UK', 'Indust.ai, Paris, France']","['France', 'UK', 'France']"
https://nips.cc/virtual/2020/poster/18929,Transparency & Explainability,Beyond Individualized Recourse: Interpretable and Interactive Summaries of Actionable Recourses,"As predictive models are increasingly being deployed in high-stakes decision-making, there has been a lot of interest in developing algorithms which can provide recourses to affected individuals. While developing such tools is important, it is even more critical to analyze and interpret a predictive model, and vet it thoroughly to ensure that the recourses it offers are meaningful and non-discriminatory before it is deployed in the real world. To this end, we propose a novel model agnostic framework called Actionable Recourse Summaries (AReS) to construct global counterfactual explanations which provide an interpretable and accurate summary of recourses for the entire population.  We formulate a novel objective which simultaneously optimizes for correctness of the recourses and interpretability of the explanations, while minimizing overall recourse costs across the entire population. More specifically, our objective enables us to learn, with optimality guarantees on recourse correctness, a small number of compact rule sets each of which capture recourses for well defined subpopulations within the data. We also demonstrate theoretically that several of the prior approaches proposed to generate recourses for individuals are special cases of our framework. Experimental evaluation with real world datasets and user studies demonstrate that our framework can provide decision makers with a comprehensive overview of recourses corresponding to any black box model, and consequently help detect undesirable model biases and discrimination. ",[],[],"['Kaivalya Rawal', 'Himabindu Lakkaraju']","['Harvard University', 'Harvard University']",[]
https://nips.cc/virtual/2020/poster/18910,Transparency & Explainability,Unsupervised Learning of Lagrangian Dynamics from Images for Prediction and Control,"Recent approaches for modelling dynamics of physical systems with neural networks enforce Lagrangian or Hamiltonian structure to improve prediction and generalization. However, when coordinates are embedded in high-dimensional data such as images, these approaches either lose interpretability or can only be applied to one particular example. We introduce a new unsupervised neural network model that learns Lagrangian dynamics from images, with interpretability that benefits prediction and control. The model infers Lagrangian dynamics on generalized coordinates that are simultaneously learned with a coordinate-aware variational autoencoder (VAE). The VAE is designed to account for the geometry of physical systems composed of multiple rigid bodies in the plane. By inferring interpretable Lagrangian dynamics, the model learns physical system properties, such as kinetic and potential energy, which enables long-term prediction of dynamics in the image space and synthesis of energy-based controllers. ",[],[],"['Yaofeng Desmond Zhong', 'Naomi Leonard']",[],[]
https://nips.cc/virtual/2020/poster/17331,Transparency & Explainability,Random Walk Graph Neural Networks,"In recent years, graph neural networks (GNNs) have become the de facto tool for performing machine learning tasks on graphs. Most GNNs belong to the family of message passing neural networks (MPNNs). These models employ an iterative neighborhood aggregation scheme to update vertex representations. Then, to compute vector representations of graphs, they aggregate the representations of the vertices using some permutation invariant function. One would expect the hidden layers of a GNN to be composed of parameters that take the form of graphs. However, this is not the case for MPNNs since their update procedure is parameterized by fully-connected layers. In this paper, we propose a more intuitive and transparent architecture for graph-structured data, so-called Random Walk Graph Neural Network (RWNN). The first layer of the model consists of a number of trainable ``hidden graphs'' which are compared against the input graphs using a random walk kernel to produce graph representations. These representations are then passed on to a fully-connected neural network which produces the output. The employed random walk kernel is differentiable, and therefore, the proposed model is end-to-end trainable. We demonstrate the model's transparency on synthetic datasets. Furthermore, we empirically evaluate the model on graph classification datasets and show that it achieves competitive performance.",[],[],"['Giannis Nikolentzos', 'Michalis Vazirgiannis']",[],[]
https://nips.cc/virtual/2020/poster/16820,Transparency & Explainability,Quantifying Learnability and Describability of Visual Concepts Emerging in Representation Learning,"The increasing impact of black box models, and particularly of unsupervised ones, comes with an increasing interest in tools to understand and interpret them. In this paper, we consider in particular how to characterise visual groupings discovered automatically by deep neural networks, starting with state-of-the-art clustering methods. In some cases, clusters readily correspond to an existing labelled dataset. However, often they do not, yet they still maintain an ""intuitive interpretability''. We introduce two concepts, visual learnability and describability, that can be used to quantify the interpretability of arbitrary image groupings, including unsupervised ones. The idea is to measure (1) how well humans can learn to reproduce a grouping by measuring their ability to generalise from a small set of visual examples (learnability) and (2) whether the set of visual examples can be replaced by a succinct, textual description (describability). By assessing human annotators as classifiers, we remove the subjective quality of existing evaluation metrics. For better scalability, we finally propose a class-level captioning system to generate descriptions for visual groupings automatically and compare it to human annotators using the describability metric.","['Imag', 'Algorithms -> Image Segmentation; Algorithms -> Semi-Supervised Learning; Applications -> Computer Vision; Applications', 'Adversarial Learning', 'Algorithms']",[],"['Iro Laina', 'Ruth Fong', 'Andrea Vedaldi']","['Visual Geometry Group, University of Oxford', 'Visual Geometry Group, University of Oxford', 'Visual Geometry Group, University of Oxford']",[]
