link,category,title,abstract,keywords,ccs_concepts,author_names,author_affiliations,author_countries
https://nips.cc/virtual/2020/poster/17324,Fairness & Bias,Neural Networks Fail to Learn Periodic Functions and How to Fix It,"Previous literature offers limited clues on how to learn a periodic function using modern neural networks. We start with a study of the extrapolation properties of neural networks; we prove and demonstrate experimentally that the standard activations functions, such as ReLU, tanh, sigmoid, along with their variants, all fail to learn to extrapolate simple periodic functions. We hypothesize that this is due to their lack of a ``periodic"" inductive bias. As a fix of this problem, we propose a new activation, namely, $x + \sin^2(x)$, which achieves the desired periodic inductive bias to learn a periodic function while maintaining a favorable optimization property of the $\relu$-based activations. Experimentally, we apply the proposed method to temperature and financial data prediction",[],[],"['Liu Ziyin', 'Tilman Hartwig', 'Masahito Ueda']",[],[]
https://nips.cc/virtual/2020/poster/16921,Fairness & Bias,Extrapolation Towards Imaginary 0-Nearest Neighbour and Its Improved Convergence Rate,"$k$-nearest neighbour ($k$-NN) is one of the simplest and most widely-used methods for supervised classification, that predicts a query's label by taking weighted ratio of observed labels of $k$ objects nearest to the query. The weights and the parameter $k \in \mathbb{N}$ regulate its bias-variance trade-off, and the trade-off implicitly affects the convergence rate of the excess risk for the $k$-NN classifier; several existing studies considered selecting optimal $k$ and weights to obtain faster convergence rate. Whereas $k$-NN with non-negative weights has been developed widely, it was also proved that negative weights are essential for eradicating the bias terms and attaining optimal convergence rate. In this paper, we propose a novel multiscale $k$-NN (MS-$k$-NN), that extrapolates unweighted $k$-NN estimators from several $k \ge 1$ values to $k=0$, thus giving an imaginary 0-NN estimator. Our method implicitly computes optimal real-valued weights that are adaptive to the query and its neighbour points. We theoretically prove that the MS-$k$-NN attains the improved rate, which coincides with the existing optimal rate under some conditions.",[],[],"['Akifumi Okuno', 'Hidetoshi Shimodaira']",[],[]
https://nips.cc/virtual/2020/poster/19075,Fairness & Bias,Bad Global Minima Exist and SGD Can Reach Them,"Several works have aimed to explain why  overparameterized neural networks generalize well when trained by Stochastic Gradient Descent (SGD). The consensus explanation that has emerged credits the randomized nature of SGD for the bias of the training process towards low-complexity models and, thus, for implicit regularization. We take a careful look at this explanation in the context of image classification with common deep neural network architectures. We find that if we do not regularize \emph{explicitly}, then SGD can be easily made to converge to poorly-generalizing, high-complexity models: all it takes is to first train on a random labeling on the data, before switching to properly training with the correct labels. In contrast, we find that in the presence of explicit regularization, pretraining with random labels has no detrimental effect on SGD. We believe that our results give evidence that explicit regularization plays a far more important role in the success of overparameterized neural networks than what has been understood until now. Specifically, in suppressing complicated models that got lucky with the training data, regularization not only makes simple models that fit the data well the global optima, but it also clears the way to make them discoverable by local methods, such as SGD.",[],[],"['Shengchao Liu', 'Dimitris Papailiopoulos', 'Dimitris Achlioptas']",[],[]
https://nips.cc/virtual/2020/poster/18854,Fairness & Bias,Towards Learning Convolutions from Scratch,"Convolution is one of the most essential components of modern architectures used in computer vision. As machine learning moves towards reducing the expert bias and learning it from data, a natural next step seems to be learning convolution-like structures from scratch.  This, however, has proven elusive.  For example, current state-of-the-art architecture search algorithms use convolution as one of the existing modules rather than learning it from data. In an attempt to understand the inductive bias that gives rise to convolutions, we investigate minimum description length as a guiding principle and show that in some settings, it can indeed be indicative of the performance of architectures. To find architectures with small description length, we propose beta-LASSO, a simple variant of LASSO algorithm that, when applied on fully-connected networks for image classification tasks, learns architectures with local connections and achieves state-of-the-art accuracies for training fully-connected networks on CIFAR-10 (84.50%), CIFAR-100 (57.76%) and SVHN (93.84%) bridging the gap between fully-connected and convolutional networks.",[],[],['Behnam Neyshabur'],['Google'],[]
https://nips.cc/virtual/2020/poster/17550,Fairness & Bias,Achieving Equalized Odds by Resampling Sensitive Attributes,"We present a flexible framework for learning predictive models that approximately satisfy the equalized odds notion of fairness. This is achieved by introducing a general discrepancy functional that rigorously quantifies violations of this criterion. This differentiable functional is used as a penalty driving the model parameters towards equalized odds. To rigorously evaluate fitted models, we develop a formal hypothesis test to detect whether a prediction rule violates this property, the first such test in the literature. Both the model fitting and hypothesis testing leverage a resampled version of the sensitive attribute obeying equalized odds, by construction. We demonstrate the applicability and validity of the proposed framework both in regression and multi-class classification problems, reporting improved performance over state-of-the-art methods. Lastly, we show how to incorporate techniques for equitable uncertainty quantification---unbiased for each group under study---to communicate the results of the data analysis in exact terms.",[],[],"['Yaniv Romano', 'Stephen Bates', 'Emmanuel Candes']",[],[]
https://nips.cc/virtual/2020/poster/18746,Fairness & Bias,Ensembling geophysical models with Bayesian Neural Networks,"Ensembles of geophysical models improve projection accuracy and express uncertainties. We develop a novel data-driven ensembling strategy for combining geophysical models using Bayesian Neural Networks, which infers spatiotemporally varying model weights and bias while accounting for heteroscedastic uncertainties in the observations. This produces more accurate and uncertainty-aware projections without sacrificing interpretability. Applied to the prediction of total column ozone from an ensemble of 15 chemistry-climate models, we find that the Bayesian neural network ensemble (BayNNE) outperforms existing ensembling methods, achieving a 49.4% reduction in RMSE for temporal extrapolation, and a 67.4% reduction in RMSE for polar data voids, compared to a weighted mean. Uncertainty is also well-characterized, with 90.6% of the data points in our extrapolation validation dataset lying within 2 standard deviations and 98.5% within 3 standard deviations.",[],[],"['Ushnish Sengupta', 'Matt Amos', 'Scott Hosking', 'Carl Edward Rasmussen', 'Matthew Juniper', 'Paul Young']",[],[]
https://nips.cc/virtual/2020/poster/17366,Fairness & Bias,Rethinking Importance Weighting for Deep Learning under Distribution Shift,"Under distribution shift (DS) where the training data distribution differs from the test one, a powerful technique is importance weighting (IW) which handles DS in two separate steps: weight estimation (WE) estimates the test-over-training density ratio and weighted classification (WC) trains the classifier from weighted training data. However, IW cannot work well on complex data, since WE is incompatible with deep learning. In this paper, we rethink IW and theoretically show it suffers from a circular dependency: we need not only WE for WC, but also WC for WE where a  trained deep classifier is used as the feature extractor (FE). To cut off the dependency, we try to pretrain FE from unweighted training data, which leads to biased FE. To overcome the bias, we propose an end-to-end solution dynamic IW that iterates between WE and WC and combines them in a seamless manner, and hence our WE can also enjoy deep networks and stochastic optimizers indirectly. Experiments with two representative types of DS on three popular datasets show that our dynamic IW compares favorably with state-of-the-art methods.",[],[],"['Tongtong Fang', 'Nan Lu', 'Gang Niu', 'Masashi Sugiyama']",[],[]
https://nips.cc/virtual/2020/poster/18723,Fairness & Bias,Removing Bias in Multi-modal Classifiers: Regularization by Maximizing Functional Entropies,"Many recent datasets contain a variety of different data modalities, for instance, image, question, and answer data in visual question answering (VQA). When training deep net classifiers on those multi-modal datasets, the modalities get exploited at different scales, i.e., some modalities can more easily contribute to the classification results than others. This is suboptimal because the classifier is inherently biased towards a subset of the modalities. To alleviate this shortcoming, we propose a novel regularization term based on the functional entropy. Intuitively, this term encourages to balance the contribution of each modality to the classification result. However, regularization with the functional entropy is challenging. To address this, we develop a method based on the log-Sobolev inequality, which bounds the functional entropy with the functional-Fisher-information. Intuitively, this maximizes the amount of information that the modalities contribute. On the two challenging multi-modal datasets VQA-CPv2, and SocialIQ, we obtain state-of-the-art results while more uniformly exploiting the modalities. In addition, we demonstrate the efficacy of our method on Colored MNIST.",[],[],"['Itai Gat', 'Idan Schwartz', 'Alexander Schwing', 'Tamir Hazan']",[],[]
https://nips.cc/virtual/2020/poster/17352,Fairness & Bias,Domain Generalization via Entropy Regularization,"Domain generalization aims to learn from multiple source domains a predictive model that can generalize to unseen target domains. One essential problem in domain generalization is to learn discriminative domain-invariant features. To arrive at this, some methods introduce a domain discriminator through adversarial learning to match the feature distributions in multiple source domains. However, adversarial training can only guarantee that the learned features have invariant marginal distributions, while the invariance of conditional distributions is more important for prediction in new domains. To ensure the conditional invariance of learned features, we propose an entropy regularization term that measures the dependency between the learned features and the class labels. Combined with the typical task-related loss, e.g., cross-entropy loss for classification, and adversarial loss for domain discrimination, our overall objective is guaranteed to learn conditional-invariant features across all source domains and thus can learn classifiers with better generalization capabilities. We demonstrate the effectiveness of our method through comparison with state-of-the-art methods on both simulated and real-world datasets. Code is available at: https://github.com/sshan-zhao/DGviaER.",[],[],"['Shanshan Zhao', 'Mingming Gong', 'Tongliang Liu', 'Huan Fu', 'Dacheng Tao']","['The University of Sydney, Australia', 'University of Melbourne, Australia', 'The University of Sydney, Australia', 'Alibaba Group, China', 'The University of Sydney, Australia']","['Australia', 'Australia', 'Australia', 'China', 'Australia']"
https://nips.cc/virtual/2020/poster/18483,Fairness & Bias,Robust Correction of Sampling Bias using Cumulative Distribution Functions,"Varying domains and biased datasets can lead to differences between the training and the target distributions, known as covariate shift. Current approaches for alleviating this often rely on estimating the ratio of training and target probability density functions. These techniques require parameter tuning and can be unstable across different datasets. We present a new method for handling covariate shift using the empirical cumulative distribution function estimates of the target distribution by a rigorous generalization of a recent idea proposed by Vapnik and Izmailov. Further, we show experimentally that our method is more robust in its predictions, is not reliant on parameter tuning and shows similar classification performance compared to the current state-of-the-art techniques on synthetic and real datasets.",[],[],"['Bijan Mazaheri', 'Siddharth Jain', 'Jehoshua Bruck']",[],[]
https://nips.cc/virtual/2020/poster/18454,Fairness & Bias,On Function Approximation in Reinforcement Learning: Optimism in the Face of Large State Spaces,"Reinforcement learning (RL) algorithms combined with modern function approximators such as kernel functions and deep neural networks have achieved significant empirical successes in large-scale application problems with a massive number of states. From a theoretical perspective, however, RL with functional approximation  poses a fundamental challenge  to developing algorithms  with provable computational and statistical efficiency, due to the need to take into consideration  both the exploration-exploitation tradeoff that is inherent in RL and the bias-variance tradeoff that is innate in statistical estimation. To address such a challenge,  focusing on the episodic setting where the action-value functions are represented by a kernel function or over-parametrized neural network, we propose the first provable RL algorithm with both polynomial runtime and sample complexity, without additional assumptions on the data-generating model. In particular, for both the kernel and neural settings,  we prove that an optimistic modification of the least-squares value iteration algorithm incurs an $\tilde{\mathcal{O}}(\delta_{\cF}  H^2 \sqrt{T})$ regret, where $\delta_{\cF}$ characterizes the intrinsic complexity of the function class $\cF$, $H$ is the length of each episode, and  $T$ is the total number of episodes. Our regret bounds are independent of the number of states and therefore even allows it to diverge,  which exhibits the benefit of function approximation. ",[],[],"['Zhuoran Yang', 'Chi Jin', 'Zhaoran Wang', 'Mengdi Wang', 'Michael Jordan']",[],[]
https://nips.cc/virtual/2020/poster/19034,Fairness & Bias,Incorporating Interpretable Output Constraints in Bayesian Neural Networks,"Domains where supervised models are deployed often come with task-specific constraints, such as prior expert knowledge on the ground-truth function, or desiderata like safety and fairness. We introduce a novel probabilistic framework for reasoning with such constraints and formulate a prior that enables us to effectively incorporate them into Bayesian neural networks (BNNs), including a variant that can be amortized over tasks. The resulting Output-Constrained BNN (OC-BNN) is fully consistent with the Bayesian framework for uncertainty quantification and is amenable to black-box inference. Unlike typical BNN inference in uninterpretable parameter space, OC-BNNs widen the range of functional knowledge that can be incorporated, especially for model users without expertise in machine learning. We demonstrate the efficacy of OC-BNNs on real-world datasets, spanning multiple domains such as healthcare, criminal justice, and credit scoring.",[],[],"['Wanqian Yang', 'Lars Lorch', 'Moritz Graule', 'Himabindu Lakkaraju', 'Finale Doshi-Velez']","['Harvard University, Cambridge, MA', 'ETH Zürich, Zürich, Switzerland', 'Harvard University, Cambridge, MA', 'Harvard University, Cambridge, MA', 'Harvard University, Cambridge, MA']",['Switzerland']
https://nips.cc/virtual/2020/poster/18962,Fairness & Bias,Learning efficient task-dependent representations with synaptic plasticity,"Neural populations encode the sensory world imperfectly: their capacity is limited by the number of neurons, availability of metabolic and other biophysical resources, and intrinsic noise. The brain is presumably shaped by these limitations, improving efficiency by discarding some aspects of incoming sensory streams, while preferentially preserving commonly occurring, behaviorally-relevant information. Here we construct a stochastic recurrent neural circuit model that can learn efficient, task-specific sensory codes using a novel form of reward-modulated Hebbian synaptic plasticity. We illustrate the flexibility of the model by training an initially unstructured neural network to solve two different tasks: stimulus estimation, and stimulus discrimination. The network achieves high performance in both tasks by appropriately allocating resources and using its recurrent circuitry to best compensate for different levels of noise. We also show how the interaction between stimulus priors and task structure dictates the emergent network representations.",[],[],"['Colin Bredenberg', 'Eero Simoncelli', 'Cristina Savin']","['Center for Neural Science, New York University', 'Center for Neural Science, Howard Hughes Medical Institute, New York University', 'Center for Neural Science, Center for Data Science, New York University']",[]
https://nips.cc/virtual/2020/poster/18959,Fairness & Bias,Understanding Double Descent Requires A Fine-Grained Bias-Variance Decomposition,"Classical learning theory suggests that the optimal generalization performance of a machine learning model should occur at an intermediate model complexity, with simpler models exhibiting high bias and more complex models exhibiting high variance of the predictive function. However, such a simple trade-off does not adequately describe deep learning models that simultaneously attain low bias and variance in the heavily overparameterized regime. A primary obstacle in explaining this behavior is that deep learning algorithms typically involve multiple sources of randomness whose individual contributions are not visible in the total variance. To enable fine-grained analysis, we describe an interpretable, symmetric decomposition of the variance into terms associated with the randomness from sampling, initialization, and the labels. Moreover, we compute the high-dimensional asymptotic behavior of this decomposition for random feature kernel regression, and analyze the strikingly rich phenomenology that arises. We find that the bias decreases monotonically with the network width, but the variance terms exhibit non-monotonic behavior and can diverge at the interpolation boundary, even in the absence of label noise. The divergence is caused by the interaction between sampling and initialization and can therefore be eliminated by marginalizing over samples (i.e. bagging) or over the initial parameters (i.e. ensemble learning).",[],[],"['Ben Adlam', 'Jeffrey Pennington']","['Google Brain', 'Google Brain']",[]
https://nips.cc/virtual/2020/poster/18955,Fairness & Bias,DisARM: An Antithetic Gradient Estimator for Binary Latent Variables,"Training models with discrete latent variables is challenging due to the difficulty of estimating the gradients accurately. Much of the recent progress has been achieved by taking advantage of continuous relaxations of the system, which are not always available or even possible. The Augment-REINFORCE-Merge (ARM) estimator provides an alternative that, instead of relaxation, uses continuous augmentation. Applying antithetic sampling over the augmenting variables yields a relatively low-variance and unbiased estimator applicable to any model with binary latent variables. However, while antithetic sampling reduces variance, the augmentation process increases variance. We show that ARM can be improved by analytically integrating out the randomness introduced by the augmentation process, guaranteeing substantial variance reduction. Our estimator, DisARM, is simple to implement and has the same computational cost as ARM. We evaluate DisARM on several generative modeling benchmarks and show that it consistently outperforms ARM and a strong independent sample baseline in terms of both variance and log-likelihood. Furthermore, we propose a local version of DisARM designed for optimizing the multi-sample variational bound, and show that it outperforms VIMCO, the current state-of-the-art method.",[],[],"['Zhe Dong', 'Andriy Mnih', 'George Tucker']",[],[]
https://nips.cc/virtual/2020/poster/18952,Fairness & Bias,Adaptive Shrinkage Estimation for Streaming Graphs,"Networks are a natural representation of complex systems across the sciences, and higher-order dependencies are central to the understanding and modeling of these systems. However, in many practical applications such as online social networks, networks are massive, dynamic, and naturally streaming, where pairwise interactions among vertices become available one at a time in some arbitrary order. The massive size and streaming nature of these networks allow only partial observation, since it is infeasible to analyze the entire network. Under such scenarios, it is challenging to study the higher-order structural and connectivity patterns of streaming networks. In this work, we consider the fundamental problem of estimating the higher-order dependencies using adaptive sampling. We propose a novel adaptive, single-pass sampling framework and unbiased estimators for higher-order network analysis of large streaming networks. Our algorithms exploit adaptive techniques to identify edges that are highly informative for efficiently estimating the higher-order structure of streaming networks from small sample data. We also introduce a novel James-Stein shrinkage estimator to reduce the estimation error. Our approach is fully analytic, computationally efficient, and can be incrementally updated in a streaming setting. Numerical experiments on large networks show that our approach is superior to baseline methods.  ",[],[],"['Nesreen Ahmed', 'Nick Duffield']","['Intel Labs, Santa Clara, CA', 'Texas A & M University, College Station, TX']",[]
https://nips.cc/virtual/2020/poster/18947,Fairness & Bias,A/B Testing in Dense Large-Scale Networks: Design and Inference,"Design of experiments and estimation of treatment effects in large-scale networks, in the presence of strong interference, is a challenging and important problem. Most existing methods' performance deteriorates as the density of the network increases. In this paper, we present a novel strategy for accurately estimating the causal effects of a class of treatments in a dense large-scale network. First, we design an approximate randomized controlled experiment by solving an optimization problem to allocate treatments in the presence of competition among neighboring nodes. Then we apply an importance sampling adjustment to correct for any leftover bias (from the approximation) in estimating average treatment effects. We provide theoretical guarantees, verify robustness in a simulation study, and validate the scalability and usefulness of our procedure in a real-world experiment on a large social network.",[],[],"['Preetam Nandy', 'Kinjal Basu', 'Shaunak Chatterjee', 'Ye Tu']","['LinkedIn Corporationm Mountain View, CA', 'LinkedIn Corporationm Mountain View, CA', 'LinkedIn Corporationm Mountain View, CA', 'LinkedIn Corporationm Mountain View, CA']",[]
https://nips.cc/virtual/2020/poster/18922,Fairness & Bias,"Demystifying Contrastive Self-Supervised Learning: Invariances, Augmentations and Dataset Biases","Self-supervised representation learning approaches have recently surpassed their supervised learning counterparts on downstream tasks like object detection and image classification. Somewhat mysteriously the recent gains in performance come from training instance classification models, treating each image and it's augmented versions as samples of a single class. In this work, we first present quantitative experiments to demystify these gains. We demonstrate that approaches  like MOCO and PIRL learn occlusion-invariant representations. However, they fail to capture viewpoint and category instance invariance which are crucial components for object recognition. Second, we demonstrate that these approaches obtain further gains from access to a clean object-centric training dataset like Imagenet. Finally, we propose an approach to leverage unstructured videos to learn representations that possess higher viewpoint invariance. Our results show that the learned representations outperform MOCOv2 trained on the same data in terms of invariances encoded and the performance on downstream image classification and semantic segmentation tasks.",[],[],"['Senthil Purushwalkam', 'Abhinav Gupta']","['Carnegie Mellon University', 'Carnegie Mellon University & Facebook AI Research']",[]
